,kmeans,nouns
7,10,library today woman penis canon computers
72,10,woman lives years
184,10,woman bus smoking heroin tinfoil..
255,10,'m fireman home help move woman co-worker cotton ass embalm use let
298,10,woman pregnant dead baby stone
345,10,sethi woman craigslist slap face time gets internet work productivity gone %
359,10,break wikileaks announce world press freedom day
370,10,world coolest behold octopus
386,10,woman year daughter acid attack ( sfw )
443,10,woman pizza place everyday past years days call pizza delivery woman check house turns fallen get telephone call help pizza deliver woman saves life
678,10,girl news world phone messages voice mailbox messages notw journalists messages evidence girl family
860,10,black man terrorizes woman niga means south korea
925,10,woman ground protests turkey
1054,10,woman cart
1181,10,woman death camel
1214,10,woman yoga 37weeks pregnant studio ( time reader time poster ! )
1244,10,drink world
1585,10,topless woman room puppy man turkey pie rocks floor
1634,10,man woman vagina
1665,10,woman child abbey denmark
1667,10,years was cut human contact unaware world war ii | imperfect
1708,10,woman china dynasty [ /r/pics ]
1737,10,woman child fire escape boston fire child woman
1902,10,alaska world problems
1941,10,woman train tracks
1986,10,woman demands husband perform cunnilingus ( sex ) knife point
1987,10,world bugs
2238,10,contestants world championship
2346,10,neighborhood fuck world
2361,10,woman surgeries become doll
2549,10,balls world
2634,10,woman gets pound tumor mouth
2734,10,woman entire uterus slips hernia
2757,10,world
2865,10,present world toshio sakei
2899,10,library today misfortune woman
2957,10,are wan na woman
3036,10,woman truck enters bar
3142,10,dog haters razor blades sausages â€” world worse ( neighbor )
3181,10,tallest building world
3211,10,woman movember contest mo area night moâ€_is
3226,10,woman years juicy
3331,10,question placement woman hand pixar
3524,10,woman birth g kids swim play
3550,10,mammatus clouds end world
3567,10,world golf course
3613,10,woman hips world feel super
3652,10,gem fashion world dementors style
3778,10,woman horn
3859,10,woman death starvation
3951,10,saw woman bart
4164,10,wonderful world
4520,10,im man world woman fail shirt
4655,10,woman time get cyst ureters failure
4806,10,woman kilo cocaine diaper
4826,10,woman encounter bear end warning death gore nsfl
4830,10,world ugliest frog
4875,10,woman tries escape prison fails
4945,10,saw woman conversation michael bart morning
5094,10,guy done woman seat times ( chicago )
5112,10,lion tibetan mastiff world dog million
5182,10,woman preterm miscarriage keeps brings home treats child
5263,10,giant statue pregnant woman
5399,10,fattest man world
5463,10,world mother months pregnant
5496,10,lois lane spends hours black woman
5786,10,generosity woman charts
5803,10,name frank louie guineas book world records longest condition known janus cat god janus
6068,10,woman blew thumb fireworks toe
6117,10,woman time
6272,10,creepy advertisement pakistani airlines advertisement shows world trade centre towers airliner buildings
6285,10,woman sleep upscale hotel lobby
6327,10,library care world
6385,10,see costco man raise costco woman !
6411,10,body scan vs healthy woman
6484,10,dog world tibetan mastiff
6509,10,cathie jung guiness record waist world cm ( inches )
6587,10,spain richest woman duchess alba [ marÃ_a del rosario cayetana alfonsa victoria eugenia francisca fitz-james stuart y silva ]
6995,10,woman crushes husband own head
7055,10,woman artwork world
7182,10,woman building apartment
7306,10,world
7349,10,games bill clinton gem tokyo year translates world war
7422,10,woman train home work matt hairband bottom
7476,10,endurance world record holder
7568,10,woman board dog toy inside zip-lock bag contents
7616,10,year joke lol school words lol jk woman message school terrorist threats
7677,10,vagina world tallest woman [ nsfw ]
7724,10,woman husband woods promise sex slit meet internet lover
7729,10,creepy paintings predicted real world events
