,kmeans,nouns
16,3,friend daughter work loader aliens
19,3,friend subject grandma lives
38,3,friend someone interests reykjavik
43,3,friend mine drug house safe get
56,3,letter friend icu term memory loss
60,3,allow boss facebook friend [ ]
138,3,friend rabbit cherry
148,3,welder friend bet fork bottle booze gift
201,3,friend mine picture cake woman thumb picture use friend pick clerks language fill blanks
225,3,friend drunken ebay purchase
397,3,crazy friends throw friend surprise stag party isle skye
448,3,lance cpl william kyle carpenter man front grenade afghanistan protect friend
547,3,friend met gentlemen gallatin field airport ( montana usa ) shirt
568,3,friend mine rock climber night shot ground cliff starfield background
607,3,friend nico weeks thing fun
626,3,friend mine leukemia wish meet cast psych royal treatment pictures
652,3,friend road trip days miles ( r/naturepics )
717,3,friend picture front protesters fit
739,3,friend fiancee meet sir richard branson
807,3,photo friend pole dance instructor studio !
840,3,friend christmas
865,3,friend japan
915,3,friend picture bee check things
998,3,friend fb magazine covers years apart content
1016,3,friend house backyard
1028,3,'m telecaster guitar body guys bass friend
1036,3,friend line vote hours someone line everyone
1040,3,friend accident morning okay stop questions
1138,3,friend naturalist amazon baby macaw come way days !
1172,3,friend dad makes watercolors look pictures
1175,3,friend mine caught everest shadow way summit
1184,3,friend mine works ship picture today
1194,3,friend time ( south africa ) hawaii today !
1213,3,friend monkey
1248,3,took photos today friend umbrella steel wool fire
1289,3,wooden toys friend makes hand parts move life version machine
1301,3,friend muppet likeness father christmas
1312,3,friend resume job
1319,3,friend mine tonights halloween party nailed
1326,3,guide books art student friend mine
1369,3,facebook friend teacher childlike wonder
1387,3,boy friend
1415,3,friend bald eagle
1462,3,friend likes draw whiteboard work
1514,3,friend lion work today brain surgery
1544,3,friend facebook kids china touch
1558,3,friend paycheck week mailbox morning
1565,3,friend leukemia days macklemore show burlington night friend get see mack visit
1578,3,friend uncle looks walter white
1590,3,friend likes pictures
1591,3,friend pumpkin facebook
1594,3,friend mine pilot picture cockpit
1598,3,friend turkey sent
1634,3,picture friend afghanistan
1636,3,friend met beyonce new orleans face
1638,3,friend setup
1643,3,friend thought picture
1647,3,friend picture
1696,3,picture friend game run league contrast victory pure defeat
1717,3,work bronze foundry friend bronze scrap pours
1721,3,friend job sent pray sanity
1735,3,friend son difference marker permanent marker today
1749,3,bumper hurricane sandy friend doomsday bumper [ album ]
1794,3,professor friend art art project
1795,3,friend husband iphone station
1798,3,made friend today
1839,3,friend mine car lot days
1854,3,saw spider golf course today friend feet [ ]
2011,3,friend castle ( )
2033,3,friend line half marathon boyfriend way broke spine months
2102,3,r/pics remember drunk girl house let crash friend doorstep today
2103,3,friend mine building bridge norway.. winter
2124,3,woolen socks friend present
2139,3,friend mom octopus pizza breadsticks ! ( /r/food )
2154,3,friend found rock said looks idaho
2204,3,friend halloween costume tonight
2206,3,spring friend grandma house barbecue entire family mormon t-shirt tattoos shit feel unwelcome letter months
2222,3,friend hr life wants nerve submit photos national geographic- reddit think
2245,3,friend book cover artwork assignment chose hobbit
2274,3,friend bag inside zip prevent theft idea richard branson happy
2279,3,friend mine jail house hallway apartment bedroom rooms jail cells
2286,3,friend mine picture middle strike result
2293,3,made friend mexico !
2302,3,thanks wish foundation friend cellist chance play someone
2382,3,friend jeep quebec night
2426,3,tortoise friend weekend
2438,3,friend baby owl owls think personality
2512,3,friend halloween costume
2575,3,friend man awsomest costume
2623,3,friend dogs
2749,3,friend party costume
2753,3,( picture sent mom friend ) bikers show boy moore attempt wbc thanks guys
2756,3,friend coffee maker dumpster morning
2766,3,friend artist spent months color pencil !
2772,3,friend minutes modest skills think
2779,3,friend whatever birthday cake sooooo roadkill
2785,3,saturday friend broke american record run olympians look pure excitement
2799,3,friend dollars silver coins floor joists basement
2874,3,friend picture dad child
2879,3,friend tornado standing front house
2883,3,friend afghanistan mail
2961,3,friend mine walk balloon tree feels
3029,3,friend bridal pictures horses
3060,3,friend awesome work mini metal bender
3168,3,facebook friend picture
3169,3,australia dress cricket friend effort today game sydney
3270,3,friend teacher student wash board class
3321,3,friend halloween costume half sweeney todd half mrs lovett
3376,3,photographer friend sunday ultimate pic
3405,3,friend makeup photoshopped miner ya
3412,3,'m dancer shoots friend photos come shot alongside counterpart
3423,3,friend tip restaurant work
3454,3,friend furniture results
3458,3,friend watercolor paint spare time think
3463,3,friend rescued
3470,3,friend breakfast muppets !
3500,3,friend facebook grandma great grandma concentration camp tattoos grotesque history ( oc )
3537,3,friend scratches portraits beer bottles reddit enjoy
3556,3,friend cameron master halloween
3559,3,friend illustrator get think talent
3604,3,lost wallet night asu concert major bummer gave home find ! thank friend owe drink !
3657,3,friend okinawa sharpie btw
3677,3,tell friend real pole time !
3679,3,friend yesterday yes police officer motorcycle
3716,3,friend acceptance letter today [ ]
3725,3,friend training
3762,3,friend picture forrest gump run
3812,3,dragons born art done friend
3820,3,went desert weekend friend drink beer eat brats cool picture
3874,3,friend guys see
3941,3,look friend sister grapes whole foods today
3943,3,friend semester school goal mind hotdog stand months setbacks tape hello man friend dogs !
3953,3,friend sister ( done )
3995,3,photoshoot etiquette friend beer whaddya think reddit
4007,3,asked friend borrow headphones grab desk drawer..
4032,3,friend pants look jabba hutt
4039,3,friend trader joe hand basket card curiosity
4052,3,friend chicken david bowie
4054,3,friend dad candles
4062,3,friend ironman suit
4065,3,friend iron man suit scratch
4069,3,friend panzer tank slippers
4083,3,friend pictures sunset facebook
4104,3,singapore pollution level deliberate forest fires indonesia friend refuses
4116,3,friend letter producers judge judy
4155,3,hell mom studio friend
4157,3,friend picture dubai
4176,3,struck friend area today
4183,3,friend standing glass floor
4208,3,friend tries photobomb panorama panorama makes god
4209,3,friend pink floyd fan
4243,3,friend world problems reddit
4365,3,friend way cooler
4388,3,friend mine dogs pound anything sit look happy
4412,3,father friend service cell radio equipment towers midwestern southern u.s
4483,3,friend dad seals navy everyday job
4495,3,friend submit picture babysitter
4507,3,friend spent hours magazines recreate work art
4514,3,friend trick tonight reason door
4536,3,friend sons bedroom wall
4548,3,friend nerd factory bag rejects enjoy bag diabetes
4618,3,friend mine lake caught gold
4639,3,night friend throw knife door.. result
4702,3,friend class james franco morning
4717,3,friend photograph proposal crater lake
4721,3,friend mine dinner bill murray happy meal
4800,3,moms friend loose change years
4841,3,friend family picture
4889,3,friend costume shop..
4902,3,friend mine likes birthday today å£6 spent
4919,3,friend facebook awesome post
4933,3,friend picture wife canoe
4975,3,friend facebook mother jacket
4987,3,friend family question sexuality
5041,3,friend kate upton ncaa
5080,3,friend cappuccino got..
5081,3,friend today money celebrate notes heater
5152,3,friend dad oil competition
5192,3,friend mine beach guy
5242,3,friend mine borrow apartment shoot girl home 'm mad standing counters ( semi nsfw )
5255,3,friend awesome cake sisters !
5274,3,friend makes tires
5297,3,friend van gogh halloween ( amsterdam ) !
5310,3,friend picture
5337,3,friend hatchet
5348,3,bit yesterday friend response
5362,3,friend heart nbd [ /r/science ]
5375,3,friend mine model green iguana process [ images ]
5458,3,friend people
5477,3,friend cactus puberty
5483,3,friend facebook africa
5520,3,friend underwater engagement hawaii
5522,3,friend view manila hours reminds gotham
5534,3,friend person met dad years share
5545,3,friend pet pig yoda forehead
5557,3,friend mine likes tattoos
5563,3,friend mine barbasol
5566,3,friend bass guitar
5569,3,friend driver do text
5670,3,friend hi world
5732,3,made friend whilst today ( info comments )
5756,3,friend broke camera picture
5772,3,friend salon work scissor hands
5798,3,friend ballpoint pen laughs think reddit
5804,3,today friend shot son space shuttle flew tucson
5817,3,casper ( overweight blind friend ) begun enjoy summer paw time
5822,3,friend drunk bet fit entire box straws mouth disappoint
5863,3,friend xmas gift fuck !
5871,3,friend son legoland reddit
5885,3,friend son kind cookies birthday star wars ! ! ! star wars cookies !
6000,3,friend sent night shift
6001,3,friend makes glass think
6012,3,friend redditor bioengineer tells
6020,3,friend gf way home school
6024,3,friend mirror broke waste opportunity ! pieces glass hand leg result
6035,3,friend gf costumes friends end
6068,3,friend ep cover decent
6078,3,friend seaweed wookie beach nice likeness !
6086,3,friend daytona
6102,3,friend picture weekend sent caption man am
6103,3,took picture friend cool surprise film
6105,3,priceless faces friend
6166,3,friend window book shop
6168,3,friend victoria falls dp fb
6198,3,friend mine denny server tear search money schoolers bill forever food get leave tip cover bills
6207,3,friend find
6220,3,friend cakes profession dr suess fans
6224,3,friend bow super yacht
6230,3,okay reddit post friend whose sacred geometry artwork exposure recognition
6300,3,friend hazel morning everyone birthday party
6306,3,friend carpenter spare time draws shows anyone think appreciate reddit
6322,3,coolest picture friend
6362,3,wheelchair-bound dystrophy set help friend poses ground pictures ( source link comments )
6402,3,crater lake friend alfred
6413,3,friend photoshop project
6480,3,redditors picture friend wants get variation !
6497,3,friend school halloween
6523,3,everyday school point talk janitor gift friend
6527,3,friend mine peace corps mongolia picture ( post )
6528,3,took picture godson friend aquarium think keeper
6545,3,good friend practice proposal lines ( ) wife clothes work
6603,3,friend 'm stone first time stone tell think !
6652,3,drugs friends meet friend buddy atlas
6661,3,friend kindergartners sandy hook tear jerker
6671,3,friend mine afghanistan share
6673,3,friend photoshop engagement photos bit
6703,3,friend father makes pocket knife sand paper models toys think deserves
6738,3,friend illustrator faces lincoln
6759,3,friend father womens bars
6778,3,friend ron swanson
6815,3,friend business card turns rubber band gun
6832,3,stranger friend bus
6850,3,friend draw eyebrows toddler..
6857,3,sooooo friend doppleganger subway night
6877,3,friend floorboards house
6881,3,get friend
6931,3,plane friend front yard night
6946,3,friend awesome uncle
6964,3,friend dad albino baby deer backyard today
6971,3,friend get
7006,3,friend sell mad family
7027,3,friend process pilots license picture sent motivation
7045,3,spy friend balcony smoking
7087,3,friend daughters stand building tenants ! rent watch learn bastards pay attention
7095,3,friend tub
7130,3,friend trail today waterfall bone discovery nsfw
7218,3,friend dealt tv cord [ crosspost ]
7223,3,friend dad works nabisco gets sent care packages
7242,3,lot portraits teenager friend kind things
7247,3,made friend gift
7252,3,friend house
7260,3,night friend secret basement show franz ferdinand
7325,3,brothers friend classy dude
7364,3,friend car done sharpie
7403,3,friend charity shop coathanger
7423,3,friend awesome rendition ronald mcdonald
7433,3,turtle way fence isaac show friend
7451,3,friend spray
7488,3,friend picture breath
7501,3,friend harry potter party beer
7509,3,friend warehouse
7517,3,friend cinnamon challenge
7562,3,friend bass band weekend
7563,3,friend yesterday [ hd video stills ]
7628,3,'m earn money college friend napoleon dynamite halloween costume
7629,3,took picture friend cool
7657,3,friend weeks sikh weekend mario came !
7660,3,adult friend mine
7704,3,friend makes balloon animals date
7736,3,very shy friend mine calculator art gets fun hobby lot guys think
7743,3,friend cover-up think job
7745,3,ai broke fix dads friend cell phone life case
7828,3,friend claims tree walk work today dated
7832,3,friend art class charcoal
7891,3,friend fibrosis lung transplant battle scar !
7916,3,friend lymphoma dead november wish christmas wish
7921,3,shaq town sxsw hookah bar friend works end result
7954,3,sister friend past years friday let share photos
7983,3,friend dumbledore today
7992,3,friend devin house bags groceries gesture
8003,3,friend meth pictures
8007,3,friend ethiopia )
8039,3,reddit meet friend sloth chewy
8047,3,see friend drunken ebay purchase raise mother sober auction purchase
8130,3,friend cake halloween party kind beast
8144,3,friend doctorate mate
8161,3,friend works yellowstone get pictures preview whats come guys
8214,3,friend sloth think reddit
8257,3,friend let california
8288,3,voted class friend daughters clay diorama bears
8314,3,friend sent morning jog
8328,3,bonfire night think ass portrait friend
8330,3,friend thailand
8364,3,friend son adventure time cakes
8419,3,friend finishes dash marathon place degrees below zero weather !
8457,3,friend hidden wall house idea
8480,3,friend walter white
8483,3,friend student teacher china grade class
8487,3,friend son batmobile
8519,3,friend portrait louis c.k cheetos
8544,3,lung transplants years fibrosis friend saturday pics mother
8585,3,friend water sunset
8593,3,friend door australia
8788,3,cancer treatment kills melanin meet hero friend captain white beard
8818,3,friend yoda fountain
8840,3,friend try cheesy pictures think !
8850,3,friend tip
8870,3,friend days death car crash waist
8913,3,friend work friend ( ) whose dad car work did disappoint
8928,3,friend mine life cancer grade year seat
8982,3,friend career talent insists hobby
9012,3,friend mine get cake business
9031,3,friend school cheerleader florida bastard
9074,3,friend nature shots
9082,3,friend graduation
9128,3,friend locker combination class everything locker narnia
9145,3,friend roommate art tape
9153,3,friend mine wings restaurant creation
9155,3,friend mine post come home vase nice people !
9171,3,kate upton met patients friend work today
9172,3,birthday cake chef friend makes charcuterie restaurant cake
9176,3,friend found windshield wiper today
9203,3,girl friend
9222,3,friend cali work threw away party
9273,3,friend lives bastard
9289,3,school justice class get gentlemen club shut objectifies women friend dancer
9333,3,friend snake sweater lt
9361,3,friend mine wizards !
9397,3,friend origami peacock pieces paper
9405,3,friend car freeway
9412,3,friend
9437,3,friend dad look bryan cranston reddit think baby
9518,3,friend laser company freak buddy city
9526,3,friend mine horror makeup guys think 'm surprise support [ ]
9552,3,bangs time life look pocahontas friend
9561,3,friend paste bill murray party photos 'm result
9598,3,friend american dad grand canyon america act tourist assumes lazy american
9611,3,friend wear rest life fiancÌ© weeks
9627,3,basketball game fb mins friend wall
9658,3,friend stall moments think use
9683,3,friend harry dress prom kids
9686,3,friend ( ) rainbow cake !
9687,3,friend amp factors business reality
9757,3,friend mine school dance troop pics nyc
9759,3,friend picture date
9760,3,friend works yard anniversary lamborghini aventador lp
9786,3,reason hate bank america friend pizza order branch manager
9793,3,friend mine wall new years party
9868,3,friend years
9884,3,friend replaces phones pop tarts people selfies
9894,3,friend husband transport remains neil armstrong washington dc aboard air force
9928,3,friend friend airport
9942,3,friend gets point borderline genius
9989,3,friend food party think
10111,3,friend picture morning vacation yemen show matter kids find way get marker face
10145,3,friend carbon fiber storm trooper helmet
10203,3,niece heart surgery may friend
10267,3,grumpy friend whole foods
10339,3,friend mom cancer years wake house bathroom
10391,3,friend fence picture phone image
10410,3,friend leg landmine afghanistan today person backflip monoski
10413,3,girl friend mine costume day months highlights:
10427,3,friend bit crazy..
10431,3,friend hummingbird nest yard
10500,3,friend twenty years flew town weekend marry wife
10504,3,painted friend mine wave parents voices love
10575,3,friend vet run
10579,3,friend photoshop picture martin luther jr specify pictures
10587,3,friend depression pictures cope save couple
10644,3,friend girlfriend cheating
10712,3,friend met man
10748,3,friend mine boyfriend vacation suitcase
10751,3,friend university study session
10801,3,drunk years friend impact sent mail today
10835,3,friend model result
10839,3,went smoke friend container
10864,3,years sober bachelors degree program lbs jobs house friend man get sober 'm today
10875,3,evil lampshade friend house
10889,3,friend met actor today
10901,3,friend [ idap ]
10974,3,reddit friend ryan halo suit get credit share
10983,3,friend air force builds bombs
11015,3,friend rate sunglasses something seems bit
11041,3,friend london rain today
11091,3,friend map bread shape states chewnited states
11093,3,piece ice railing friend work
11120,3,friend bottle vodka russia
11126,3,friend taser sword remade sword
11139,3,friend gay stars wars theme band look awesome
11181,3,friend inside barn
11225,3,friend shot grandpa today worth
11244,3,friend tube station today
11319,3,friend watches worn moon
11345,3,friend kinder garden-kids skatepark tooday
11397,3,friend today
11426,3,storage trailer pup father friend
11460,3,friend yesterday !
11485,3,friend transformation lbs ! proud
11507,3,lost dear friend hours years pregnant cancer gave birth years till today
11523,3,friend met merry ( lotr ) miami international airport
11544,3,penny friend tells win internet picture
11606,3,friend penny floor apt pennies heads wheat pennies adventure
11663,3,friend wants quit photography think hes awesome.i want encourage feedback ! think reddit
11667,3,hello 'm friend photographs details comments photographs mine selfie
11710,3,friend likes hide guys car
11780,3,friend afghanistan boy today shows media citizens
11796,3,friend artist internet picture think
11809,3,friend beard
11823,3,friend work dad shows effort son halloween costumes
11834,3,friend photoshop girlfriend pinup wanted reddit opinion
11893,3,friend draw
12057,3,friend inappropriate places history [ ]
12072,3,find friend lapdog
12136,3,friend karma dads footsteps years
12176,3,friend friend khaleesi
12181,3,friend years today sleep miss buddy
12183,3,get karma bath friend
12185,3,friend art result minute work
12195,3,friend duct tape school
12246,3,friend broke iphone minutes pack highlighters later..
12264,3,good people things friend wife boys mother time christmas til marine friend call marines penn boys gifts christmas
12269,3,friend photography project disorders
12276,3,feline friend today picture rip hobbes
12283,3,work friend
12300,3,nyc girlfriend friend album life wheel
12315,3,friend met hunter airport
12318,3,friend dug baylor class '66 st louis garden initials inside read wfs can help owner
12324,3,friend paintings artists look kind art think
12335,3,friend met someone set skills
12342,3,friend run home
12347,3,friend submit seafood place afternoon
12421,3,friend facebook met magnificent men time
12477,3,friend nyc ron pearlman
12493,3,friend super hygiene epic brush time
12502,3,friend france heart attack france
12523,3,awesome friend
12543,3,friend kinda misses
12690,3,facebook friend vacation japan picture sort deer
12771,3,friend ( ) lymphoma heads support ( pics )
12795,3,friend set spiderman movie new york
12855,3,robin williams friend
12920,3,friend mom guests
12922,3,friend arnold schwarzenegger front muscle
12947,3,want friend help this..
12966,3,friend mine ( ) walter white
12983,3,friend mine appraiser fb
12997,3,friend finals week
13002,3,friend today luck
13013,3,art teacher friend draw
13025,3,busty friend dress think karma
13095,3,friend walk
13122,3,friend mine works glass thinks sucks disagree
13139,3,friend facebook gave chills
13147,3,friend moment silence
13178,3,friend new subaru brz
13199,3,reddit years friend years tonight am
13223,3,think friend looks matt damon
13267,3,portrait friend
13272,3,friend beauty alley
13311,3,friend years today masters 'm way time flies !
13324,3,marine friend japan facebook
13345,3,friend youth group
13414,3,friend walk
13416,3,friend ballpoint pen
13422,3,friend bartender found tonight
13432,3,squeezy water bottle vegeta friend mine
13454,3,friend athens greece hole wall acropolis
13467,3,friend mine collects antiquities wall letter things bit
13545,3,friend middle outback sent picture 'm miss
13550,3,yesterday friend look rings
13571,3,friend submit think !
13608,3,friend father years friend spends majority time spot
13609,3,friend comes family xbox life buddies tickets dave buster get xbox
13677,3,friend people met artist
13678,3,friend years today think world see face thank star
13744,3,friend dead fairy !
13758,3,friend jack box today stranger food letter
13763,3,friend snake
13766,3,friend nap watch afghanistan
13778,3,found friend work yesterday
13805,3,friend tattoo think women look jesus muscles
13825,3,friend tree son today inside
13856,3,friend house today expiration date
13860,3,friend run today seems legit
13898,3,morning view friend farm narrows va
13918,3,hi library friend
13943,3,friend victim run good thing violator nice leave license plate information !
13960,3,friend hung sky way bricks
13978,3,friend mine get
13999,3,learned lot friend salt
14027,3,friend ben stein kind hook eyes !
14052,3,friend peru crisis pure joy !
14074,3,friend dubai refuses wear anything
14111,3,college friend sick art facebook think
14157,3,couple years friend ww2 bunker bus shelter london ( uk ) sisters anything
14194,3,years thing reddit friend
14230,3,friend makes leather head dresses shoot
14237,3,friend sent 5mins approach tips
14249,3,friend picture giraffe pittsburg thought
14251,3,friend egypt crazy awesome object middle desert meteorite
14277,3,friend years point siamese today raise glass ! cheers !
14361,3,friend wallet bonnaroo mail today
14391,3,anytime friend leave life may rest peace sam
14424,3,friend musket night
14466,3,zelda cross stitch friend months
14475,3,friend mine drives stop get gas
14484,3,friend wait install video card
14496,3,friend tricks notice
14548,3,friend friends entire lives moms picture frame preschool graduation school graduation
14574,3,friend buy tights safety purpose
14702,3,friend oklahoma tornado month
14788,3,friend thinks cool reddit stop enjoy creepy house dreams )
14864,3,firefighter friend saddest thing job saddest thing show
14865,3,friend park
14871,3,friend shop order
14876,3,friend sent whole life..
14891,3,friend picture shadow horses legs ( xpost )
14916,3,friend met someone awesome
14961,3,friend picture hernandez
14979,3,friend room cool
15037,3,matilda actress mara wilson puberty friend
15070,3,friend friend boston marathon pics taken line
15073,3,gets front page friend meet gf parents
15094,3,drew facebooks graffiti app friend mine enjoy masterpiece spongebob dickface
15103,3,friend
15114,3,friend view [ trolltunga norway ]
15150,3,lol ! 'm friend upvote sees ! ! ! !
15168,3,friend halloween costume !
15218,3,friend park ranger cops
