,kmeans,nouns
68,2, maid dubai tries kill employers pay months woman suicide
182,2, samoa air becomes airline introduce pay weigh aifares meaninig overweight passengers pay
226,2, there’s country pay rhino horn cure cancer hangovers it’s rhinos
328,2, catholic church pay property tax year
340,2, teacher career cyber-stalker jail pay damages schools want hire teacher
402,2, police officers owner auto-parts business complaint officers pay bribe death inside home juarez testify
594,2, airline tax passengers pay
681,2, chevron pay environment damages
776,2, dad pay child support kids court rules | canada
889,2, secret unit rupert murdoch news corp wave piracy competition pay tv market ramifications
1005,2, scale tax outstrips deficit elite pay matter justice necessity
1055,2, president francois hollande campaign pledge wealthiest france pay percent income tax
1134,2, police stun batons end protest pay workers nike factory cambodia
1359,2, woman transplant rare condition kidneys operation government pay drug needs prevent organ
1466,2, holocaust city amsterdam jews concentration camps failure pay taxes
1617,2, switzerland two-thirds voters initiative” – referendum gives shareholders executive pay part world’s stringent rule kind date noncompliance carries fines jail time
1736,2, women stole husbands sperm pregnant use ivf pay compensation
1833,2, wikileaks iceland supreme court rules visa contractor valitor pay month continues block
1834,2, women harassment '99.3 % women form harassment men pay penalties women violent manner
1910,2, brazil poor pay world cup penalty inside stadium president dilma roussef match
1986,2, google eric schmidt change law pay tax system changes tax laws taxes pay pay decision democracy uk
2174,2, forced pay tirade words patron appeal denied
2259,2, pay ’ residents angry rcmp sieze guns river homes
