,kmeans,nouns
117,2,til school student airplane struck kilometers ground endure day walk nearest civilzation
188,2,til new zealand bans advertising tv christmas easter good friday anzac day
220,2,til girl africa attackers half day lions
239,2,til guinness wwii pint christmas day pay half wages family war job expenses vacations childrens education scholarships wages % breweries ( see link )
317,2,til day section hospital ottawa canada territory princess born citizen ( requirement princess ) year netherlands sends canada gift tulips show gratitude
375,2,til pow charlie inspectors conditions ss kill anyway save men roll call day
501,2,til rms empress ireland emmy voyage may emmy aboard ship sunk day
502,2,til warner music group day ( million year ) royalties usage happy birthday known charge usage film restaurants birthday songs visit
507,2,til napoleons day stay malta administration twelve municipalities finance administration feudal privileges slavery family code twelve judges education
528,2,til earth rotation rate milliseconds century length day dinosaurs hours
559,2,til buddhists see movie groundhog day representation religion
606,2,til submarine crews use day submarine day lasts hours
609,2,til parents ferris buellers day met onset
713,2,til space shuttle flew year day eve computers handle year rollover
719,2,til day arnold palmer hole film hole record
725,2,til mother day honor mothers woman mother day become
728,2," til terry fox year cancer patient 3,339miles canada days equivalent marathon day youngest person companion order canada"
756,2,til today march afghanistan day ronald reagan watch afghan freedom fighters battle arsenals simple weapons inspiration freedom
823,2,til stones drummer charlie watts day mick jagger drunk watts hotel room drummer watts suited-up jagger room do call drummer singer !
824,2,til psychiatrist dr ewen cameron wipe woman memory electroshocks hallucinogens day period..
839,2,til prisoner job prison mail bags inside prison day railway line let police officer
854,2,til einstein surgery want want tasteless life done share time day
863,2,til day bbc news piano music
865,2,til period years ships location coast wales day ( december ) survivor survivors name williams
885,2,til amendment sent truckload winner beer president franklin d roosevelt appreciation day amendment — beer weeks age
1014,2,til japan something happy monday system aims place state holidays mondays order work week day weekends
1016,2,til president roosevelt letters cavalrymen ride miles day training response teddy rode horseback miles sunrise sunset years
1023,2,til chris gay day houdini custody times crystal gayles bus whilst run
1159,2,til mark twain born visit halley comet visit freaks day halley comet
1175,2,til april fool day prank taco bell corporation full-page ad newspapers liberty bell taco liberty bell national historic park philadelphia hundreds calls
1194,2,til ron perlman make-up hellboy ( process ) fulfill child request spent whole day child
1244,2,til girl front cover vampire weekend album artwork use year band daughter home copy album day
1303,2,til charlie sheen buy tickets major league baseball game anaheim stadium catch home run ball sheen friends rows home runs day
1430,2,til betelgeus star light years supernova moment outshine moon night day
1440,2,til oxford england dispute students pub landlord quality pints day riot scholars locals dead
1545,2,til jackie kennedy pink chanel suit rest day jfk assassination change outfit want see done jack
1624,2,til day keith richards pirates caribbean world end drunk film director prop order shoot scene
1731,2,til cancer death warren zevon want see james bond movie goal see die day
1775,2,til president lincoln secret service day
1809,2,til man planes day job
1853,2,til charlie sheen days sobriety nicolas cage house day
1880,2,til movie director life prison movie people actors court film remains countries day
1907,2,til michael cameron student greenbrier school ( ) pepsi shirt coke day
1943,2,til thing black day ( april ) south korea people anything equivalent valentine day eat black noodles mourn
1995,2,til arnold schwarzenegger awol competition caught post superiors hours day work rest time service
2005,2,til albert einstein tongue end birthday celebration persuade camera time photographers times day einstein stuck tongue
2037,2,til term genocide describe mass armenians day turkey million people heritage history
2054,2,til james huberty health center help state emergency call day mcdonald san ysidro
2064,2,til day london transportation thousands people circle line ride circle hours
2102,2,til astronauts aboard international space station see sunrises sunsets day minutes
2111,2,til base rogue dj fortress principality sealand flag prince wife princess sealand withstood court challenges remains independent nation day
2114,2,til venus day venus year
2154,2,til williams survivor wrecks wrecks day
2220,2,til father day ( tomorrow ) day collect calls
2239,2,til surprise visit hospital fan coma times geri halliwell ( ginger spice ) sang girl arms legs day woke
2240,2,til people building dam father son death years day apart
2249,2,til florida law toddlers schools music day governor georgia year child born georgia tape cd music
2267,2,til nazi salute day germany yrs prison
2304,2,til pixar animators toy story workload chose work hours pixar animators tunnel syndrome forgot baby backseat car day
2305,2,til authors building eiffel tower times guy maupassant lunch day bottom place paris see structure
2322,2,til twin brothers sex women day child paternity tests father uncle child identify father unknown
2323,2,til scientist linnaeus clock times openings closings species flowers garden tell time day garden !
2381,2,til viggo mortensen eastern promises fake tattoos day dinner restaurant actor people tattoos silent member mafia
2390,2,til mark hamill car accident trauma day star wars explanation empire strikes back wampa continue trilogy
2423,2,til reason breakfast day mcdonald grill temperature cook beef patties temperature eggs
2439,2,til hikers days gear man year day matches pack light fire
2442,2,til correct response o morning ya rest day
2461,2,til einstein born pi day
2583,2,til national grid prepare times day everyone puts kettle tea
2699,2,til judge judy makes money celebrity lebron james day amounts million year
2771,2,til translation error years women buy men chocolate japan valentines day practice persists today
2782,2,til may national masturbation month may national masturbation day
2783,2,til bill murray garfield script coen brothers ( fargo country old men ) joel cohen man daddy day camp
2980,2,til buddhists see big lewbowski dude day zen master
3019,2,til blue whale calves born tons gain lbs grow inches day ! father nuts size midsize car..
3062,2,til mr rogers day pounds years life beauty number letter word letters word letters word
3070,2,til nasa scientists way warp day lead light space travel
3080,2,til oil boost metabolism calories day
3084,2,til mira star universe matter bit day grow star nasa johnny appleseed universe
3104,2,til evan mecham arizona governor mlk jr day act office group black community leaders folks holiday folks jobs
3156,2,til government australia spent billion seawater desalination plant plant standby mode million day produce water
3203,2,til steven russell texas jail times hostages weapon years escapes ( years ) confinement hours day
3257,2,til wednesdays day week suicides
3264,2,til team america trey parker matt stone puppet parody day tomorrow
3305,2,til kim child malnutrition parents spent hours day child online game prius online
3410,2,til dr donald unger knuckles hand day years hands ig nobel prize medicine parody award
3451,2,til people building dam guy place build dam guy son construction years day
3454,2,til babies born monday tuesday day doctors c-sections weekend
3462,2,til gmail april service april fools day joke !
3486,2,til war graves soldiers day wwi november ensure war pensions people armistice
3490,2,til vatican carbon offsets enitre papal city day vatican forest
3648,2,til act habeas corpus votes lords lords worth votes joke remains statute books day
3675,2,til day june years cheyenne women awls dead george armstrong custer ears afterlife promise chief stone forehead fight americans
3687,2,til ginkgo tree hardy variety blast hiroshima exist day
3830,2,til supernova arab observers star zeta tauri months day remnants form crab nebula
3837,2,til men work half women day
3866,2,til village peru settles grudges christmas day start year slate
3871,2,til nyc head d.a oversaw conviction year-olds confessions intimidation tactics culprit day d.a refuses apologize men multi millionaire author expertise
3872,2,til thirds employees cantor fitzgerald relief fund % dollar victims disasters million year fund donates % day revenue charity million tragedy
3898,2,til pandas poop pounds day
3941,2,til year nasa computers day shutdown computers pentagon
3950,2,til buddy hollys wife hearing news husbands death miscarriage day authorities adopt policy months release victim names till families
4017,2,til ben sliney scatana order planes airspace day job time history order
4044,2,til tennis players rally remains longest tennis history day
4061,2,til million years koala species times size present day koala
4071,2,til norman invasion england noblemen flee england byzantine empire ( modern day turkey greece ) diaspora town new york years new york america
4174,2,today learned niagara falls silent day water hours night falls erie silent sudden
4183,2,til nicholas cage style known nouveau shamanic plans day book method
4212,2,til exception proves rule misunderstood phrase example sundays sign 'proves park day
4289,2,til ups fedex delivery companies tickets day nyc million year city budget
4320,2,til slayer album god hates september inspiration idea day life car dog dies feel hates today
4348,2,til girl sea round trip voyage england father girl man sea father cask rum captain girl inside remains day
4431,2,til year nickelodeon shuts tv channels hours worldwide day play
4438,2,til response phrase top morning rest day !
4442,2,til moscow russia stray dogs ride subways schedule day
4459,2,til women topless new york day everyday
4468,2,til april fool day prank sports illustrated ny mets fan base team sidd finch phenom throw ball mph art pitch tibetan monastery lama milaraspa
4471,2,til heart pumps gallons blood day blood body minute
4511,2,til university norway day students mandatory course includes shoot bear
4516,2,til babies dream day ( birth )
4528,2,til ambassador afghanistan militants police valentine day
4697,2,til years day pilot kenneth arnold shiny disks mt rainier washington term saucer
4845,2,til coke makes beverages drank day years try
4847,2,til johnny knoxville uses catheter twice day jackass penis injuries
4882,2,til official father day gaaaaaayyyyyy
4886,2,til john kennedy barry goldwater friends travel campaign town day spoke plan jfk death
4892,2,til lisa sparks world record holder sex partners day sex men october warsaw poland
4893,2,til president truman theatre daughter singer review president truman day hope meet happens nose lot beefsteak black eyes supporter !
