,Unnamed: 0,domain,banned_by,subreddit,selftext_html,selftext,likes,link_flair_text,id,clicked,title,media,score,approved_by,over_18,hidden,thumbnail,subreddit_id,edited,link_flair_css_class,author_flair_css_class,downs,saved,is_self,permalink,name,created,url,author_flair_text,author,created_utc,ups,num_comments,num_reports,distinguished,_id,__v
2745,2745,wrcbtv.com,,politics,,,,,18usv0,False,Obama wants to retire the penny.,,3388,,False,False,,t5_2cneq,False,,,17322,False,False,/r/politics/comments/18usv0/obama_wants_to_retire_the_penny/,t3_18usv0,1361322332,http://www.wrcbtv.com/story/21252200/obama-wants-to-retire-the-penny-but-can-it-be-done,,sirms,1361322332,20710,3158,,,ObjectID(51cd3fca607d46e3990006d2),0
2751,2751,huffingtonpost.com,,politics,,,,,1equqr,False,"Both Senators From Oklahoma Votes Against Federal Disaster Relief For Hurricane Sandy, Now Face Difficult Questions Regarding Tornado Relief",,3383,,False,False,,t5_2cneq,False,,,10268,False,False,/r/politics/comments/1equqr/both_senators_from_oklahoma_votes_against_federal/,t3_1equqr,1369114475,http://www.huffingtonpost.com/2013/05/20/oklahoma-senators-disaster-relief_n_3309234.html?icid=hp_front_top_art,,sheepsleepdeep,1369110875,13651,2525,,,ObjectID(51cd3fca607d46e3990006d8),0
2757,2757,chron.com,,politics,,,,,13az75,False,"Republican U.S. Rep. Scott DesJarlais, who opposes abortion rights, mutually agreed with wife to abort not once but twice.",,3385,,False,False,,t5_2cneq,False,,,8300,False,False,/r/politics/comments/13az75/republican_us_rep_scott_desjarlais_who_opposes/,t3_13az75,1353084039,http://www.chron.com/news/politics/article/Tenn-GOP-congressman-s-ex-wife-had-2-abortions-4040986.php,,jccodez,1353084039,11685,1070,,,ObjectID(51cd3fca607d46e3990006de),0
2786,2786,zdnet.com,,politics,,,,,1fusqv,False,"US gov defends NSA surveillance, slams 'reprehensible' journalists for exposing it",,3381,,False,False,,t5_2cneq,False,,,4400,False,False,/r/politics/comments/1fusqv/us_gov_defends_nsa_surveillance_slams/,t3_1fusqv,1370607104,http://www.zdnet.com/us-gov-defends-nsa-surveillance-slams-reprehensible-journalists-7000016529/,,mom0nga,1370603504,7781,1319,,,ObjectID(51cd3fca607d46e3990006fb),0
2824,2824,motherjones.com,,politics,,,,,14qt3z,False,"""Loud-Ass TV Ads Are About to Be Outlawed - Beginning at midnight tonight, new Federal Communications Commission rules will bar television networks from blasting viewers with those excessively loud, screamy commercial breaks.""",,3370,,False,False,,t5_2cneq,False,,,8321,False,False,/r/politics/comments/14qt3z/loudass_tv_ads_are_about_to_be_outlawed_beginning/,t3_14qt3z,1355345315,http://www.motherjones.com/mojo/2012/12/loud-tv-commercials-outlawed-fcc-rules,,kimat-qn-gurruod,1355345315,11691,1280,,,ObjectID(51cd3fcf607d46e399000721),0
2826,2826,commondreams.org,,politics,,,,,12idgr,False,"In an astounding, little-reported act of hubris, Senate Republicans apparently killed a study by the non-partisan Congressional Research Service when its findings contradicted their favorite economic myth: that giving tax cuts to the rich helps anyone but themselves. ",,3365,,False,False,,t5_2cneq,False,,,16116,False,False,/r/politics/comments/12idgr/in_an_astounding_littlereported_act_of_hubris/,t3_12idgr,1351861064,http://www.commondreams.org/further/2012/11/01-4,,alllie,1351857464,19481,1027,,,ObjectID(51cd3fcf607d46e399000723),0
2829,2829,politico.com,,politics,,,,,14sodb,False,"Arnold Schwarzenegger: “I always tell my accountant, If you’re in doubt about taxes, pay more. No Cayman Island offshore investments. No gimmicks. I love paying my taxes!”",,3367,,False,False,,t5_2cneq,False,,,13362,False,False,/r/politics/comments/14sodb/arnold_schwarzenegger_i_always_tell_my_accountant/,t3_14sodb,1355422993,http://www.politico.com/story/2012/12/arnold-i-love-paying-my-taxes-85031.html,,NashMcCabe,1355422993,16729,2159,,,ObjectID(51cd3fcf607d46e399000726),0
2833,2833,bostonherald.com,,politics,,,,,19uotl,False,Six Boston cops fired after testing positive for cocaine have been ordered reinstated — with back pay ,,3364,,False,False,,t5_2cneq,False,,,11714,False,False,/r/politics/comments/19uotl/six_boston_cops_fired_after_testing_positive_for/,t3_19uotl,1362674571,http://bostonherald.com/news_opinion/local_coverage/2013/03/cops_firing_for_drugs_reversed,,spedmunki,1362674571,15078,1915,,,ObjectID(51cd3fcf607d46e39900072a),0
2834,2834,bloomberg.com,,politics,,,,,18ybfj,False,"What if we told you that, by our calculations, the largest U.S. banks aren’t really profitable at all? What if the billions of dollars they allegedly earn for their shareholders were almost entirely a gift from U.S. taxpayers? – Bloomberg Editors",,3373,,False,False,,t5_2cneq,False,,,6250,False,False,/r/politics/comments/18ybfj/what_if_we_told_you_that_by_our_calculations_the/,t3_18ybfj,1361454406,http://www.bloomberg.com/news/2013-02-20/why-should-taxpayers-give-big-banks-83-billion-a-year-.html,,stylemaven1,1361454406,9623,919,,,ObjectID(51cd3fcf607d46e39900072b),0
2849,2849,msnbc.msn.com,,politics,,,,,7488a,False,Bailout does NOT pass vote. 206 Yea - 227 Nay. Dow tumbles.,,3364,,False,False,,t5_2cneq,False,,,302,False,False,/r/politics/comments/7488a/bailout_does_not_pass_vote_206_yea_227_nay_dow/,t3_7488a,1222714701,http://www.msnbc.msn.com/id/26884523/?,,IM_A_REPTILIAN,1222711101,3666,1362,,,ObjectID(51cd3fcf607d46e39900073a),0
2856,2856,politicususa.com,,politics,,,,,129s36,False,As the Frankenstorm Arrives Romney/ Ryan Go Silent on Their Plan to Cut FEMA and Disaster Relief,,3363,,False,False,,t5_2cneq,False,,,18133,False,False,/r/politics/comments/129s36/as_the_frankenstorm_arrives_romney_ryan_go_silent/,t3_129s36,1351516643,http://www.politicususa.com/frankenstorm-arrives-romney-ryan-silent-plan-cut-fema-disaster-relief.html,,tradexl,1351513043,21496,1888,,,ObjectID(51cd3fcf607d46e399000741),0
2857,2857,aclu.org,,politics,,,,,7b7rz,False,"Know your voting rights: STAY IN THE LINE! If you're in line when the polls close, they have to let you vote.",,3362,,False,False,,t5_2cneq,False,,,402,False,False,/r/politics/comments/7b7rz/know_your_voting_rights_stay_in_the_line_if_youre/,t3_7b7rz,1225796753,http://www.aclu.org/vec/,,mom-bot,1225796753,3764,347,,,ObjectID(51cd3fcf607d46e399000742),0
2862,2862,nymag.com,,politics,,,,,1ad5ak,False,Anti-weed NY assemblyman Steve Katz charged with possession,,3360,,False,False,,t5_2cneq,False,,,10178,False,False,/r/politics/comments/1ad5ak/antiweed_ny_assemblyman_steve_katz_charged_with/,t3_1ad5ak,1363377022,http://nymag.com/daily/intelligencer/2013/03/steve-katz-assemblyman-charged-with-marijuana-possession.html,,marji80,1363373422,13538,945,,,ObjectID(51cd3fcf607d46e399000747),0
2888,2888,mediamatters.org,,politics,,,,,17lciv,False,"Colin Powell to Bill O'Reilly: I want to see a Republican Party that, rather than trying to make it more difficult to vote and restricting the number of days and hours you can vote, a Republican Party that says we want everybody to vote and we're going to give you a reason to vote for us.",,3359,,False,False,,t5_2cneq,False,,,10963,False,False,/r/politics/comments/17lciv/colin_powell_to_bill_oreilly_i_want_to_see_a/,t3_17lciv,1359588334,http://mediamatters.org/blog,,ZeOppositeOfProgress,1359588334,14322,1510,,,ObjectID(51cd3fcf607d46e399000761),0
2901,2901,emptywheel.net,,politics,,,,,14y0sr,False,Democratic and Republican Agreement: Prosecute HSBC,,3350,,False,False,,t5_2cneq,False,,,3501,False,False,/r/politics/comments/14y0sr/democratic_and_republican_agreement_prosecute_hsbc/,t3_14y0sr,1355674438,http://www.emptywheel.net/2012/12/14/democratic-and-republican-agreement-prosecute-hsbc/,,archtype,1355674438,6851,709,,,ObjectID(51cd3fd4607d46e39900076e),0
2914,2914,boldprogressives.org,,politics,,,,,12rrvb,False,Tammy Baldwin Has Been Elected The First Openly-Gay Senator In U.S. History ,,3353,,False,False,,t5_2cneq,False,,,6021,False,False,/r/politics/comments/12rrvb/tammy_baldwin_has_been_elected_the_first/,t3_12rrvb,1352258810,http://boldprogressives.org/breaking-tammy-baldwin-has-been-elected-the-first-openly-gay-senator-in-u-s-history/,,terran1212,1352258810,9374,367,,,ObjectID(51cd3fd4607d46e39900077b),0
2924,2924,dailymail.co.uk,,politics,,,,,1gnf2b,False,'Tell your boss I owe him another friggin' beer:' Hot mic catches NSA boss praising FBI chiefs for supportive testimony on surveillance programs.,,3348,,False,False,,t5_2cneq,False,,,12977,False,False,/r/politics/comments/1gnf2b/tell_your_boss_i_owe_him_another_friggin_beer_hot/,t3_1gnf2b,1371672253,http://www.dailymail.co.uk/news/article-2344098/NSA-hearing-Hot-mic-catches-NSA-boss-praising-FBI-chiefs-supportive-testimony-surveillance-programs.html,,PaxiSnack,1371643453,16325,1250,,,ObjectID(51cd3fd4607d46e399000785),0
2926,2926,salon.com,,politics,,,,,1b57y2,False,High school teacher under investigation for saying “vagina” during anatomy lesson.,,3340,,False,False,,t5_2cneq,False,,,15621,False,False,/r/politics/comments/1b57y2/high_school_teacher_under_investigation_for/,t3_1b57y2,1364432337,http://www.salon.com/2013/03/27/high_school_teacher_under_investigation_for_saying_vagina_during_anatomy_lesson/#.UVOHsbGZxMQ.reddit,,GonzoVeritas,1364428737,18961,3474,,,ObjectID(51cd3fd4607d46e399000787),0
2927,2927,nytimes.com,,politics,,,,,18otp1,False,"Don’t Blink, or You’ll Miss Another Bailout--The NY Fed ""released Bank of America from all legal claims arising from losses in some mortgage-backed securities the Fed received.""",,3348,,False,False,,t5_2cneq,False,,,8328,False,False,/r/politics/comments/18otp1/dont_blink_or_youll_miss_another_bailoutthe_ny/,t3_18otp1,1361103905,http://www.nytimes.com/2013/02/17/business/dont-blink-or-youll-miss-another-bank-bailout.html?smid=tw-share&amp;_r=0,,rspix000,1361103905,11676,1287,,,ObjectID(51cd3fd4607d46e399000788),0
2940,2940,video.pbs.org,,politics,,,,,1f65xf,False,"FRONTLINE ""The Untouchables"" examines why no Wall St. execs have faced fraud charges for the financial crisis.","{ ""oembed"" : { ""thumbnail_height"" : 212, ""thumbnail_url"" : ""http://pbs.merlin.cdn.prod.s3.amazonaws.com/Video%20Asset/pbs/frontline/67875/images/530183_COVEStackCard_20130122133909.jpg.resize.380x212.jpg"", ""provider_name"" : ""PBS"", ""version"" : ""1.0"", ""html"" : ""&lt;object width=\""512\"" height=\""328\""&gt;&lt;param name=\""movie\"" value=\""http://www-tc.pbs.org/video/media/swf/PBSPlayer.swf\""&gt;&lt;/param&gt;&lt;param name=\""flashvars\"" value=\""video=2327953844&amp;player=viral\""&gt;&lt;/param&gt;&lt;param name=\""allowFullScreen\"" value=\""true\""&gt;&lt;/param&gt;&lt;param name=\""allowscriptaccess\"" value=\""always\""&gt;&lt;/param&gt;&lt;param name=\""wmode\"" value=\""transparent\""&gt;&lt;/param&gt;&lt;embed src=\""http://www-tc.pbs.org/video/media/swf/PBSPlayer.swf\"" flashvars=\""video=2327953844&amp;player=viral\"" type=\""application/x-shockwave-flash\"" allowscriptaccess=\""always\"" wmode=\""transparent\"" allowfullscreen=\""true\"" width=\""512\"" height=\""328\"" bgcolor=\""#000000\""&gt;&lt;/embed&gt;&lt;/object&gt;"", ""width"" : 512, ""height"" : 328, ""thumbnail_width"" : 318, ""type"" : ""video"", ""title"" : ""Watch now: The Untouchables | FRONTLINE | PBS Video"", ""description"" : ""FRONTLINE investigates why Wall Street's leaders have escaped prosecution for any fraud related to the sale of bad mortgages. Watch online: The Untouchables from FRONTLINE. On demand, streaming video from PBS"", ""provider_url"" : ""http://video.pbs.org"" }, ""type"" : ""video.pbs.org"" }",3337,,False,False,,t5_2cneq,False,,,5312,False,False,/r/politics/comments/1f65xf/frontline_the_untouchables_examines_why_no_wall/,t3_1f65xf,1369706846,http://video.pbs.org/video/2327953844/,,Tememachine,1369703246,8649,777,,,ObjectID(51cd3fd4607d46e399000795),0
2946,2946,self.politics,,politics,"&lt;!-- SC_OFF --&gt;&lt;div class=""md""&gt;&lt;p&gt;It is apparent that the government will do or try to do everything in it&amp;#39;s power to watch, censor and keep things from us. It is vilifying it&amp;#39;s citizens and obscuring truth. (Nothing new in the truth part.) This is not the America my grandfather fought for and was so proud of. It also seems that more and more &amp;quot;western&amp;quot; and &amp;quot;first world&amp;quot; nations aside from us are attempting the same. So I ask this: 
Why are we the global citizens supposedly the ones who elect these officials to represent us allowing them to represent their own interests and oppress us? Is WW3 really going to be global citizens versus global government? Honestly I have no idea what&amp;#39;s going on and what to think of it.&lt;/p&gt;

&lt;p&gt;Edit: CISPA - HR 3523 (not 3525). Also, I thought I had posted a link but evidently did not. &lt;/p&gt;

&lt;p&gt;&lt;a href=""http://kat.ph/blog/GreenPirate/post/1774/""&gt;http://kat.ph/blog/GreenPirate/post/1774/&lt;/a&gt;.&lt;/p&gt;
&lt;/div&gt;&lt;!-- SC_ON --&gt;","It is apparent that the government will do or try to do everything in it's power to watch, censor and keep things from us. It is vilifying it's citizens and obscuring truth. (Nothing new in the truth part.) This is not the America my grandfather fought for and was so proud of. It also seems that more and more ""western"" and ""first world"" nations aside from us are attempting the same. So I ask this: 
Why are we the global citizens supposedly the ones who elect these officials to represent us allowing them to represent their own interests and oppress us? Is WW3 really going to be global citizens versus global government? Honestly I have no idea what's going on and what to think of it.

Edit: CISPA - HR 3523 (not 3525). Also, I thought I had posted a link but evidently did not. 

http://kat.ph/blog/GreenPirate/post/1774/.",,,rs68z,False,Aww shit. Here we go again. Again. CISPA - HR 3525. AKA Return of the SOPA.,,3348,,False,False,,t5_2cneq,True,,,12823,False,True,/r/politics/comments/rs68z/aww_shit_here_we_go_again_again_cispa_hr_3525_aka/,t3_rs68z,1333507761,http://www.reddit.com/r/politics/comments/rs68z/aww_shit_here_we_go_again_again_cispa_hr_3525_aka/,,Emperor_Zar,1333504161,16171,880,,,ObjectID(51cd3fd4607d46e39900079b),0
2947,2947,imgur.com,,politics,,,,,aa0yu,False,I sent a letter to Al Franken asking his position on net neutrality. This was his reply.,,3341,,False,False,,t5_2cneq,False,,,1435,False,False,/r/politics/comments/aa0yu/i_sent_a_letter_to_al_franken_asking_his_position/,t3_aa0yu,1259705083,http://imgur.com/Nt9ug,,nvolker,1259705083,4776,853,,,ObjectID(51cd3fd4607d46e39900079c),0
2960,2960,nytimes.com,,politics,,,,,12ufzj,False,"""Sheldon Adelson, the biggest single donor in political history, supported eight candidates through super PACs. All of them lost on Tuesday."" - NY Times",,3340,,False,False,,t5_2cneq,False,,,3751,False,False,/r/politics/comments/12ufzj/sheldon_adelson_the_biggest_single_donor_in/,t3_12ufzj,1352355494,http://www.nytimes.com/2012/11/08/us/politics/little-to-show-for-cash-flood-by-big-donors.html?ref=politics,,ilfordgrain,1352355494,7091,526,,,ObjectID(51cd3fd4607d46e3990007a9),0
2963,2963,thedailyshow.com,,politics,,,,,6zlek,False,Jon Stewart on GOP hypocrisy over the VP issue,,3341,,False,False,,t5_2cneq,False,,,579,False,False,/r/politics/comments/6zlek/jon_stewart_on_gop_hypocrisy_over_the_vp_issue/,t3_6zlek,1220529653,http://www.thedailyshow.com/video/index.jhtml?videoId=184086&amp;title=sarah-palin-gender-card,,gnome94,1220526053,3920,547,,,ObjectID(51cd3fd4607d46e3990007ac),0
2964,2964,forbes.com,,politics,,,,,1fl9cw,False,California To Wal-Mart: Enough! No More Taxpayer Subsidized Profits For You,,3336,,False,False,,t5_2cneq,False,,,8597,False,False,/r/politics/comments/1fl9cw/california_to_walmart_enough_no_more_taxpayer/,t3_1fl9cw,1370282133,http://www.forbes.com/sites/rickungar/2013/06/03/california-to-wal-mart-enough-no-more-taxpayer-subsidized-profits-for-you/,,CharlieDarwin2,1370278533,11933,2175,,,ObjectID(51cd3fd4607d46e3990007ad),0
3016,3016,courthousenews.com,,politics,,,,,vmpcs,False,"'A Tampa rape victim can sue Hillsborough County Sheriff for allowing a jail guard to refuse to give her a prescribed emergency contraception pill because it was against the guard's religious beliefs, a federal judge ruled.'",,3339,,False,False,,t5_2cneq,False,,,19725,False,False,/r/politics/comments/vmpcs/a_tampa_rape_victim_can_sue_hillsborough_county/,t3_vmpcs,1340724836,http://www.courthousenews.com/2012/06/25/47785.htm,,maxwellhill,1340721236,23064,2339,,,ObjectID(51cd3fd9607d46e3990007e1),0
3091,3091,reuters.com,,politics,,,,,1giyg8,False,"Snowden says he cannot get a fair trial on NSA leaks in U.S.: ""Being called a traitor by Dick Cheney is the highest honor you can give an American""",,3319,,False,False,,t5_2cneq,False,,,6307,False,False,/r/politics/comments/1giyg8/snowden_says_he_cannot_get_a_fair_trial_on_nsa/,t3_1giyg8,1371518284,http://www.reuters.com/article/2013/06/17/us-snowden-forum-trial-idUSBRE95G0NQ20130617,,DougBolivar,1371489484,9626,641,,,ObjectID(51cd3fd9607d46e39900082c),0
3095,3095,youtube.com,,politics,,,,,a1ay3,False,Alan Grayson took to the floor of the House last night and started naming the number of people who have died in each Republican district who have no health insureance. Repugs freak out and get the House to adjourn in attempt to strike the record. Fucking cowards.,"{ ""type"" : ""youtube.com"", ""video_id"" : ""K1pSfEyqOQI"" }",3316,,False,False,,t5_2cneq,False,,,1930,False,False,/r/politics/comments/a1ay3/alan_grayson_took_to_the_floor_of_the_house_last/,t3_a1ay3,1257439002,http://www.youtube.com/watch?v=K1pSfEyqOQI,,[deleted],1257439002,5246,1272,,,ObjectID(51cd3fd9607d46e399000830),0
3097,3097,hispanicbusiness.com,,politics,,,,,1dkn24,False,"""How do Fortune 500 companies pay zero in taxes while college loans go up to 6 percent?"" Elizabeth Warren asked. ""This game is rigged.""",,3321,,False,False,,t5_2cneq,False,,,13500,False,False,/r/politics/comments/1dkn24/how_do_fortune_500_companies_pay_zero_in_taxes/,t3_1dkn24,1367529434,http://www.hispanicbusiness.com/2013/5/2/elizabeth_warren_brings_consumer_cause_to.htm,,wang-banger,1367525834,16821,2179,,,ObjectID(51cd3fd9607d46e399000832),0
3112,3112,politicususa.com,,politics,,,,,1ghx1o,False,"Hypocrisy Overload: Dick Cheney Calls Edward Snowden a Traitor -- ""Dick Cheney helped mislead the country into invading Iraq and has been convicted of war crimes, but he thinks Edward Snowden is a traitor""",,3316,,False,False,,t5_2cneq,False,,,13056,False,False,/r/politics/comments/1ghx1o/hypocrisy_overload_dick_cheney_calls_edward/,t3_1ghx1o,1371474241,http://www.politicususa.com/2013/06/16/dick-cheney-thinks-edward.html,,mepper,1371445441,16372,1324,,,ObjectID(51cd3fde607d46e399000841),0
3133,3133,s-ak.buzzfed.com,,politics,,,,,i0v01,False,I've honestly never come across a dumber human being.  ,,3317,,False,False,,t5_2cneq,False,,,9465,False,False,/r/politics/comments/i0v01/ive_honestly_never_come_across_a_dumber_human/,t3_i0v01,1308194504,http://s-ak.buzzfed.com/static/enhanced/terminal01/2010/4/12/14/enhanced-buzz-6328-1271095591-8.jpg,,dweckl,1308190904,12782,3656,,,ObjectID(51cd3fde607d46e399000856),0
3134,3134,self.politics,,politics,"&lt;!-- SC_OFF --&gt;&lt;div class=""md""&gt;&lt;p&gt;Congress has never been a popular institution -- the general rule of thumb &amp;quot;everyone hates congress, but likes their congressman&amp;quot; generally applied through history. But it wasn&amp;#39;t until after 9/11 when congress, intentionally, sacrificed their own legislative and oversight powers by making the executive branch the most powerful it has ever been.&lt;/p&gt;

&lt;p&gt;Note 1: I must point out that the point of this post is not about Obama. The executive branch does not enact legislation, the legislative branch does (congress) and the executive branch is tasked with implementation of passed legislation. &lt;/p&gt;

&lt;p&gt;Note 2: A president cannot retroactively veto laws.&lt;/p&gt;
&lt;/div&gt;&lt;!-- SC_ON --&gt;","Congress has never been a popular institution -- the general rule of thumb ""everyone hates congress, but likes their congressman"" generally applied through history. But it wasn't until after 9/11 when congress, intentionally, sacrificed their own legislative and oversight powers by making the executive branch the most powerful it has ever been.

Note 1: I must point out that the point of this post is not about Obama. The executive branch does not enact legislation, the legislative branch does (congress) and the executive branch is tasked with implementation of passed legislation. 

Note 2: A president cannot retroactively veto laws.

",,,1gf0to,False,NSA Spying: Remember when the PATRIOT act was rushed through congress within 48 hours of the final draft? Congress has been broken for a long time now.,,3317,,False,False,,t5_2cneq,True,,,6733,False,True,/r/politics/comments/1gf0to/nsa_spying_remember_when_the_patriot_act_was/,t3_1gf0to,1371331854,http://www.reddit.com/r/politics/comments/1gf0to/nsa_spying_remember_when_the_patriot_act_was/,,PlushgunMusic,1371328254,10050,706,,,ObjectID(51cd3fde607d46e399000857),0
3136,3136,self.politics,,politics,"&lt;!-- SC_OFF --&gt;&lt;div class=""md""&gt;&lt;p&gt;As of now, Congress is struggling with figuring out how to &lt;a href=""http://www.huffingtonpost.com/2013/03/02/obama-sequestration-_n_2795749.html""&gt;cut $85 billion from their budget,&lt;/a&gt; considering cuts in Medicaire, Medicaid, Education, and even Defense spending. But instead of cutting these programs, politicians should consider eliminating the War on Drugs, which, according to Harvard Economist Jeffrey Miron, &lt;a href=""http://www.spiegel.de/international/world/harvard-economist-jeffrey-miron-on-why-drugs-should-be-legalized-a-886289.html""&gt;would save the US $85 to $90 billion dollars a year.&lt;/a&gt; &lt;/p&gt;

&lt;p&gt;This would be the equivalent of killing two birds with one stone: it would reduce drug violence, bolster the economy, prevent cuts into vital social institutions, and--other than the rehabilitation and prison sectors--create jobs. &lt;/p&gt;

&lt;p&gt;The solution seems clear. What do you think, reddit?&lt;/p&gt;

&lt;p&gt;Edit: Whoa, front page! Did not see that coming. Thanks for the thoughtful comments, reddit!&lt;/p&gt;
&lt;/div&gt;&lt;!-- SC_ON --&gt;","As of now, Congress is struggling with figuring out how to [cut $85 billion from their budget,](http://www.huffingtonpost.com/2013/03/02/obama-sequestration-_n_2795749.html) considering cuts in Medicaire, Medicaid, Education, and even Defense spending. But instead of cutting these programs, politicians should consider eliminating the War on Drugs, which, according to Harvard Economist Jeffrey Miron, [would save the US $85 to $90 billion dollars a year.](http://www.spiegel.de/international/world/harvard-economist-jeffrey-miron-on-why-drugs-should-be-legalized-a-886289.html) 

This would be the equivalent of killing two birds with one stone: it would reduce drug violence, bolster the economy, prevent cuts into vital social institutions, and--other than the rehabilitation and prison sectors--create jobs. 

The solution seems clear. What do you think, reddit?

Edit: Whoa, front page! Did not see that coming. Thanks for the thoughtful comments, reddit!",,,19iym3,False,What's The Best Way To Cut $85 Billion To Avoid The Sequester? Eliminate the War on Drugs. ,,3319,,False,False,,t5_2cneq,True,,,14442,False,True,/r/politics/comments/19iym3/whats_the_best_way_to_cut_85_billion_to_avoid_the/,t3_19iym3,1362240962,http://www.reddit.com/r/politics/comments/19iym3/whats_the_best_way_to_cut_85_billion_to_avoid_the/,,hawaiiankid,1362240962,17761,2286,,,ObjectID(51cd3fde607d46e399000859),0
