,Unnamed: 0,domain,banned_by,subreddit,selftext_html,selftext,likes,link_flair_text,id,clicked,title,media,score,approved_by,over_18,hidden,thumbnail,subreddit_id,edited,link_flair_css_class,author_flair_css_class,downs,saved,is_self,permalink,name,created,url,author_flair_text,author,created_utc,ups,num_comments,num_reports,distinguished,_id,__v
6260,6260,self.politics,,politics,"&lt;!-- SC_OFF --&gt;&lt;div class=""md""&gt;&lt;p&gt;Like thousands of other Americans, my wife and I signed up months ago for a tour of the U.S. Capitol building during the Christmas holidays. Back in our twenties we used to ride a lot of Amtrak; with a couple of hours to kill changing trains at Union Station, we used to love walking up to the Capitol building and roaming its beautiful interior unattended. Since 9/11, you can only tour the building with a guide, but the elegant new Capitol Visitors Center offers a partial consolation.&lt;/p&gt;

&lt;p&gt;This afternoon, after watching the required orientation film that precedes the tour, I&amp;#39;m exiting the theater when I hear Al Franken&amp;#39;s distinctive bass voice right in front of me. It can&amp;#39;t be him: why would Franken be on a public tour? I edge around for a glimpse and confirm it&amp;#39;s the Senator. I have a split second to decide whether to say something or leave the man alone on his day off. I choose the latter and we end up in different tour groups.&lt;/p&gt;

&lt;p&gt;About halfway through our tour, our guide asks if any of us noticed that Senator Franken was in the theater with us. He mentions that its very unusual for Senators to take the public tours when they can easily use their position to schedule V.I.P tours that are able to visit parts of the building off-limits to the general public. Our guide clearly thinks it&amp;#39;s pretty cool that Franken has chosen to see the U.S. Capitol from the perspective of ordinary Americans. I agree.&lt;/p&gt;

&lt;p&gt;Since I didn&amp;#39;t take the opportunity on the tour, I&amp;#39;ll take it here: Senator Franken, thank you. Thank you for being genuine and courageous, for being a voice that cuts through the bullshit that seems to be the stock and trade of most people in Congress, for doing the things we&amp;#39;d like to think we&amp;#39;d do if we were in the Senate.&lt;/p&gt;
&lt;/div&gt;&lt;!-- SC_ON --&gt;","Like thousands of other Americans, my wife and I signed up months ago for a tour of the U.S. Capitol building during the Christmas holidays. Back in our twenties we used to ride a lot of Amtrak; with a couple of hours to kill changing trains at Union Station, we used to love walking up to the Capitol building and roaming its beautiful interior unattended. Since 9/11, you can only tour the building with a guide, but the elegant new Capitol Visitors Center offers a partial consolation.

This afternoon, after watching the required orientation film that precedes the tour, I'm exiting the theater when I hear Al Franken's distinctive bass voice right in front of me. It can't be him: why would Franken be on a public tour? I edge around for a glimpse and confirm it's the Senator. I have a split second to decide whether to say something or leave the man alone on his day off. I choose the latter and we end up in different tour groups.

About halfway through our tour, our guide asks if any of us noticed that Senator Franken was in the theater with us. He mentions that its very unusual for Senators to take the public tours when they can easily use their position to schedule V.I.P tours that are able to visit parts of the building off-limits to the general public. Our guide clearly thinks it's pretty cool that Franken has chosen to see the U.S. Capitol from the perspective of ordinary Americans. I agree.

Since I didn't take the opportunity on the tour, I'll take it here: Senator Franken, thank you. Thank you for being genuine and courageous, for being a voice that cuts through the bullshit that seems to be the stock and trade of most people in Congress, for doing the things we'd like to think we'd do if we were in the Senate.",,,aiu2i,False,"Earlier today, Al Franken toured the U.S. Capitol building. He could have scheduled a V.I.P. tour like other Senators. Instead, he stood in line for a public tour just like the rest of us. Vote up if you think we need more folks like Al in Congress.",,2923,,False,False,,t5_2cneq,False,,,3194,False,True,/r/politics/comments/aiu2i/earlier_today_al_franken_toured_the_us_capitol/,t3_aiu2i,1261892460,http://www.reddit.com/r/politics/comments/aiu2i/earlier_today_al_franken_toured_the_us_capitol/,,mojosam,1261892460,6117,633,,,ObjectID(51cd40b8ef7ac6f3990004ed),0
6282,6282,cnn.com,,politics,,,,,1gyk30,False,"Snowden: ""The greatest fear that I have regarding the outcome for America of these disclosures is that nothing will change.""",,2921,,False,False,,t5_2cneq,False,,,3684,False,False,/r/politics/comments/1gyk30/snowden_the_greatest_fear_that_i_have_regarding/,t3_1gyk30,1372094691,http://www.cnn.com/2013/06/10/politics/edward-snowden-profile,,SomeKindOfMutant,1372065891,6605,533,,,ObjectID(51cd40b8ef7ac6f399000503),0
6292,6292,politico.com,,politics,,,,,1200h3,False,Elizabeth Warren opens up 6-point lead over Scott Brown in Massachusetts ,,2924,,False,False,,t5_2cneq,False,,,2606,False,False,/r/politics/comments/1200h3/elizabeth_warren_opens_up_6point_lead_over_scott/,t3_1200h3,1351080056,http://www.politico.com/news/stories/1012/82800.html,,Dizzy_Slip,1351076456,5530,506,,,ObjectID(51cd40b8ef7ac6f39900050d),0
6294,6294,buzzfeed.com,,politics,,,,,tuohs,False,An amendment that would legalize the use of propaganda on American audiences is being inserted into the latest defense authorization bill. The bi-partisan amendment is sponsored by Rep. Mark Thornberry from Texas and Rep. Adam Smith from Washington State.,,2922,,False,False,,t5_2cneq,False,,,10286,False,False,/r/politics/comments/tuohs/an_amendment_that_would_legalize_the_use_of/,t3_tuohs,1337438225,http://www.buzzfeed.com/mhastings/congressmen-seek-to-lift-propaganda-ban,,Orangutan,1337434625,13208,1541,,,ObjectID(51cd40b8ef7ac6f39900050f),0
6316,6316,colbertnation.com,,politics,,,,,1ey13q,False,PBS kills documentary about Koch Brothers out of fear of losing David Koch's millions.,"{ ""type"" : ""colbertnation.com"", ""oembed"" : { ""thumbnail_height"" : 1080, ""type"" : ""video"", ""thumbnail_url"" : ""http://colbertnation.mtvnimages.com/images/shows/colbert_report/videos/season9/09107/cr_09107_04.jpg"", ""provider_name"" : ""Colbert Nation"", ""version"" : ""1.0"", ""html"" : ""&lt;embed style=\""display:block\"" src=\""http://media.mtvnservices.com/mgid:cms:item:comedycentral.com:426582\"" width=\""600\"" height=\""400\"" type=\""application/x-shockwave-flash\"" wmode=\""window\"" allowfullscreen=\""true\"" flashvars=\""autoPlay=false\"" allowscriptaccess=\""always\"" allownetworking=\""all\"" bgcolor=\""#000000\""&gt;&lt;/embed&gt;"", ""width"" : 600, ""height"" : 400, ""thumbnail_width"" : 1920, ""title"" : ""\""Citizen Koch\"""", ""description"" : ""PBS drops a documentary called \""Citizen Koch\"" because they feared the reaction of billionaire sponsor David Koch."", ""provider_url"" : ""http://www.colbertnation.com/"" } }",2919,,False,False,,t5_2cneq,False,,,3058,False,False,/r/politics/comments/1ey13q/pbs_kills_documentary_about_koch_brothers_out_of/,t3_1ey13q,1369364324,http://www.colbertnation.com/the-colbert-report-videos/426582/may-22-2013/-citizen-koch-?xrs=synd_facebook,,harsesus,1369360724,5977,606,,,ObjectID(51cd40bdef7ac6f399000525),0
6331,6331,dailyfinance.com,,politics,,,,,13xgfk,False,"Wall Street Professionals Admit: Yes, Lots of Us Are Corrupt",,2923,,False,False,,t5_2cneq,False,,,3444,False,False,/r/politics/comments/13xgfk/wall_street_professionals_admit_yes_lots_of_us/,t3_13xgfk,1354101561,http://www.dailyfinance.com/2012/07/20/stockbroker-corrupt-wall-street-cheats/,,trot-trot,1354101561,6367,775,,,ObjectID(51cd40bdef7ac6f399000534),0
6335,6335,self.politics,,politics,"&lt;!-- SC_OFF --&gt;&lt;div class=""md""&gt;&lt;p&gt;Not sure why &lt;a href=""/r/politics""&gt;/r/politics&lt;/a&gt; isn&amp;#39;t letting me repost this. It&amp;#39;s only been submitted once before (EDIT: 3 months ago by someone else) and it received one upvote.&lt;/p&gt;

&lt;p&gt;&lt;a href=""http://www.reddit.com/r/politics/comments/qjwte/rootstrikers_a_harvard_profs_plan_to_take_our/?already_submitted=true""&gt;Here&amp;#39;s the original submission&lt;/a&gt; of this &lt;a href=""http://www.youtube.com/watch?v=Y9UXiB5s4b0""&gt;ten minute video of Lawrence Lessig&lt;/a&gt; succinctly explaining how money dominates our legislature. I can&amp;#39;t think of a better resource to direct someone to who doesn&amp;#39;t already understand how this works.&lt;/p&gt;

&lt;p&gt;EDIT: Since this has garnered some attention, I&amp;#39;d like to point everyone to &lt;a href=""/r/rootstrikers""&gt;/r/rootstrikers&lt;/a&gt; for further discussion on what can be done to rectify this situation.&lt;/p&gt;

&lt;p&gt;More Lessig videos:&lt;/p&gt;

&lt;p&gt;*&lt;a href=""http://www.youtube.com/watch?v=Ik1AK56FtVc""&gt;A more comprehensive hour long video that can be found here.&lt;/a&gt;&lt;/p&gt;

&lt;p&gt;*Interviews on The Daily Show &lt;a href=""http://www.thedailyshow.com/watch/tue-december-13-2011/exclusive---lawrence-lessig-extended-interview-pt--1""&gt;part 1&lt;/a&gt; &amp;amp; &lt;a href=""http://www.thedailyshow.com/watch/tue-december-13-2011/exclusive---lawrence-lessig-extended-interview-pt--2""&gt;part 2&lt;/a&gt;&lt;/p&gt;

&lt;p&gt;Lessig has two books he put out recently that are worth a look (I haven&amp;#39;t read the second yet):&lt;/p&gt;

&lt;p&gt;&lt;a href=""http://www.amazon.com/Republic-Lost-Money-Corrupts-Congress--/dp/0446576433/ref=sr_1_1?ie=UTF8&amp;amp;qid=1339859244&amp;amp;sr=8-1&amp;amp;keywords=lawrence+lessig""&gt;Republic, Lost: How Money Corrupts Congress--and a Plan to Stop It&lt;/a&gt;&lt;/p&gt;

&lt;p&gt;&lt;a href=""http://www.amazon.com/One-Way-Forward-Outsiders-ebook/dp/B0078TE3NG/ref=sr_1_3?ie=UTF8&amp;amp;qid=1339859244&amp;amp;sr=8-3&amp;amp;keywords=lawrence+lessig""&gt;One Way Forward: The Outsider&amp;#39;s Guide to Fixing the Republic&lt;/a&gt;&lt;/p&gt;

&lt;p&gt;Copied from another comment:&lt;/p&gt;

&lt;blockquote&gt;
&lt;p&gt;Want to show your support for his message? Spread the message:&lt;/p&gt;

&lt;ul&gt;
&lt;li&gt;Make an anti-corruption pledge here: &lt;a href=""http://www.theanticorruptionpledge.org/""&gt;http://www.theanticorruptionpledge.org/&lt;/a&gt;&lt;/li&gt;
&lt;li&gt;Like the Facebook page: &lt;a href=""https://www.facebook.com/rootstrikers""&gt;https://www.facebook.com/rootstrikers&lt;/a&gt;&lt;/li&gt;
&lt;li&gt;Follow on Twitter: &lt;a href=""https://twitter.com/#!/rootstrikers""&gt;https://twitter.com/#!/rootstrikers&lt;/a&gt;&lt;/li&gt;
&lt;/ul&gt;
&lt;/blockquote&gt;
&lt;/div&gt;&lt;!-- SC_ON --&gt;","Not sure why /r/politics isn't letting me repost this. It's only been submitted once before (EDIT: 3 months ago by someone else) and it received one upvote.

[Here's the original submission](http://www.reddit.com/r/politics/comments/qjwte/rootstrikers_a_harvard_profs_plan_to_take_our/?already_submitted=true) of this [ten minute video of Lawrence Lessig](http://www.youtube.com/watch?v=Y9UXiB5s4b0) succinctly explaining how money dominates our legislature. I can't think of a better resource to direct someone to who doesn't already understand how this works.

EDIT: Since this has garnered some attention, I'd like to point everyone to /r/rootstrikers for further discussion on what can be done to rectify this situation.

More Lessig videos:

*[A more comprehensive hour long video that can be found here.](http://www.youtube.com/watch?v=Ik1AK56FtVc)

*Interviews on The Daily Show [part 1](http://www.thedailyshow.com/watch/tue-december-13-2011/exclusive---lawrence-lessig-extended-interview-pt--1) &amp; [part 2](http://www.thedailyshow.com/watch/tue-december-13-2011/exclusive---lawrence-lessig-extended-interview-pt--2)

Lessig has two books he put out recently that are worth a look (I haven't read the second yet):

[Republic, Lost: How Money Corrupts Congress--and a Plan to Stop It](http://www.amazon.com/Republic-Lost-Money-Corrupts-Congress--/dp/0446576433/ref=sr_1_1?ie=UTF8&amp;qid=1339859244&amp;sr=8-1&amp;keywords=lawrence+lessig)

[One Way Forward: The Outsider's Guide to Fixing the Republic](http://www.amazon.com/One-Way-Forward-Outsiders-ebook/dp/B0078TE3NG/ref=sr_1_3?ie=UTF8&amp;qid=1339859244&amp;sr=8-3&amp;keywords=lawrence+lessig)

Copied from another comment:
&gt;Want to show your support for his message? Spread the message:

&gt;* Make an anti-corruption pledge here: http://www.theanticorruptionpledge.org/
&gt;* Like the Facebook page: https://www.facebook.com/rootstrikers
&gt;* Follow on Twitter: https://twitter.com/#!/rootstrikers",,,v4a02,False,"Lawrence Lessig succinctly explains (10min) how money dominates our legislature. Last time this was posted it got one upvote, and the video on Youtube has 1,148 views.",,2920,,False,False,,t5_2cneq,True,,,6670,False,True,/r/politics/comments/v4a02/lawrence_lessig_succinctly_explains_10min_how/,t3_v4a02,1339808882,http://www.reddit.com/r/politics/comments/v4a02/lawrence_lessig_succinctly_explains_10min_how/,,siskoraban,1339805282,9590,487,,,ObjectID(51cd40bdef7ac6f399000538),0
6346,6346,freakoutnation.com,,politics,,,,,11ta95,False,"Hypocrisy: If the President’s Family Purchased Voter Machines, the Uproar Would be Deafening",,2915,,False,False,,t5_2cneq,False,,,8260,False,False,/r/politics/comments/11ta95/hypocrisy_if_the_presidents_family_purchased/,t3_11ta95,1350769789,http://freakoutnation.com/2012/10/20/hypocrisy-if-the-presidents-family-purchased-voter-machines-the-uproar-would-be-deafening/,,btrfly,1350766189,11175,1244,,,ObjectID(51cd40bdef7ac6f399000543),0
6374,6374,businessinsider.com,,politics,,,,,11kdw9,False,"This is a man without a core, this is a man without substance, this is a man that will say anything to become president of the United States.  -- Rudy Giuliani on Mitt Romney in December 2011",,2912,,False,False,,t5_2cneq,False,,,4796,False,False,/r/politics/comments/11kdw9/this_is_a_man_without_a_core_this_is_a_man/,t3_11kdw9,1350392231,http://www.businessinsider.com/rudy-giuliani-endorses-mitt-romney-but-it-could-backfire-2012-4,,geordilaforge,1350388631,7708,445,,,ObjectID(51cd40bdef7ac6f39900055f),0
6385,6385,nytimes.com,,politics,,,,,1bv9ca,False,Hunger Strike at Guantánamo - Prisoners say that they would rather die than remain in the purgatory of indefinite detention,,2914,,False,False,,t5_2cneq,False,,,4348,False,False,/r/politics/comments/1bv9ca/hunger_strike_at_guantánamo_prisoners_say_that/,t3_1bv9ca,1365366468,http://www.nytimes.com/2013/04/06/opinion/hunger-strike-at-guantanamo-bay.html?hp&amp;_r=2&amp;,,mike___mc,1365362868,7262,1466,,,ObjectID(51cd40bdef7ac6f39900056a),0
6403,6403,alternet.org,,politics,,,,,19pmwg,False,"Silicon Valley Reportedly Full of Stoners - 'Silicon Valley CEO Mark Johnson told Businessweek, “Pot is an extremely functional drug. Coders can code on it, writers can write on it."" '",,2914,,False,False,,t5_2cneq,False,,,7309,False,False,/r/politics/comments/19pmwg/silicon_valley_reportedly_full_of_stoners_silicon/,t3_19pmwg,1362499549,http://www.alternet.org/silicon-valley-reportedly-full-stoners,,homebrewtj,1362499549,10223,1634,,,ObjectID(51cd40c2ef7ac6f39900057c),0
6408,6408,washingtonpost.com,,politics,,,,,14cb16,False,"“I cannot in good conscience support a tax cut in which so many of the benefits go to the most fortunate among us,” McCain said in 2001, when the Bush tax cuts first were proposed.",,2905,,False,False,,t5_2cneq,False,,,4354,False,False,/r/politics/comments/14cb16/i_cannot_in_good_conscience_support_a_tax_cut_in/,t3_14cb16,1354739814,http://www.washingtonpost.com/opinions/ruth-marcus-the-shifting-line-on-tax-cuts/2012/12/04/e50bd63e-3e46-11e2-ae43-cf491b837f7b_story.html?wpisrc=nl_politics,,Zaylyn,1354739814,7259,461,,,ObjectID(51cd40c2ef7ac6f399000581),0
6432,6432,washingtonpost.com,,politics,,,,,1acp24,False,"Why an MRI costs $1,080 in America and $280 in France",,2906,,False,False,,t5_2cneq,False,,,7745,False,False,/r/politics/comments/1acp24/why_an_mri_costs_1080_in_america_and_280_in_france/,t3_1acp24,1363363092,http://www.washingtonpost.com/blogs/wonkblog/wp/2013/03/15/why-an-mri-costs-1080-in-america-and-280-in-france/,,ipmzero,1363359492,10651,3082,,,ObjectID(51cd40c2ef7ac6f399000599),0
6439,6439,gawker.com,,politics,,,,,qqecb,False,NYPD Officer Sent To Psych Ward By Superiors After Reporting Corruption,,2908,,False,False,,t5_2cneq,False,,,10807,False,False,/r/politics/comments/qqecb/nypd_officer_sent_to_psych_ward_by_superiors/,t3_qqecb,1331398270,http://gawker.com/5892115/nypd-officer-sent-to-psych-ward-by-superiors-after-reporting-corruption,,djkrugger,1331398270,13715,726,,,ObjectID(51cd40c2ef7ac6f3990005a0),0
6440,6440,economist.com,,politics,,,,,qdpq0,False,"""Prison as a Deterrent Does Not Work. If it Did, America Would be the Safest Country on Earth""",,2910,,False,False,,t5_2cneq,False,,,9971,False,False,/r/politics/comments/qdpq0/prison_as_a_deterrent_does_not_work_if_it_did/,t3_qdpq0,1330647793,http://www.economist.com/node/21548989,,mothslice,1330647793,12881,1135,,,ObjectID(51cd40c2ef7ac6f3990005a1),0
6445,6445,wosu.org,,politics,,,,,1cp6vs,False,"Catholic high school in Columbus OH fires teacher of 19 years when they found out she was a lesbian, a ""violation of moral law."" Columbus has an ordinance that protects employees from discrimination including sexual orientation. Religious employers are not exempt.",,2903,,False,False,,t5_2cneq,False,,,12472,False,False,/r/politics/comments/1cp6vs/catholic_high_school_in_columbus_oh_fires_teacher/,t3_1cp6vs,1366408853,http://wosu.org/2012/news/2013/04/18/watterson-teacher-wants-job-back-thats-all-im-hoping-for/,,mepper,1366405253,15375,1305,,,ObjectID(51cd40c2ef7ac6f3990005a6),0
6451,6451,dailypaul.com,,politics,,,,,hjg2q,False,"For the past seven hours, Senator Paul has been holding the Senate floor to keep the senate from passing the patriot act without debate or amendments.",,2910,,False,False,,t5_2cneq,False,,,10165,False,False,/r/politics/comments/hjg2q/for_the_past_seven_hours_senator_paul_has_been/,t3_hjg2q,1306295242,http://dailypaul.com/165765,,y2quest,1306291642,13075,2660,,,ObjectID(51cd40c2ef7ac6f3990005ac),0
6470,6470,ctpost.com,,politics,,,,,18y7xr,False,"Towns pay $3.5 million to settle lawsuit: '5yrs ago, a heavily armed special weapons and tactics team charged into a home - guns drawn and flash grenades exploding - and killed a man who was quietly watching porn on TV'
",,2911,,False,False,,t5_2cneq,False,,,7554,False,False,/r/politics/comments/18y7xr/towns_pay_35_million_to_settle_lawsuit_5yrs_ago_a/,t3_18y7xr,1361448915,http://www.ctpost.com/local/article/Towns-to-pay-3-5M-in-deadly-cop-raid-4290145.php,,maxwellhill,1361448915,10465,2279,,,ObjectID(51cd40c2ef7ac6f3990005bf),0
6481,6481,npr.org,,politics,,,,,1f9k62,False,Tea Party Favorite Rep. Michele Bachmann Leaving Congress,,2915,,False,False,,t5_2cneq,False,,,5189,False,False,/r/politics/comments/1f9k62/tea_party_favorite_rep_michele_bachmann_leaving/,t3_1f9k62,1369835457,http://www.npr.org/blogs/thetwo-way/2013/05/29/187010187/tea-party-favorite-rep-michele-bachmann-leaving-congress?utm_source=news&amp;utm_medium=facebook&amp;utm_campaign=20130529,,Kida89,1369831857,8104,1088,,,ObjectID(51cd40c2ef7ac6f3990005ca),0
6486,6486,thehill.com,,politics,,,,,14oyzz,False,Jimmy Carter: 'I think it's OK' to legalize marijuana,,2903,,False,False,,t5_2cneq,False,,,7415,False,False,/r/politics/comments/14oyzz/jimmy_carter_i_think_its_ok_to_legalize_marijuana/,t3_14oyzz,1355269292,http://thehill.com/blogs/blog-briefing-room/news/272355-jimmy-carter-i-think-its-okay-to-legalize-marijuana,,KitAndKat,1355269292,10318,777,,,ObjectID(51cd40c2ef7ac6f3990005cf),0
6489,6489,nytimes.com,,politics,,,,,13407f,False,"The Fiscal Delusion: ""President Bill Clinton’s 1993 deficit reduction plan increased income tax rates for roughly the top 1.2 percent of incomes. Opponents said this would lead to recession. Instead, we had enormous job creation and the longest economic expansion in our history.""",,2907,,False,False,,t5_2cneq,False,,,4607,False,False,/r/politics/comments/13407f/the_fiscal_delusion_president_bill_clintons_1993/,t3_13407f,1352787753,http://www.nytimes.com/2012/11/13/opinion/rubin-deluding-ourselves-over-the-fiscal-cliff.html?smid=re-share,,jamestown112,1352787753,7514,1502,,,ObjectID(51cd40c2ef7ac6f3990005d2),0
6493,6493,playboy.com,,politics,,,,,ys1am,False,"Hugh Hefner: Today, in every instance of sexual rights falling under attack, you’ll find legislation forced into place by people who practice discrimination disguised as religious freedom. ",,2903,,True,False,,t5_2cneq,False,,,7388,False,False,/r/politics/comments/ys1am/hugh_hefner_today_in_every_instance_of_sexual/,t3_ys1am,1345851132,http://www.playboy.com/playground/view/sexual-freedom,,sunkid,1345847532,10291,698,,,ObjectID(51cd40c2ef7ac6f3990005d6),0
6495,6495,content.usatoday.com,,politics,,,,,quh92,False,Poll: 69% of Americans want to outlaw super PACs,,2906,,False,False,,t5_2cneq,False,,,10997,False,False,/r/politics/comments/quh92/poll_69_of_americans_want_to_outlaw_super_pacs/,t3_quh92,1331647835,http://content.usatoday.com/communities/onpolitics/post/2012/03/super-pacs-illegal-abc-poll-/1?csp=34news&amp;utm_source=feedburner&amp;utm_medium=feed&amp;utm_campaign=Feed%3A+usatoday-NewsTopStories+%28News+-+Top+Stories%29&amp;utm_content=Google+Feedfetcher#.T19HLBEgfQg,,F0REM4N,1331644235,13903,1250,,,ObjectID(51cd40c2ef7ac6f3990005d8),0
6523,6523,huffingtonpost.com,,politics,,,,,1390sq,False,"Elizabeth Warren on Filibuster Reform: I want to fight for jobs for people who want to work, for millionaires and Big Oil to pay their fair share, and to hold Wall Street accountable. But here's the honest truth: we'll never do any of that if we can't get up-or-down votes in the Senate.  ",,2907,,False,False,,t5_2cneq,False,,,2816,False,False,/r/politics/comments/1390sq/elizabeth_warren_on_filibuster_reform_i_want_to/,t3_1390sq,1353002660,http://www.huffingtonpost.com/elizabeth-warren/filibuster-reform_b_2136800.html,,nowhathappenedwas,1353002660,5723,633,,,ObjectID(51cd40c7ef7ac6f3990005f4),0
6524,6524,dailykos.com,,politics,,,,,11id8e,False,"Gov. Walker's (WI-R) 80,000 job deficit: Walker quietly removes from his website promise to create 250,000 jobs in his 4 year term",,2902,,False,False,,t5_2cneq,False,,,4882,False,False,/r/politics/comments/11id8e/gov_walkers_wir_80000_job_deficit_walker_quietly/,t3_11id8e,1350311667,http://www.dailykos.com/story/2012/09/24/1134424/-Walker-s-80-000-job-deficit,,Dizzy_Slip,1350308067,7784,623,,,ObjectID(51cd40c7ef7ac6f3990005f5),0
6542,6542,cnn.com,,politics,,,,,1a1p7r,False,"We do not have a health care system in America. We have a disease-management system -- one that depends on ruinously expensive drugs and surgeries that treat health conditions after they manifest rather than giving our citizens simple diet, lifestyle and therapeutic tools to keep them healthy.",,2899,,False,False,,t5_2cneq,False,,,11088,False,False,/r/politics/comments/1a1p7r/we_do_not_have_a_health_care_system_in_america_we/,t3_1a1p7r,1362959290,http://www.cnn.com/2013/03/08/opinion/weil-health-care/index.html?hpt=hp_c1,,acore8604,1362955690,13987,1653,,,ObjectID(51cd40c7ef7ac6f399000607),0
6544,6544,alternet.org,,politics,,,,,14q6s7,False,Twinkie CEO Admits Company Took Employees Pensions and Put It Toward Executive Pay,,2905,,False,False,,t5_2cneq,False,,,8830,False,False,/r/politics/comments/14q6s7/twinkie_ceo_admits_company_took_employees/,t3_14q6s7,1355324745,http://www.alternet.org/corporate-accountability-and-workplace/twinkie-ceo-admits-company-took-employees-pensions-and-put-it?paging=off,,maxwellhill,1355324745,11735,1657,,,ObjectID(51cd40c7ef7ac6f399000609),0
6558,6558,theatlantic.com,,politics,,,,,19pqfg,False,"This is America, now: The Dow hits a record high, with household income at a decade low",,2903,,False,False,,t5_2cneq,False,,,7533,False,False,/r/politics/comments/19pqfg/this_is_america_now_the_dow_hits_a_record_high/,t3_19pqfg,1362502401,http://www.theatlantic.com/business/archive/2013/03/this-is-america-now-the-dow-hits-a-record-high-with-household-income-at-a-decade-low/273719/,,Mr_Mew,1362502401,10436,1396,,,ObjectID(51cd40c7ef7ac6f399000617),0
6565,6565,nytimes.com,,politics,,,,,y9h3u,False,"Ohio Republicans are allowing early voting in Republican districts, striking it down in Democratic districts.",,2897,,False,False,,t5_2cneq,False,,,10267,False,False,/r/politics/comments/y9h3u/ohio_republicans_are_allowing_early_voting_in/,t3_y9h3u,1345045415,http://www.nytimes.com/2012/08/15/opinion/overt-discrimination-in-ohio.html?_r=1&amp;hp,,78fivealive,1345041815,13164,1515,,,ObjectID(51cd40c7ef7ac6f39900061e),0
6566,6566,andrewsullivan.thedailybeast.com,,politics,,,,,vxcy8,False,"Anderson Cooper: ""The Fact Is, I'm Gay."" - ""I’ve also been reminded recently that while as a society we are moving toward greater inclusion and equality for all people, the tide of history only advances when people make themselves fully visible.""",,2896,,False,False,,t5_2cneq,False,,,21053,False,False,/r/politics/comments/vxcy8/anderson_cooper_the_fact_is_im_gay_ive_also_been/,t3_vxcy8,1341245469,http://andrewsullivan.thedailybeast.com/2012/07/anderson-cooper-the-fact-is-im-gay.html,,Anomaly100,1341241869,23949,2741,,,ObjectID(51cd40c7ef7ac6f39900061f),0
