,Unnamed: 0,domain,banned_by,subreddit,selftext_html,selftext,likes,link_flair_text,id,clicked,title,media,score,approved_by,over_18,hidden,thumbnail,subreddit_id,edited,link_flair_css_class,author_flair_css_class,downs,saved,is_self,permalink,name,created,url,author_flair_text,author,created_utc,ups,num_comments,num_reports,distinguished,_id,__v
4401,4401,thehill.com,,politics,,,,,1amtis,False,"It's official: Elizabeth Colbert Busch, sister of Stephen Colbert, is the Democratic nominee for South Carolina's open House seat.",,3109,,False,False,,t5_2cneq,False,,,10237,False,False,/r/politics/comments/1amtis/its_official_elizabeth_colbert_busch_sister_of/,t3_1amtis,1363745765,http://thehill.com/blogs/ballot-box/house-races/289183-colbert-busch-wins-south-carolina-democratic-primary,,uriman,1363742165,13346,594,,,ObjectID(51cd401f607d46e399000d4a),0
4416,4416,news.cnet.com,,politics,,,,,t72rd,False,"CNET has learned the FBI is quietly pushing its plan to force surveillance backdoors on social networks, VoIP, and Web e-mail providers, and is asking Internet companies not to oppose a law making those backdoors mandatory.",,3109,,False,False,,t5_2cneq,False,,,7848,False,False,/r/politics/comments/t72rd/cnet_has_learned_the_fbi_is_quietly_pushing_its/,t3_t72rd,1336154460,http://news.cnet.com/8301-1009_3-57428067-83/fbi-we-need-wiretap-ready-web-sites-now/,,MrsPibb,1336150860,10957,707,,,ObjectID(51cd401f607d46e399000d59),0
4418,4418,youtube.com,,politics,,,,,hczy8,False,"First part of Stewart vs. O'Reilly, absolute slaughter. ""BOOYA! That's another rap term""","{ ""type"" : ""youtube.com"", ""oembed"" : { ""author_url"" : ""http://www.youtube.com/user/FoxNewsInsider"", ""thumbnail_height"" : 360, ""thumbnail_url"" : ""http://i2.ytimg.com/vi/Im8WhG-8FGw/hqdefault.jpg"", ""provider_name"" : ""YouTube"", ""version"" : ""1.0"", ""thumbnail_width"" : 480, ""html"" : ""&lt;object width=\""600\"" height=\""363\""&gt;&lt;param name=\""movie\"" value=\""http://www.youtube.com/v/Im8WhG-8FGw?version=3\""&gt;&lt;/param&gt;&lt;param name=\""allowFullScreen\"" value=\""true\""&gt;&lt;/param&gt;&lt;param name=\""allowscriptaccess\"" value=\""always\""&gt;&lt;/param&gt;&lt;embed src=\""http://www.youtube.com/v/Im8WhG-8FGw?version=3\"" type=\""application/x-shockwave-flash\"" width=\""600\"" height=\""363\"" allowscriptaccess=\""always\"" allowfullscreen=\""true\""&gt;&lt;/embed&gt;&lt;/object&gt;"", ""width"" : 600, ""height"" : 363, ""author_name"" : ""FoxNewsInsider"", ""type"" : ""video"", ""url"" : ""http://www.youtube.com/watch?v=Im8WhG-8FGw"", ""title"" : ""051611 oreilly1"", ""description"" : ""Uploaded by FoxNewsInsider on 2011-05-17."", ""provider_url"" : ""http://www.youtube.com/"" } }",3103,,False,False,,t5_2cneq,False,,,10194,False,False,/r/politics/comments/hczy8/first_part_of_stewart_vs_oreilly_absolute/,t3_hczy8,1305598245,http://www.youtube.com/watch?v=Im8WhG-8FGw,,therealbarackobama,1305594645,13297,3074,,,ObjectID(51cd401f607d46e399000d5b),0
4424,4424,huffingtonpost.com,,politics,,,,,14eezj,False,"Debt Ceiling Bluff Called By Harry Reid, Leaving Mitch McConnell To Filibuster Himself",,3104,,False,False,,t5_2cneq,False,,,3814,False,False,/r/politics/comments/14eezj/debt_ceiling_bluff_called_by_harry_reid_leaving/,t3_14eezj,1354823905,http://www.huffingtonpost.com/2012/12/06/debt-ceiling-mitch-mcconnell_n_2251515.html,,SatanIsRepublican,1354823905,6918,962,,,ObjectID(51cd401f607d46e399000d61),0
4429,4429,self.politics,,politics,"&lt;!-- SC_OFF --&gt;&lt;div class=""md""&gt;&lt;p&gt;I&amp;#39;d gladly pay an additional 50c or so per pizza to know the people making and delivering my food are insured. It seems ludicrous that they didn&amp;#39;t do that earlier. I like their pizza, but am less inclined to go there now that I see what kind of a hissy this choad is throwing now that his employees are entitled to health care. 
&lt;strong&gt;Edit: a lot of people have asked where I got the 50c figure from... I misrembered the story! Mea Culpa! The fact that it is only 11-14 cents only makes my original sentiment that much more relevant. A dime and a nickel to insure a worker is a ludicrous thing to get bent out of shape about.&lt;/strong&gt;&lt;/p&gt;
&lt;/div&gt;&lt;!-- SC_ON --&gt;","I'd gladly pay an additional 50c or so per pizza to know the people making and delivering my food are insured. It seems ludicrous that they didn't do that earlier. I like their pizza, but am less inclined to go there now that I see what kind of a hissy this choad is throwing now that his employees are entitled to health care. 
**Edit: a lot of people have asked where I got the 50c figure from... I misrembered the story! Mea Culpa! The fact that it is only 11-14 cents only makes my original sentiment that much more relevant. A dime and a nickel to insure a worker is a ludicrous thing to get bent out of shape about.**",,,12yqjm,False,Papa John's says they'll increase the cost of pizza by about 50c in response to ObamaCare. Is anyone else annoyed they didn't do that earlier so all their employees could be insured?,,3107,,False,False,,t5_2cneq,True,,,16431,False,True,/r/politics/comments/12yqjm/papa_johns_says_theyll_increase_the_cost_of_pizza/,t3_12yqjm,1352560271,http://www.reddit.com/r/politics/comments/12yqjm/papa_johns_says_theyll_increase_the_cost_of_pizza/,,drivebypooping,1352560271,19538,3579,,,ObjectID(51cd401f607d46e399000d66),0
4430,4430,pixiq.com,,politics,,,,,tpsrn,False,DoJ Tells Baltimore PD the right to record on-duty police officers is protected by the First Amendment,,3111,,False,False,,t5_2cneq,False,,,7652,False,False,/r/politics/comments/tpsrn/doj_tells_baltimore_pd_the_right_to_record_onduty/,t3_tpsrn,1337171032,http://www.pixiq.com/article/department-of-justice-slaps-baltimore-pd,,chefsinblack,1337167432,10763,787,,,ObjectID(51cd401f607d46e399000d67),0
4438,4438,wired.com,,politics,,,,,1dxd1l,False,"1/3 of US Honeybee Colonies Died Last Winter, Threatening US Food Supply - “We’re getting closer &amp; closer to the point where we don’t have enough bees in this country to meet pollination demands,” said entomologist Dennis vanEngelstorp, who led survey documenting declines.",,3100,,False,False,,t5_2cneq,False,,,5123,False,False,/r/politics/comments/1dxd1l/13_of_us_honeybee_colonies_died_last_winter/,t3_1dxd1l,1368017213,http://www.wired.com/wiredscience/2013/05/winter-honeybee-losses/,,anutensil,1368013613,8223,986,,,ObjectID(51cd401f607d46e399000d6f),0
4439,4439,arstechnica.com,,politics,,,,,1ddf55,False,"Congress tries to reset science grants, wants every one to be “groundbreaking” -- If lawmakers get their way, research like recent Higgs findings could disappear.",,3105,,False,False,,t5_2cneq,False,,,5530,False,False,/r/politics/comments/1ddf55/congress_tries_to_reset_science_grants_wants/,t3_1ddf55,1367281233,http://arstechnica.com/science/2013/04/congress-tries-to-reset-science-grants-wants-every-one-to-be-groundbreaking/,,tepidwaters,1367277633,8635,954,,,ObjectID(51cd401f607d46e399000d70),0
4450,4450,newdeal.feri.org,,politics,,,,,1ffqvz,False,"""We cannot allow our economic life to be controlled by that small group of men whose chief outlook upon the social welfare is tinctured by the fact that they can make huge profits from the lending of money"" -FDR, 1932",,3105,,False,False,,t5_2cneq,False,,,6105,False,False,/r/politics/comments/1ffqvz/we_cannot_allow_our_economic_life_to_be/,t3_1ffqvz,1370048834,http://newdeal.feri.org/speeches/1932d.htm,,americandreamsicle,1370045234,9210,724,,,ObjectID(51cd401f607d46e399000d7b),0
4459,4459,torrentfreak.com,,politics,,,,,n9mjs,False,"Megaupload to sue Universal for wrongfully taking down its content from YouTube; enters SOPA debate, calling for like-minded people to join forces and fight for an Internet without censorship",,3105,,False,False,,t5_2cneq,False,,,11300,False,False,/r/politics/comments/n9mjs/megaupload_to_sue_universal_for_wrongfully_taking/,t3_n9mjs,1323696724,https://torrentfreak.com/megaupload-to-sue-universal-joins-fight-against-sopa-111212/,,maxwellhill,1323696724,14405,634,,,ObjectID(51cd401f607d46e399000d84),0
4460,4460,dailyherald.com,,politics,,,,,1f4ylo,False,Teacher faces possible discipline for reminding his students that they are protected by the 5th amendment before taking a school survey.,,3109,,False,False,,t5_2cneq,False,,,10424,False,False,/r/politics/comments/1f4ylo/teacher_faces_possible_discipline_for_reminding/,t3_1f4ylo,1369667776,http://www.dailyherald.com/article/20130525/news/705259921/,,tazcel,1369664176,13533,1344,,,ObjectID(51cd401f607d46e399000d85),0
4464,4464,truthdig.com,,politics,,,,,18qlww,False,"""The United States, from 1970 to 2005, increased its prison population by about 700 percent, according to statistics gathered by the ACLU.""",,3097,,False,False,,t5_2cneq,False,,,4570,False,False,/r/politics/comments/18qlww/the_united_states_from_1970_to_2005_increased_its/,t3_18qlww,1361170226,http://www.truthdig.com/report/item/profiting_from_human_misery_20130217/,,logo_positive,1361170226,7667,985,,,ObjectID(51cd401f607d46e399000d89),0
4505,4505,businessinsider.com,,politics,,,,,lqv57,False,MARINES TO OAKLAND POLICE: 'You Did This To My Brother.'  Marines around the world are outraged by the injuries inflicted by police on Scott Olsen at Tuesday's Occupy Oakland protests,,3097,,False,False,,t5_2cneq,False,,,16433,False,False,/r/politics/comments/lqv57/marines_to_oakland_police_you_did_this_to_my/,t3_lqv57,1319720510,http://www.businessinsider.com/marine-to-police-you-did-this-to-my-brother-2011-10,,Dizzy_Slip,1319716910,19530,2418,,,ObjectID(51cd4024607d46e399000db2),0
4517,4517,online.wsj.com,,politics,,,,,1gljd0,False,"""Here's how terrorism really works: Slaughter people on national TV, and watch a nation that prides itself on freedom as it shackles itself.""",,3104,,False,False,,t5_2cneq,False,,,5613,False,False,/r/politics/comments/1gljd0/heres_how_terrorism_really_works_slaughter_people/,t3_1gljd0,1371606983,http://online.wsj.com/article/SB10001424127887323844804578531131808392240.html,,mellowmonk,1371578183,8717,1019,,,ObjectID(51cd4024607d46e399000dbe),0
4544,4544,krugman.blogs.nytimes.com,,politics,,,,,13rcsa,False,"Whenever you see some business person quoted complaining about how he or she can’t find workers with the necessary skills, ask what wage they’re offering.",,3102,,False,False,,t5_2cneq,False,,,7511,False,False,/r/politics/comments/13rcsa/whenever_you_see_some_business_person_quoted/,t3_13rcsa,1353852603,http://krugman.blogs.nytimes.com/2012/11/25/the-fake-skills-shortage/?smid=tw-NytimesKrugman&amp;seid=auto,,wang-banger,1353852603,10613,3246,,,ObjectID(51cd4024607d46e399000dd9),0
4554,4554,salon.com,,politics,,,,,11jcod,False,"Ohio soup kitchen slams Ryan: ""He did nothing""",,3097,,False,False,,t5_2cneq,False,,,5693,False,False,/r/politics/comments/11jcod/ohio_soup_kitchen_slams_ryan_he_did_nothing/,t3_11jcod,1350345142,http://www.salon.com/2012/10/15/ohio_soup_kitchen_slams_ryan_photo_op_he_did_nothing/,,gongabonga,1350341542,8790,803,,,ObjectID(51cd4024607d46e399000de3),0
4557,4557,latimesblogs.latimes.com,,politics,,,,,pexk3,False,"Prop. 8: Gay-marriage ban unconstitutional, court rules",,3091,,False,False,,t5_2cneq,False,,,24334,False,False,/r/politics/comments/pexk3/prop_8_gaymarriage_ban_unconstitutional_court/,t3_pexk3,1328637749,http://latimesblogs.latimes.com/lanow/2012/02/gay-marriage-prop-8s-ban-ruled-unconstitutional.html,,TheGhostOfNoLibs,1328637749,27425,3238,,,ObjectID(51cd4024607d46e399000de6),0
4562,4562,huffingtonpost.com,,politics,,,,,12rrmr,False,Todd Akin defeated by Claire McCaskill,,3092,,False,False,,t5_2cneq,False,,,4411,False,False,/r/politics/comments/12rrmr/todd_akin_defeated_by_claire_mccaskill/,t3_12rrmr,1352258568,http://www.huffingtonpost.com/2012/11/06/todd-akin-election-results-2012_n_2049695.html,,ckbrech,1352258568,7503,296,,,ObjectID(51cd4024607d46e399000deb),0
4582,4582,thenewcivilrightsmovement.com,,politics,,,,,mil4w,False,"""When students covered their eyes with clothing, police forced open their mouths and pepper-sprayed down their throats."" Junior faculty member at UC Davis writes open letter to Chancellor Linda P.B. Katehi recounting the horrible acts of police brutality at the OWS protest on campus.",,3087,,False,False,,t5_2cneq,False,,,11614,False,False,/r/politics/comments/mil4w/when_students_covered_their_eyes_with_clothing/,t3_mil4w,1321753104,http://thenewcivilrightsmovement.com/uc-davis-professor-demands-chancellor-resign-over-pepper-spraying-of-students/news/2011/11/19/30450#.TshZ_3M4OAE,,[deleted],1321753104,14701,1905,,,ObjectID(51cd4024607d46e399000dff),0
4591,4591,pcworld.com,,politics,,,,,9x1uk,False,"Why is John McCain, who admits to not even knowing how to operate a computer, now introducing a bill to block net neutrality rules?",,3084,,False,False,,t5_2cneq,False,,,1497,False,False,/r/politics/comments/9x1uk/why_is_john_mccain_who_admits_to_not_even_knowing/,t3_9x1uk,1256313356,http://www.pcworld.com/businesscenter/article/174221/mccain_moves_to_block_fcc_net_neutrality.html,,[deleted],1256309756,4581,609,,,ObjectID(51cd4024607d46e399000e08),0
4599,4599,self.politics,,politics,"&lt;!-- SC_OFF --&gt;&lt;div class=""md""&gt;&lt;p&gt;He said this in 2008, but to hear Ryan discuss his values, then to see his actual budget, I found this quote quite apt. Looking at the meat of a plan rather than the talk surrounding it is a very pragmatic outlook.&lt;/p&gt;

&lt;p&gt;Edit: For &lt;a href=""http://www.whitehouse.gov/omb/budget""&gt;comparison&lt;/a&gt;&lt;/p&gt;
&lt;/div&gt;&lt;!-- SC_ON --&gt;","He said this in 2008, but to hear Ryan discuss his values, then to see his actual budget, I found this quote quite apt. Looking at the meat of a plan rather than the talk surrounding it is a very pragmatic outlook.

Edit: For [comparison](http://www.whitehouse.gov/omb/budget)",,,y3x59,False,"Joe Biden quote: “Don't tell me what you value, show me your budget, and I'll tell you what you value.”",,3095,,False,False,,t5_2cneq,True,,,15508,False,True,/r/politics/comments/y3x59/joe_biden_quote_dont_tell_me_what_you_value_show/,t3_y3x59,1344808638,http://www.reddit.com/r/politics/comments/y3x59/joe_biden_quote_dont_tell_me_what_you_value_show/,,jamestown112,1344805038,18603,2447,,,ObjectID(51cd4024607d46e399000e10),0
4601,4601,justsaynow.firedoglake.com,,politics,,,,,17p8hs,False,Americans Overwhelmingly Want Feds to Let States Move Forward With Marijuana Legalization,,3086,,False,False,,t5_2cneq,False,,,21219,False,False,/r/politics/comments/17p8hs/americans_overwhelmingly_want_feds_to_let_states/,t3_17p8hs,1359736514,http://justsaynow.firedoglake.com/2013/02/01/americans-overwhelmingly-want-feds-to-let-states-move-forward-with-marijuana-legalization/,,twolf1,1359736514,24305,2186,,,ObjectID(51cd4029607d46e399000e12),0
4621,4621,kpic.com,,politics,,,,,15ven4,False,Oregon wants to add a mileage tax to energy efficient cars that get over 55 mpg to offset the loss in revenue from taxes on gasoline.,,3093,,False,False,,t5_2cneq,False,,,6351,False,False,/r/politics/comments/15ven4/oregon_wants_to_add_a_mileage_tax_to_energy/,t3_15ven4,1357189902,http://www.kpic.com/news/local/185498072.html,,Disco_Drew,1357189902,9444,3014,,,ObjectID(51cd4029607d46e399000e26),0
4648,4648,rollingstone.com,,politics,,,,,1b3tch,False,"Cruel and Unusual Punishment: The Shame of Three Strikes Laws. While Wall Street crooks walk, thousands sit in California prisons for life over crimes as trivial as stealing socks",,3085,,False,False,,t5_2cneq,False,,,7028,False,False,/r/politics/comments/1b3tch/cruel_and_unusual_punishment_the_shame_of_three/,t3_1b3tch,1364390042,http://www.rollingstone.com/politics/news/cruel-and-unusual-punishment-the-shame-of-three-strikes-laws-20130327,,Libertatea,1364386442,10113,1287,,,ObjectID(51cd4029607d46e399000e41),0
4654,4654,conceptualmath.org,,politics,,,,,11ok1e,False,"""Overall, higher taxes on the rich historically have correlated to higher economic growth for the country. It's counterintuitive, but it is the historical fact.""",,3084,,False,False,,t5_2cneq,False,,,5988,False,False,/r/politics/comments/11ok1e/overall_higher_taxes_on_the_rich_historically/,t3_11ok1e,1350555926,http://conceptualmath.org/philo/taxgrowth.htm,,mork_from_blork,1350552326,9072,2653,,,ObjectID(51cd4029607d46e399000e47),0
4656,4656,megrobertson.com,,politics,,,,,je1i6,False,"Dylan Ratigan lost his cool on his show today, and it was a beauty to watch. A 5 min unabashed honest rant on the corruption of the American political system and how our country is being sucked dry by banks, congress and an unfair tax system.",,3083,,False,False,,t5_2cneq,False,,,9803,False,False,/r/politics/comments/je1i6/dylan_ratigan_lost_his_cool_on_his_show_today_and/,t3_je1i6,1312938093,http://www.megrobertson.com/post/8708219865/dylan-ratigan-mad-as-hell-his-epic-network-moment,,[deleted],1312934493,12886,2057,,,ObjectID(51cd4029607d46e399000e49),0
4671,4671,dailykos.com,,politics,,,,,1fxeb8,False,"Americans Are Outraged Because in Voting for Obama, They Thought They Were Rejecting Bush",,3081,,False,False,,t5_2cneq,False,,,8756,False,False,/r/politics/comments/1fxeb8/americans_are_outraged_because_in_voting_for/,t3_1fxeb8,1370706250,http://www.dailykos.com/story/2013/06/08/1214650/-Americans-Are-Outraged-Because-in-Voting-for-Obama-They-Thought-They-Were-Rejecting-Bush,,this_too_shall_pass_,1370702650,11837,2012,,,ObjectID(51cd4029607d46e399000e58),0
4680,4680,thelede.blogs.nytimes.com,,politics,,,,,1175ep,False,"""27% of Americans knew that the money for PBS and NPR was &lt;1% of government spending. Remarkably, 40% guessed that the share was between 1 and 5% and 30% said it was in excess of 5% — including 7% who said that more than half of the federal budget was spent on television and radio broadcasts.""",,3079,,False,False,,t5_2cneq,False,,,7439,False,False,/r/politics/comments/1175ep/27_of_americans_knew_that_the_money_for_pbs_and/,t3_1175ep,1349798944,http://thelede.blogs.nytimes.com/2012/10/05/romneys-attack-on-big-bird-sows-confusion-abroad-and-feeds-it-at-home/?smid=tw-share,,mlurve,1349795344,10518,1511,,,ObjectID(51cd4029607d46e399000e61),0
4683,4683,self.politics,,politics,,,,,glqji,False,"The US budget is like a 1st grader playing Oregon Trail. Spend all the money on ammunition so you can shoot at stuff, then wonder why your wagon is falling apart and everyone is dying of dysentery",,3077,,False,False,,t5_2cneq,False,,,9346,False,True,/r/politics/comments/glqji/the_us_budget_is_like_a_1st_grader_playing_oregon/,t3_glqji,1302298360,http://www.reddit.com/r/politics/comments/glqji/the_us_budget_is_like_a_1st_grader_playing_oregon/,,Malhavoc430,1302294760,12423,691,,,ObjectID(51cd4029607d46e399000e64),0
4686,4686,guardian.co.uk,,politics,,,,,1auti8,False,"
NYPD officers testify stop-and-frisk policy driven by quota system and race: Officer secretly recorded conversation with his supervisor in which he is apparently told to target 'male blacks 14 to 21'
",,3077,,False,False,,t5_2cneq,False,,,9438,False,False,/r/politics/comments/1auti8/nypd_officers_testify_stopandfrisk_policy_driven/,t3_1auti8,1364045352,http://www.guardian.co.uk/world/2013/mar/22/nypd-stop-frisk-quota-race,,maxwellhill,1364041752,12515,2214,,,ObjectID(51cd4029607d46e399000e67),0
4699,4699,alternet.org,,politics,,,,,14ub9r,False,"Matt Taibbi: You Can Go to Prison for Pot, While Big Banks Get Away With Laundering Drug Cartel Cash ",,3077,,False,False,,t5_2cneq,False,,,2434,False,False,/r/politics/comments/14ub9r/matt_taibbi_you_can_go_to_prison_for_pot_while/,t3_14ub9r,1355492572,http://www.alternet.org/matt-taibbi-you-can-go-prison-pot-while-big-banks-get-away-laundering-drug-cartel-cash?paging=off,,DesignNoobie99,1355492572,5511,244,,,ObjectID(51cd4029607d46e399000e74),0
4701,4701,businessinsider.com,,politics,,,,,1cbz6q,False,America's Prison System Is An International Embarrassment,,3075,,False,False,,t5_2cneq,False,,,8711,False,False,/r/politics/comments/1cbz6q/americas_prison_system_is_an_international/,t3_1cbz6q,1365962227,http://www.businessinsider.com/ending-our-incarceration-nation-2013-4,,caferrell,1365958627,11786,1425,,,ObjectID(51cd402e607d46e399000e76),0
4706,4706,kansascity.com,,politics,,,,,10r6k0,False,Member of the Westboro Baptist Church is running for Kansas State Board of Education seat,,3083,,False,False,,t5_2cneq,False,,,4058,False,False,/r/politics/comments/10r6k0/member_of_the_westboro_baptist_church_is_running/,t3_10r6k0,1349089969,http://www.kansascity.com/2012/10/01/3842007/westboro-attendee-running-for.html,,Citisol,1349086369,7141,584,,,ObjectID(51cd402e607d46e399000e7b),0
4718,4718,youtube.com,,politics,,,,,13e9zt,False,"Netanyahu speaking candidly, not realizing cameras are on: ""America won't get in our way, it's easily moved.""","{ ""type"" : ""youtube.com"", ""oembed"" : { ""author_url"" : ""http://www.youtube.com/user/EncryptedReality4"", ""thumbnail_height"" : 360, ""thumbnail_url"" : ""http://i3.ytimg.com/vi/JrtuBas3Ipw/hqdefault.jpg"", ""provider_name"" : ""YouTube"", ""version"" : ""1.0"", ""thumbnail_width"" : 480, ""html"" : ""&lt;iframe width=\""600\"" height=\""338\"" src=\""http://www.youtube.com/embed/JrtuBas3Ipw?fs=1&amp;feature=oembed\"" frameborder=\""0\"" allowfullscreen&gt;&lt;/iframe&gt;"", ""width"" : 600, ""height"" : 338, ""author_name"" : ""EncryptedReality4"", ""type"" : ""video"", ""url"" : ""http://www.youtube.com/watch?v=JrtuBas3Ipw"", ""title"" : ""Netanyahu Unaware of Camera"", ""description"" : ""Netanyahu 'America Won't Get in Our Way..It's Easily Moved (Bibi thought the camera stopped recording) Israel Prime Minister Benjamin (Bibi) Netanyahu addressed the General Assembly of the United Nations on Iran full VIDEO http://www.youtube.com/watch?v=JaIQHWfj5f4"", ""provider_url"" : ""http://www.youtube.com/"" } }",3079,,False,False,,t5_2cneq,False,,,12405,False,False,/r/politics/comments/13e9zt/netanyahu_speaking_candidly_not_realizing_cameras/,t3_13e9zt,1353241693,https://www.youtube.com/watch?v=JrtuBas3Ipw,,BanX,1353241693,15484,3537,,,ObjectID(51cd402e607d46e399000e87),0
4732,4732,tpmdc.talkingpointsmemo.com,,politics,,,,,130dtz,False,Obama To Boehner: Higher Taxes On The Wealthy Or The Bush Tax Cuts Expir,,3075,,False,False,,t5_2cneq,False,,,6534,False,False,/r/politics/comments/130dtz/obama_to_boehner_higher_taxes_on_the_wealthy_or/,t3_130dtz,1352645073,http://tpmdc.talkingpointsmemo.com/2012/11/obama-to-boehner-higher-taxes-on-the-wealthy-or-the-bush-tax-cuts-expire.php,,JJFFMM,1352645073,9609,2338,,,ObjectID(51cd402e607d46e399000e95),0
4770,4770,nytimes.com,,politics,,,,,12srob,False,"""The G.O.P. has lost two presidential elections in a row because it forced its candidate to run so far to the loony right to get through the primaries, dominated by its ultraconservative base"" - Thomas Friedman",,3070,,False,False,,t5_2cneq,False,,,6895,False,False,/r/politics/comments/12srob/the_gop_has_lost_two_presidential_elections_in_a/,t3_12srob,1352300404,http://www.nytimes.com/2012/11/07/opinion/friedman-hope-and-change-part-two.html?hp,,DerekReinbold,1352300404,9965,1404,,,ObjectID(51cd402e607d46e399000ebb),0
4772,4772,thedailybeast.com,,politics,,,,,10mzbw,False,"""On a rough estimate, it would only take $70 billion of the federal budget to cover the tuition costs at every two- and four-year public college. This happens to be the sum the Pentagon wastes annually in 'unaccountable spending.'""",,3074,,False,False,,t5_2cneq,False,,,6899,False,False,/r/politics/comments/10mzbw/on_a_rough_estimate_it_would_only_take_70_billion/,t3_10mzbw,1348869536,http://www.thedailybeast.com/articles/2012/09/27/nyu-professor-are-student-loans-immoral.html,,sadmoviedave,1348865936,9973,1489,,,ObjectID(51cd402e607d46e399000ebd),0
4775,4775,salon.com,,politics,,,,,1gkvj7,False,Bank of America whistle-blowers: “We were told to lie”,,3066,,False,False,,t5_2cneq,False,,,4342,False,False,/r/politics/comments/1gkvj7/bank_of_america_whistleblowers_we_were_told_to_lie/,t3_1gkvj7,1371585949,http://www.salon.com/2013/06/18/bank_of_america_whistleblowers_bombshell_we_were_told_to_lie/,,geargirl,1371557149,7408,457,,,ObjectID(51cd402e607d46e399000ec0),0
4790,4790,salon.com,,politics,,,,,12xf6i,False,White House: Obama will veto any bill extending tax cuts for those making more than $250K ,,3069,,False,False,,t5_2cneq,False,,,10722,False,False,/r/politics/comments/12xf6i/white_house_obama_will_veto_any_bill_extending/,t3_12xf6i,1352490075,http://www.salon.com/2012/11/09/white_house_obama_will_veto_any_bill_extending_tax_cuts_for_those_making_more_than_250k/singleton/,,mosstacean,1352490075,13791,2002,,,ObjectID(51cd402e607d46e399000ecf),0
4800,4800,mediaite.com,,politics,,,,,1clksl,False,Jon Stewart Tears Apart CNN For ‘Completely F*cking Wrong’ Boston Reporting: ‘Human Centipede Of News’,,3063,,False,False,,t5_2cneq,False,,,16292,False,False,/r/politics/comments/1clksl/jon_stewart_tears_apart_cnn_for_completely_fcking/,t3_1clksl,1366286686,http://www.mediaite.com/tv/stewart-tears-apart-cnn-for-completely-fcking-wrong-boston-reporting-human-centipede-of-news/,,ExeKution,1366283086,19355,1318,,,ObjectID(51cd4033607d46e399000ed9),0
4801,4801,search.wikileaks.org,,politics,,,,,1bwa6z,False,"Wikileaks releases ""Kissinger Cables"" with 2 million documents.",,3067,,False,False,,t5_2cneq,False,,,4427,False,False,/r/politics/comments/1bwa6z/wikileaks_releases_kissinger_cables_with_2/,t3_1bwa6z,1365396293,https://search.wikileaks.org/plusd/pressrelease/?nocache,,Hrodrik,1365392693,7494,724,,,ObjectID(51cd4033607d46e399000eda),0
