,Unnamed: 0,domain,banned_by,subreddit,selftext_html,selftext,likes,link_flair_text,id,clicked,title,media,score,approved_by,over_18,hidden,thumbnail,subreddit_id,edited,link_flair_css_class,author_flair_css_class,downs,saved,is_self,permalink,name,created,url,author_flair_text,author,created_utc,ups,num_comments,num_reports,distinguished,_id,__v
47,47,self.politics,,politics,,,,,7beo2,False,Obama wins the Presidency!,,8529,,False,False,,t5_2cneq,False,,,1173,False,True,/r/politics/comments/7beo2/obama_wins_the_presidency/,t3_7beo2,1225857637,http://www.reddit.com/r/politics/comments/7beo2/obama_wins_the_presidency/,,willjohnston,1225857637,9702,1961,,,ObjectID(51cd3dcc771f93c199000030),0
87,87,self.politics,,politics,"&lt;!-- SC_OFF --&gt;&lt;div class=""md""&gt;&lt;p&gt;Surprise, surprise, with 0 republican votes in favor. Who needs &amp;#39;em?&lt;/p&gt;

&lt;p&gt;P.S.For those who missed it, 219 votes in favor vs. 212 against in the House.&lt;/p&gt;

&lt;p&gt;P.P.S. Second vote has already passed 232 against altering the bill vs. 192 for changing it (or if you like, the motion technically failed for changing the bill. I just prefer the positive phrasing more).&lt;/p&gt;

&lt;p&gt;P.P.S. And.... that makes the final vote passed at 220 vs. 211!&lt;/p&gt;

&lt;hr/&gt;

&lt;p&gt;Edit: As far as the Republicans go, I don&amp;#39;t actually mean them any harm. It was just too easy to jest a bit in light-hearted celebration. :)&lt;/p&gt;

&lt;p&gt;Final edit (I think): If you missed all this as it happened, &lt;a href=""http://www.reddit.com/r/politics/comments/bgchp/for_the_first_time_ever_im_watching_cspan_at/""&gt;this thread&lt;/a&gt; has some great coverage and commentary on the debate &amp;amp; voting as it happened! &lt;/p&gt;

&lt;p&gt;Also, &lt;a href=""http://www.reddit.com/r/politics/comments/bge1p/the_health_bill_has_passed/c0mncdn?context=3""&gt;Obama was speaking live about the bill&lt;/a&gt;. If anyone else has a recording, please post it!&lt;/p&gt;

&lt;p&gt;Update: &lt;a href=""http://www.reddit.com/r/AskReddit/comments/bgemw/so_healthcare_has_passed_can_someone/""&gt;This thread&lt;/a&gt; on r/AskReddit has some good explanations of what this bill means specifically.&lt;/p&gt;

&lt;hr/&gt;

&lt;p&gt;For anyone who&amp;#39;s not sure what&amp;#39;s going on, this was just the bill passing in the House of Representatives. Things still have to go back to the Senate. That said, we&amp;#39;re definitely looking at a historic moment.&lt;/p&gt;
&lt;/div&gt;&lt;!-- SC_ON --&gt;","Surprise, surprise, with 0 republican votes in favor. Who needs 'em?

P.S.For those who missed it, 219 votes in favor vs. 212 against in the House.

P.P.S. Second vote has already passed 232 against altering the bill vs. 192 for changing it (or if you like, the motion technically failed for changing the bill. I just prefer the positive phrasing more).

P.P.S. And.... that makes the final vote passed at 220 vs. 211!

----------

Edit: As far as the Republicans go, I don't actually mean them any harm. It was just too easy to jest a bit in light-hearted celebration. :)

Final edit (I think): If you missed all this as it happened, [this thread](http://www.reddit.com/r/politics/comments/bgchp/for_the_first_time_ever_im_watching_cspan_at/) has some great coverage and commentary on the debate &amp; voting as it happened! 

Also, [Obama was speaking live about the bill](http://www.reddit.com/r/politics/comments/bge1p/the_health_bill_has_passed/c0mncdn?context=3). If anyone else has a recording, please post it!

Update: [This thread](http://www.reddit.com/r/AskReddit/comments/bgemw/so_healthcare_has_passed_can_someone/) on r/AskReddit has some good explanations of what this bill means specifically.

----------

For anyone who's not sure what's going on, this was just the bill passing in the House of Representatives. Things still have to go back to the Senate. That said, we're definitely looking at a historic moment.",,,bge1p,False,The health bill has PASSED!,,7253,,False,False,,t5_2cneq,True,,,5285,False,True,/r/politics/comments/bge1p/the_health_bill_has_passed/,t3_bge1p,1269229498,http://www.reddit.com/r/politics/comments/bge1p/the_health_bill_has_passed/,,thingamagizmo,1269225898,12538,4445,,,ObjectID(51cd3dcc771f93c199000058),0
158,158,self.politics,,politics,"&lt;!-- SC_OFF --&gt;&lt;div class=""md""&gt;&lt;p&gt;I was woken in the middle of the night by this(along with the sound of my cat getting ready to pee on the rug).&lt;/p&gt;

&lt;p&gt;Think about it. It&amp;#39;ll be just like Colbert&amp;#39;s mockery of GW Bush at the 2006 White House Correspondent&amp;#39;s Dinner, but 500,000 people will be able to participate with him. We&amp;#39;ll all stay totally in character as teabaggers. The kid with the microphone that interviews all the idiots at these things can come by and we&amp;#39;ll ramble into his microphone.&lt;/p&gt;

&lt;p&gt;This would be the high water mark of American satire. Half a million people pretending to suspend all rational thought in unison. Perfect harmony. It&amp;#39;ll feel like San Francisco in the late 60s, only we won&amp;#39;t be able to get any acid.&lt;/p&gt;

&lt;p&gt;I know you&amp;#39;re out there somewhere, Stephen, watching LOLcat gifs along side us. We need you. There&amp;#39;s no way to have a logical public discussion with the teabaggers. The best we can do is to mimic them. Show them a mirror and hopefully some will realize how ridiculous they actually are... Or maybe they won&amp;#39;t even realize that they&amp;#39;re being mocked, which could be even more awesome.&lt;/p&gt;

&lt;p&gt;Note: This is a repost. First one never popped into New.&lt;/p&gt;

&lt;p&gt;&lt;strong&gt;EDIT(Finally): The response to this post has blown my mind. I really did jump out of bed at like 5AM and type this thing up. Then I checked from work and it&amp;#39;s front page and there&amp;#39;s a Facebook page and people are emailing one of the Executive Producers. I was just hoping some people would get a laugh out of it, and now it has over 6,800 upvotes? It&amp;#39;s like I cracked the best joke of my life in a public place. :D&lt;/strong&gt;&lt;/p&gt;

&lt;p&gt;*&lt;em&gt;But to be fair, both pugsworth and hobbit6 posted the general idea before me in that Jon Stewart thread. I just fleshed it out a little bit. Anyway, I don&amp;#39;t really know what to do or say about actually trying to make a Colbert Rally happen. I&amp;#39;d sure as hell be there, and I think I&amp;#39;d opt for the &amp;quot;Go back to the rug store with the rest of the Afghans&amp;quot; sign. *&lt;/em&gt;&lt;/p&gt;

&lt;p&gt;&lt;strong&gt;I just wanted to say that I&amp;#39;m really happy that so many people got a kick out of it. And the thought of Colbert himself actually maybe seeing this is probably the coolest thing that&amp;#39;s ever happened to me so far in life.&lt;/strong&gt;&lt;/p&gt;

&lt;p&gt;&lt;strong&gt;EDIT 2: vinhboy has created a wikia page... &lt;a href=""http://www.colbertrally.com/""&gt;http://www.colbertrally.com/&lt;/a&gt;  Nothing up on it yet, though. Please feel free to change that!&lt;/strong&gt;&lt;/p&gt;
&lt;/div&gt;&lt;!-- SC_ON --&gt;","I was woken in the middle of the night by this(along with the sound of my cat getting ready to pee on the rug).

Think about it. It'll be just like Colbert's mockery of GW Bush at the 2006 White House Correspondent's Dinner, but 500,000 people will be able to participate with him. We'll all stay totally in character as teabaggers. The kid with the microphone that interviews all the idiots at these things can come by and we'll ramble into his microphone.

This would be the high water mark of American satire. Half a million people pretending to suspend all rational thought in unison. Perfect harmony. It'll feel like San Francisco in the late 60s, only we won't be able to get any acid.

I know you're out there somewhere, Stephen, watching LOLcat gifs along side us. We need you. There's no way to have a logical public discussion with the teabaggers. The best we can do is to mimic them. Show them a mirror and hopefully some will realize how ridiculous they actually are... Or maybe they won't even realize that they're being mocked, which could be even more awesome.

Note: This is a repost. First one never popped into New.

**EDIT(Finally): The response to this post has blown my mind. I really did jump out of bed at like 5AM and type this thing up. Then I checked from work and it's front page and there's a Facebook page and people are emailing one of the Executive Producers. I was just hoping some people would get a laugh out of it, and now it has over 6,800 upvotes? It's like I cracked the best joke of my life in a public place. :D**

**But to be fair, both pugsworth and hobbit6 posted the general idea before me in that Jon Stewart thread. I just fleshed it out a little bit. Anyway, I don't really know what to do or say about actually trying to make a Colbert Rally happen. I'd sure as hell be there, and I think I'd opt for the ""Go back to the rug store with the rest of the Afghans"" sign. **

**I just wanted to say that I'm really happy that so many people got a kick out of it. And the thought of Colbert himself actually maybe seeing this is probably the coolest thing that's ever happened to me so far in life.**


**EDIT 2: vinhboy has created a wikia page... http://www.colbertrally.com/  Nothing up on it yet, though. Please feel free to change that!**",,,d7ntl,False,I've had a vision and I can't shake it: Colbert needs to hold a satirical rally in DC.,,6365,,False,False,,t5_2cneq,True,,,7011,False,True,/r/politics/comments/d7ntl/ive_had_a_vision_and_i_cant_shake_it_colbert/,t3_d7ntl,1283257195,http://www.reddit.com/r/politics/comments/d7ntl/ive_had_a_vision_and_i_cant_shake_it_colbert/,,mrsammercer,1283253595,13376,1355,,,ObjectID(51cd3dd1771f93c19900009f),0
160,160,msnbc.msn.com,,politics,,,,,aseuv,False,"Supreme Court ruling comes down - Corporations are people with free speech and the protected right to bribe politicians.  Let's not even pretend anymore folks, democracy in America is dead.",,6358,,False,False,,t5_2cneq,False,,,2310,False,False,/r/politics/comments/aseuv/supreme_court_ruling_comes_down_corporations_are/,t3_aseuv,1264087059,http://www.msnbc.msn.com/id/34822247/ns/politics-supreme_court/,,KingBeetle,1264087059,8668,2983,,,ObjectID(51cd3dd1771f93c1990000a1),0
331,331,theblaze.com,,politics,,,,,101wri,False,"Jon Stewart and Bill O'Reilly to hold 90 minute, live streaming debate on October 6",,5254,,False,False,,t5_2cneq,False,,,18141,False,False,/r/politics/comments/101wri/jon_stewart_and_bill_oreilly_to_hold_90_minute/,t3_101wri,1347932371,http://www.theblaze.com/blog/2012/09/17/bill-oreilly-jon-stewart-debate/,,LaimeJannister,1347928771,23395,1767,,,ObjectID(51cd3ddc771f93c19900014c),0
353,353,self.politics,,politics,"&lt;!-- SC_OFF --&gt;&lt;div class=""md""&gt;&lt;p&gt;i just finished writing GoDaddy a letter stating why I&amp;#39;m moving my small businesses 51 domains away from them, as well as my personal domains. I also pointed out that i transferred over 300 domains to them as a director of IT for a major American company.&lt;/p&gt;

&lt;p&gt;I&amp;#39;m suggesting Dec 29th as move your domain away from GoDaddy day because of their support of SOPA. Who&amp;#39;s with me?&lt;/p&gt;

&lt;p&gt;EDIT (Added Sources &amp;amp; Statements)&lt;/p&gt;

&lt;p&gt;Source:
&amp;quot;Go Daddy has a long history of supporting federal legislation directed toward combating illegal conduct on the Internet. For example, our company strongly supported the Ryan Haight Online Pharmacy Consumer Protection Act of 2008, the Protect Our Children Act of 2008, and the Preventing Real Online Threats to Economic Creativity and Theft of Intellectual Property Act of 2011 (PROTECT IP).  Go Daddy has always supported both government and private industry efforts to identify and disable all types of illegal activity on the Internet.  It is for these reasons that I’m still struggling with why some Internet companies oppose PROTECT IP and SOPA.  There is no question that we need these added tools to counteract illegal foreign sites that are falling outside the jurisdiction of U.S. law enforcement.  And there is clearly more that we could all be doing to adequately address the problems that exist.&amp;quot;&lt;/p&gt;

&lt;p&gt;&lt;a href=""http://www.thedomains.com/2011/11/15/here-is-godaddys-statement-in-support-of-the-stop-online-privacy-act-house-hearing-tomorrow/""&gt;http://www.thedomains.com/2011/11/15/here-is-godaddys-statement-in-support-of-the-stop-online-privacy-act-house-hearing-tomorrow/&lt;/a&gt;&lt;/p&gt;

&lt;p&gt;Name Cheap messaged me with a special discount code for reddit users: BYEBYEGD I&amp;#39;m not taking any positions i&amp;#39;m just reporting it. I asked him to give reddit users a better deal. &lt;/p&gt;

&lt;p&gt;EDIT: Name.com messaged me with this. use &amp;quot;NODADDY&amp;quot; for 10% off transfer ins (COM, NET, ORG, TV, INFO, IN, US, CO, ME &amp;amp; TEL) and also receive 40% off any of our hosting plans.
They also oppose sopa:&lt;a href=""http://blog.name.com/2011/12/getting-on-our-sopa-box-and-saving-you-money/""&gt;http://blog.name.com/2011/12/getting-on-our-sopa-box-and-saving-you-money/&lt;/a&gt;&lt;/p&gt;

&lt;p&gt;EDIT: HostGator is doing 50% off Shared / Reseller / VPS first month. Coupon code: NOSOPA 
&lt;a href=""http://blog.hostgator.com/2011/12/22/sopa-must-die/""&gt;http://blog.hostgator.com/2011/12/22/sopa-must-die/&lt;/a&gt; &lt;/p&gt;

&lt;p&gt;EDIT: &lt;a href=""http://blog.easydns.org/2011/12/22/how-sopa-will-destroy-the-internet/""&gt;http://blog.easydns.org/2011/12/22/how-sopa-will-destroy-the-internet/&lt;/a&gt; Another anti sopa registrar &lt;/p&gt;

&lt;p&gt;EDIT: Contact GoDaddy
Send your emails here: &lt;a href=""mailto:oop@godaddy.com""&gt;oop@godaddy.com&lt;/a&gt; (This is the &amp;quot;office of the president&amp;quot;, the highest non-corporate level you can talk to.) &lt;a href=""mailto:suggestions@godaddy.com""&gt;suggestions@godaddy.com&lt;/a&gt; (If this gets flooded they will take notice.) - from a fellow reddit user. I also emailed &lt;a href=""mailto:suggestions@godaddy.com""&gt;suggestions@godaddy.com&lt;/a&gt; before i ever posted this. &lt;/p&gt;

&lt;p&gt;Update: Looks like we got their attention: They posted this &lt;a href=""http://support.godaddy.com/godaddy/go-daddys-position-on-sopa""&gt;http://support.godaddy.com/godaddy/go-daddys-position-on-sopa&lt;/a&gt; today. It&amp;#39;s from &amp;quot;october&amp;quot; but it was posted today. &lt;/p&gt;

&lt;p&gt;NEW EDIT: I&amp;#39;ve been talking with a few organizations that suggest we keep the boycott going until, GoDaddy announces they are no longer in favor of the SOPA act. They are working to setup a domain, with facts, counters, and more. The holiday&amp;#39;s is going to make it a bit tough as our resources are limited because of family events but i will keep posting as it comes through. &lt;/p&gt;

&lt;p&gt;UPDATE: heezburger’s Ben Huh: If GoDaddy Supports SOPA, We’re Taking Our 1000+ Domains Elsewhere 
&lt;a href=""http://techcrunch.com/2011/12/22/cheezburgers-ben-huh-if-godaddy-supports-sopa-were-taking-our-1000-domains-elsewhere/""&gt;http://techcrunch.com/2011/12/22/cheezburgers-ben-huh-if-godaddy-supports-sopa-were-taking-our-1000-domains-elsewhere/&lt;/a&gt;&lt;/p&gt;

&lt;p&gt;UPDATE: Dont PISS OFF REDDIT:&lt;a href=""http://www.techdirt.com/articles/20111222/13292217173/sopa-supporters-learning-slowly-that-pissing-off-reddit-is-bad-idea.shtml""&gt;http://www.techdirt.com/articles/20111222/13292217173/sopa-supporters-learning-slowly-that-pissing-off-reddit-is-bad-idea.shtml&lt;/a&gt;&lt;/p&gt;

&lt;p&gt;FOR THE PEOPLE WHO ARE CALLING ME A LIAR.... HERE IS MY OUTLOOK INBOX &lt;a href=""http://i.imgur.com/cPkll.jpg""&gt;http://i.imgur.com/cPkll.jpg&lt;/a&gt; &lt;/p&gt;

&lt;p&gt;FINAL UPDATE:&lt;/p&gt;

&lt;p&gt;Pledge your support to boycott Godaddy here.
&lt;a href=""http://godaddyboycott.org""&gt;http://godaddyboycott.org&lt;/a&gt;&lt;/p&gt;
&lt;/div&gt;&lt;!-- SC_ON --&gt;","i just finished writing GoDaddy a letter stating why I'm moving my small businesses 51 domains away from them, as well as my personal domains. I also pointed out that i transferred over 300 domains to them as a director of IT for a major American company.

I'm suggesting Dec 29th as move your domain away from GoDaddy day because of their support of SOPA. Who's with me?

EDIT (Added Sources &amp; Statements)

Source:
""Go Daddy has a long history of supporting federal legislation directed toward combating illegal conduct on the Internet. For example, our company strongly supported the Ryan Haight Online Pharmacy Consumer Protection Act of 2008, the Protect Our Children Act of 2008, and the Preventing Real Online Threats to Economic Creativity and Theft of Intellectual Property Act of 2011 (PROTECT IP).  Go Daddy has always supported both government and private industry efforts to identify and disable all types of illegal activity on the Internet.  It is for these reasons that I’m still struggling with why some Internet companies oppose PROTECT IP and SOPA.  There is no question that we need these added tools to counteract illegal foreign sites that are falling outside the jurisdiction of U.S. law enforcement.  And there is clearly more that we could all be doing to adequately address the problems that exist.""

http://www.thedomains.com/2011/11/15/here-is-godaddys-statement-in-support-of-the-stop-online-privacy-act-house-hearing-tomorrow/

Name Cheap messaged me with a special discount code for reddit users: BYEBYEGD I'm not taking any positions i'm just reporting it. I asked him to give reddit users a better deal. 

EDIT: Name.com messaged me with this. use ""NODADDY"" for 10% off transfer ins (COM, NET, ORG, TV, INFO, IN, US, CO, ME &amp; TEL) and also receive 40% off any of our hosting plans.
They also oppose sopa:http://blog.name.com/2011/12/getting-on-our-sopa-box-and-saving-you-money/

EDIT: HostGator is doing 50% off Shared / Reseller / VPS first month. Coupon code: NOSOPA 
http://blog.hostgator.com/2011/12/22/sopa-must-die/ 

EDIT: http://blog.easydns.org/2011/12/22/how-sopa-will-destroy-the-internet/ Another anti sopa registrar 


EDIT: Contact GoDaddy
Send your emails here: oop@godaddy.com (This is the ""office of the president"", the highest non-corporate level you can talk to.) suggestions@godaddy.com (If this gets flooded they will take notice.) - from a fellow reddit user. I also emailed suggestions@godaddy.com before i ever posted this. 

Update: Looks like we got their attention: They posted this http://support.godaddy.com/godaddy/go-daddys-position-on-sopa today. It's from ""october"" but it was posted today. 



NEW EDIT: I've been talking with a few organizations that suggest we keep the boycott going until, GoDaddy announces they are no longer in favor of the SOPA act. They are working to setup a domain, with facts, counters, and more. The holiday's is going to make it a bit tough as our resources are limited because of family events but i will keep posting as it comes through. 


UPDATE: heezburger’s Ben Huh: If GoDaddy Supports SOPA, We’re Taking Our 1000+ Domains Elsewhere 
http://techcrunch.com/2011/12/22/cheezburgers-ben-huh-if-godaddy-supports-sopa-were-taking-our-1000-domains-elsewhere/

UPDATE: Dont PISS OFF REDDIT:http://www.techdirt.com/articles/20111222/13292217173/sopa-supporters-learning-slowly-that-pissing-off-reddit-is-bad-idea.shtml

FOR THE PEOPLE WHO ARE CALLING ME A LIAR.... HERE IS MY OUTLOOK INBOX http://i.imgur.com/cPkll.jpg 

FINAL UPDATE:

Pledge your support to boycott Godaddy here.
http://godaddyboycott.org

",,,nmnie,False,"GoDaddy supports SOPA, I'm transferring 51 domains &amp; suggesting a move your domain day",,5210,,False,False,,t5_2cneq,True,,,32186,False,True,/r/politics/comments/nmnie/godaddy_supports_sopa_im_transferring_51_domains/,t3_nmnie,1324565751,http://www.reddit.com/r/politics/comments/nmnie/godaddy_supports_sopa_im_transferring_51_domains/,,selfprodigy,1324565751,37396,3037,,,ObjectID(51cd3ddc771f93c199000162),0
399,399,rawstory.com,,politics,,,,,1a4cnt,False,House Democrats demand Obama release ‘full legal basis’ for drone strikes,,5045,,False,False,,t5_2cneq,False,,,4762,False,False,/r/politics/comments/1a4cnt/house_democrats_demand_obama_release_full_legal/,t3_1a4cnt,1363056014,http://www.rawstory.com/rs/2013/03/11/house-democrats-demand-obama-release-full-legal-basis-for-drone-strikes/,,RomneysBainer,1363052414,9807,1607,,,ObjectID(51cd3ddc771f93c199000190),0
436,436,self.politics,,politics,,,,,70b2f,False,Is there anyone else out there that wants to see the debates be moderated by Jon Stewart?,,4963,,False,False,,t5_2cneq,False,,,1114,False,True,/r/politics/comments/70b2f/is_there_anyone_else_out_there_that_wants_to_see/,t3_70b2f,1220896347,http://www.reddit.com/r/politics/comments/70b2f/is_there_anyone_else_out_there_that_wants_to_see/,,maefly2,1220892747,6077,493,,,ObjectID(51cd3de0771f93c1990001b5),0
444,444,colbertsuperpac.com,,politics,,,,,14u7pd,False,"Colbert donates remaining $773,704.83 from his Super PAC to Sandy relief, soldier aid, and political transparency groups!",,4938,,False,False,,t5_2cneq,False,,,17284,False,False,/r/politics/comments/14u7pd/colbert_donates_remaining_77370483_from_his_super/,t3_14u7pd,1355485712,http://www.colbertsuperpac.com/archive/121312.html,,obsa,1355485712,22222,811,,,ObjectID(51cd3de0771f93c1990001bd),0
472,472,self.politics,,politics,"&lt;!-- SC_OFF --&gt;&lt;div class=""md""&gt;&lt;p&gt;Pros or cons?&lt;/p&gt;
&lt;/div&gt;&lt;!-- SC_ON --&gt;",Pros or cons?,,,yv4a1,False,"IBM's Watson should co-host a presidential debate, and fact-check the shit out of it in real-time.",,4860,,False,False,,t5_2cneq,True,,,25251,False,True,/r/politics/comments/yv4a1/ibms_watson_should_cohost_a_presidential_debate/,t3_yv4a1,1346012229,http://www.reddit.com/r/politics/comments/yv4a1/ibms_watson_should_cohost_a_presidential_debate/,,ornatedwithwater,1346008629,30111,1742,,,ObjectID(51cd3de0771f93c1990001d9),0
476,476,motherjones.com,,politics,,,,,101fk5,False,"SECRET ROMNEY TAPE: 47% of Americans ""with"" Obama are ""dependent upon govt"" and ""believe that they are victims.""",,4856,,False,False,,t5_2cneq,False,,,19018,False,False,/r/politics/comments/101fk5/secret_romney_tape_47_of_americans_with_obama_are/,t3_101fk5,1347916297,http://www.motherjones.com/politics/2012/09/secret-video-romney-private-fundraiser,,Chenzorama,1347912697,23874,5446,,,ObjectID(51cd3de0771f93c1990001dd),0
484,484,specialolympicsblog.wordpress.com,,politics,,,,,11zc4u,False,Man with Downs Syndrome elegantly responds to Ann Coulter calling President Obama a retard,,4829,,False,False,,t5_2cneq,False,,,22190,False,False,/r/politics/comments/11zc4u/man_with_downs_syndrome_elegantly_responds_to_ann/,t3_11zc4u,1351045786,http://specialolympicsblog.wordpress.com/2012/10/23/an-open-letter-to-ann-coulter/,,ThatFifthDentist,1351042186,27019,2307,,,ObjectID(51cd3de0771f93c1990001e5),0
488,488,nevadaappeal.com,,politics,,,,,12s9wx,False,"Puerto Rico has voted to join the union. It is to be the 51st state after congressional approval, making it the first to do so in 53 years.",,4820,,False,False,,t5_2cneq,False,,,14002,False,False,/r/politics/comments/12s9wx/puerto_rico_has_voted_to_join_the_union_it_is_to/,t3_12s9wx,1352271364,http://www.nevadaappeal.com/article/20121106/API/1211060708&amp;ParentProfile=1058,,iffraz,1352271364,18822,2586,,,ObjectID(51cd3de0771f93c1990001e9),0
522,522,fox4kc.com,,politics,,,,,1509iy,False,Kansans sign petion to classify Westboro Baptist as a hate group and be stripped of tax exempt status,,4755,,False,False,,t5_2cneq,False,,,33368,False,False,/r/politics/comments/1509iy/kansans_sign_petion_to_classify_westboro_baptist/,t3_1509iy,1355772034,http://fox4kc.com/2012/12/17/westboro-meets-its-match-thousands-sign-retaliatory-petitions/,,canhazhotness,1355772034,38123,2562,,,ObjectID(51cd3de5771f93c19900020b),0
534,534,politico.com,,politics,,,,,9j036,False,"The guy who yelled ""You lie!"" during President Obamas speech was Rep. Joe Wilson, Republican of South Carolina. Eight years of George W. Bush and no Democrat EVER disrupted any of his addresses to Congress",,4724,,False,False,,t5_2cneq,False,,,1899,False,False,/r/politics/comments/9j036/the_guy_who_yelled_you_lie_during_president/,t3_9j036,1252547330,http://www.politico.com/blogs/glennthrush/0909/The_guy_who_yelled_You_lie.html,,00boyina,1252543730,6623,2061,,,ObjectID(51cd3de5771f93c199000217),0
589,589,rollingstone.com,,politics,,,,,175zgc,False,"Why Did the Justice System Target Aaron Swartz? - The  absurdity of HSBC bankers skating on serious drug money laundering charges while the Secret Service hunts down a 26-yr-old for downloading too many scholarly articles is an example of our justice system's chillingly warped priorities.



",,4588,,False,False,,t5_2cneq,False,,,20216,False,False,/r/politics/comments/175zgc/why_did_the_justice_system_target_aaron_swartz/,t3_175zgc,1358995666,http://www.rollingstone.com/politics/news/why-did-the-justice-system-target-aaron-swartz-20130123,,anutensil,1358995666,24804,1858,,,ObjectID(51cd3de5771f93c19900024e),0
