,kmeans,nouns
0,8,playing game civilization ii years result
36,8,weird shit game playing ( spongebob battle bikini bottom )
73,8,picture playing n64 time
170,8,lost pounds ( lbs lbs ) year playing video games set-up time
206,8,was playing skyrim comprehend logic
276,8,lizard playing video games
365,8,turns playing dishonored
492,8,remember playing years time story everyone arcade cabinet !
520,8,playing rome war 'm
598,8,microsoft confirms xbox perform online checks hours playing console
790,8,playing fifa demo
830,8,playing hours happy man
938,8,borderlands disc tray broke 'm playing game
964,8,picture tupac shakur suge knight playing sonic hedgehog
1003,8,playing draw something lunch breaks
1090,8,dad playing spent time character editor
1130,8,shoot playing online
1133,8,playing dishonored
1140,8,playing everyday night
1145,8,playing time american
1181,8,binoculars playing god war ascension
1205,8,was playing cause
1211,8,playing skyrim forgot done months !
1292,8,started playing mafia ii whole way
1302,8,stress vs time whilst playing snake
1327,8,playing chivalry friend something view
1364,8,made dad christmas hope likes playing beginning
1414,8,/v/ playing cry
1447,8,playing bf copy bioshock time
1513,8,brit playing games american cars
1552,8,was playing saints row
1556,8,time start playing diablo
1591,8,playing level [ crysis ]
1614,8,piece advice folk playing
1669,8,athletes gamers ! buffalo bills rookies store hundreds dollars worth retro stuff super smash bros melee sneak playing
1688,8,playing night days
1726,8,think playing skyrim ( )
1775,8,ocd game playing
1830,8,got glitch playing me3
1840,8,forgot playing enter morph ball zone
1852,8,playing skyrim playing ac3
1859,8,dad playing gamecube time happy father day mario kart dash partner !
1909,8,playing animal ( ) morning !
1964,8,thoughts playing cry playing skyrim
1977,8,think childhood friend crappy controller get playing
2008,8,handheld game collection volt batteries playing
2018,8,happens tell daughter stop playing minecraft something
2093,8,redditor playing new vegas
2114,8,draw playing bioshock infinite game man suffering disorder
2214,8,friends playing age empires ii game [ oc ]
2373,8,mindset playing dead space game
2416,8,playing play
2437,8,friend sent playing drawsomething
2478,8,man wiiu playing home
2504,8,playing cry
2515,8,something dragon dogma someone spent hours playing skyrim
2524,8,was playing plague inc
2546,8,was playing jak daxter
2555,8,game shame playing [ ]
2598,8,year valve scare shit anyone playing games
2608,8,playing red dead redemption landon ricketts wheel
2663,8,boston feel 'm playing this..
2761,8,imagination/reality playing assassin creed
2854,8,playing putt putt golf family sudden guys game
2861,8,playing sims
2909,8,was pictures christmas morning years playing game legend zelda links
2932,8,thing think playing naval battles ac iii
2981,8,playing skylanders giants
3023,8,shitty laptop playing deadspace phone
3073,8,mom aunt playing atari system
3090,8,think playing cry ( spoiler )
3096,8,worst part playing skyrim console
3114,8,resist playing face
3138,8,playing crash tag-team
3143,8,playing nes
3147,8,was playing ac
3157,8,dad makes arcade cabinet son playing helicopter flash game [ ]
3203,8,dead space playing thing
3209,8,had playing ton civilization v skyrim
3259,8,roommates intense brawl session broke joystick controller desperate playing sacrifice life xbox controller repairs
3369,8,steven spielberg playing battlefield pre-alpha e3
3423,8,been playing tomb raider bit game thing
3493,8,playing dark souls favorite thing
3511,8,playing star wars jedi academy bit stormtrooper logic
3628,8,playing dead space seems
3681,8,powerpuff girls youtube nostalgic reasons mayor playing zelda nintendo
3703,8,playing nice stab competition
3712,8,time playing online multiplayer
3755,8,playing game months level timer score tetris axis
3776,8,playing ac3 doubt achilles mentor
3789,8,playing civilization v guy
3793,8,something kind mad playing rdr
3803,8,daughter playing pokemon time
3837,8,'m zelda deck playing cards guys think card
3886,8,playing game present quotes [ gta iv ]
4214,8,playing thomas was alone
4291,8,playing video games whole time
4323,8,happend playing cry
4352,8,found woman house playing pokemon red ( )
4457,8,game limbo playing cabinets yes eyes glow dark
4494,8,playing farcry
4516,8,playing dungeon keeper day
4594,8,been playing sim city ! have wait times game price !
4631,8,was playing fantasy
4693,8,look playing surgeon simulator
4773,8,microsoft uses nsa data roommate buy xbox playing bf3 death thanks obama
4787,8,playing dogs
4794,8,get playing
4817,8,think friend playing saint row
4968,8,( non spoiler ) was playing london riots
4990,8,things playing video game
5024,8,things playing pc ( r/mw3 )
5247,8,years playing [ oc ]
5324,8,think playing cry
5372,8,came home boyfriend playing skyrim
5552,8,thing think playing shadow colossus time
5603,8,playing mass effect years consider planet
5741,8,playing new vegas boone companion deathclaws corpses boone slight mutation [ glitch ]
5746,8,noticed playing gta
5757,8,playing rp servers garry mod
5791,8,bro playing bl2 playing batista quinn
5847,8,feel playing portal
5917,8,husband playing cod look
5984,8,woke playing feel sort super villain
6021,8,everyone playing bioshock memes
6105,8,'m remember playing school computer lab
6266,8,american playing dogs
6277,8,something understood playing assassin creed
6305,8,playing portal funniest campaign !
6328,8,plan playing bioshock infinite
6336,8,part playing emulator
6348,8,playing cod years seem happy
6445,8,scariest part playing new vegas
6491,8,steven spielberg playing battlefield e3 ( album )
6540,8,hope 'm awesome 'm ( playing pokemon silver )
6603,8,playing new vegas countless times novac name ( xpost )
6605,8,playing tf2
6689,8,impression playing hours bioshock infinite
6710,8,thoughts playing bioshock infinite mormon state country life
6713,8,first time playing game time vg
6800,8,grandfather playing games find main power cord
6912,8,first time playing video game
6928,8,everytime 'm playing halo campaign
7025,8,gamer playing animal
7038,8,audiosurf mind minutes playing
7050,8,first minutes playing elizabeth
7090,8,was playing sc2 heart swarm
7095,8,playing surgeon simulator
7124,8,playing red dead redemption ps3 lsd
7259,8,see time playing video game raise mine anyone relate
7311,8,started playing lost damned hear
7563,8,playing new vegas
7627,8,surgery ear things weeks ( weight playing basketball etc ) dad apartment couple hours try feel
7722,8,back playing new vegas
7874,8,playing broke drake
7878,8,playing gta iv xbox
7886,8,was playing friend backdrop
7891,8,time kinda playing metro light [ tiny spoiler ]
7946,8,playing 3ds ( explanation comments )
8003,8,playing super smash bros melee playing melee
8029,8,playing bioshock roommate name wall !
8057,8,easy playing hard survivor survivor +
8085,8,playing alan wake qr code something game
8089,8,backlog playing acii time
8168,8,playing school shooters lots ammo health sign [ sam ]
8232,8,looks matter time playing morrowind
8255,8,'m playing online shooter kill killstreak reward
8360,8,saw deadpool today playing deadpool
8366,8,playing battlefield
8423,8,method mature game try stop underage kids playing
8481,8,playing nv things things game
8519,8,found guys playing battlefield yesterday
8524,8,playing organ trail day
8592,8,friends playing hardcore minecraft
8664,8,playing new vegas
8905,8,playing cis men appeal adolescent males power fantasies present cart life
