,kmeans,nouns
6,7,verdict perverse sentence nature weighs seismologists years prison
49,7,earth light years astronomers planets tau ceti closest star system whose temperature luminosity match sun
82,7,decades miles ice scientists verge vast dark lake light years
121,7,brain condition skull person years
133,7,south scientists deal research clone mammoth earth years
136,7,father men years twice scientists
139,7,plants re-grow years ice
243,7,swallows highways years
246,7,lake life survives isolation years discovery strange bacteria lake beneath ice boosts chance life exist
249,7,measurements composition moon rocks suggest earth born water present liquid million years comets asteroids
266,7,world tumor rib neanderthal predates tumors years
277,7,scientists computer models planet dwarf star light years stable temperatures surface liquid water
334,7,u.s teen pregnancy rates decline hit lowest level years
354,7,version ancient maya calendar [ calendar ] billions trillions octillions years numbers wrap heads
357,7,years ice age flower blooms again‰Û©
369,7,water trapped billion years hold ancient life npr
403,7,males choosy females experiment touchstone biology years
462,7,code tweaks million years modern day systems result changes letters code place million years team geneticists
500,7,sea surface temperatures reach level years
507,7,years space voyager system crosses
526,7,nasa telescopes spy galaxy amidst ages‰Ûª billion light years away
541,7,million years invertebrate accident multiple copies brain genes evolution intelligence
548,7,universe billion years
556,7,scientists argon technique use confirm yucatan impact point extinction million years
566,7,predictions accurate analysis climate change past years reveal accurate forecasts temperatures
575,7,engraved stone years china incisions possibility
596,7,sediment deep-sea core hold iron distant supernova million years remains bacteria iron traces signature star
602,7,discovery rock earth leads evidence earth earliest years chances life universe ‰ÛÓ
681,7,telescope spots death dwarf billion years
686,7,naked mole rats cancer years exposure gamma radiation tumor transplants carcinogen injection secrets cancer resistance
718,7,humans may have mastered fire million years ago
752,7,aboriginal founders australia years reconstruction indicates ‰ÛÓ numbers evidence migration individuals time
795,7,million year bird fossil china known bird fossil million years
811,7,humans americas years
814,7,turtle shell scientists years research sheds light shells
853,7,subduction zone suggests north america collide europe million years
