,Unnamed: 0,domain,banned_by,subreddit,selftext_html,selftext,likes,link_flair_text,id,clicked,title,media,score,approved_by,over_18,hidden,thumbnail,subreddit_id,edited,link_flair_css_class,author_flair_css_class,downs,saved,is_self,permalink,name,created,url,author_flair_text,author,created_utc,ups,num_comments,num_reports,distinguished,_id,__v
3125,3125,guardian.co.uk,,worldnews,,,,,1b3iiz,False,Ecuador to auction off more than 3 MILLION hectares of pristine Amazonian rainforest to Chinese oil companies,,3314,,False,False,,t5_2qh13,False,,,9750,False,False,/r/worldnews/comments/1b3iiz/ecuador_to_auction_off_more_than_3_million/,t3_1b3iiz,1364368917,http://www.guardian.co.uk/world/2013/mar/26/ecuador-chinese-oil-bids-amazon,,Hecko0,1364365317,13064,1641,,,ObjectID(51cd3fde607d46e39900084e),0
3187,3187,rawstory.com,,worldnews,,,,,106phu,False,"Uruguay Takes ‘War on Drugs’ in New Direction: state monopoly over the production &amp; distribution of marijuana, making it the 1st national government to sell cannabis directly to citizens",,3310,,False,False,,t5_2qh13,False,,,8264,False,False,/r/worldnews/comments/106phu/uruguay_takes_war_on_drugs_in_new_direction_state/,t3_106phu,1348140698,http://www.rawstory.com/rs/2012/09/20/uruguay-takes-war-on-drugs-in-new-direction-state-monopoly-over-the-production-and-distribution-of-marijuana/,,anutensil,1348137098,11574,833,,,ObjectID(51cd3fde607d46e39900088c),0
3213,3213,news.nationalpost.com,,worldnews,,,,,11xztk,False,"A 28-year-old Tunisian who was caught on security camera stealing from a man who had fallen onto the tracks on the Stockholm subway and then leaving him to be hit by a train was sentenced to prison, deportation",,3299,,False,False,,t5_2qh13,False,,,12032,False,False,/r/worldnews/comments/11xztk/a_28yearold_tunisian_who_was_caught_on_security/,t3_11xztk,1351001412,http://news.nationalpost.com/2012/10/23/thief-who-robbed-swedish-man-who-fell-onto-subway-tracks-sentenced-to-prison-deportation/,,davidreiss666,1350997812,15331,2651,,,ObjectID(51cd3fe3607d46e3990008a6),0
3249,3249,news.sky.com,,worldnews,,,,,1gz15c,False,Silvio Berlusconi sentenced to seven years in jail,,3297,,False,False,,t5_2qh13,False,,,10289,False,False,/r/worldnews/comments/1gz15c/silvio_berlusconi_sentenced_to_seven_years_in_jail/,t3_1gz15c,1372116356,http://news.sky.com/story/1107593/silvio-berlusconi-found-guilty-in-sex-trial,,giggsy664,1372087556,13586,1143,,,ObjectID(51cd3fe3607d46e3990008ca),0
3277,3277,bbc.co.uk,,worldnews,,,,,1f4wzx,False,"The bewildering state of India's justice system - Prison born boy grows up, gets a job and finally manages to provide his mum with the $180 bail she's been waiting 19 years in jail for.",,3286,,False,False,,t5_2qh13,False,,,10586,False,False,/r/worldnews/comments/1f4wzx/the_bewildering_state_of_indias_justice_system/,t3_1f4wzx,1369665603,http://www.bbc.co.uk/news/world-asia-22677788,,LaszloK,1369662003,13872,1163,,,ObjectID(51cd3fe3607d46e3990008e6),0
3296,3296,stuff.co.nz,,worldnews,,,,,1aawjg,False,"VW shares $1.1b in profits with workers ""'Profit sharing is hard earned and deserved; it is the equitable participation of employees in the success""",,3291,,False,False,,t5_2qh13,False,,,11445,False,False,/r/worldnews/comments/1aawjg/vw_shares_11b_in_profits_with_workers_profit/,t3_1aawjg,1363293231,http://www.stuff.co.nz/motoring/8426009/VW-shares-1-1b-in-profits-with-workers,,chandummclandum,1363289631,14736,969,,,ObjectID(51cd3fe3607d46e3990008f9),0
3303,3303,torontosun.com,,worldnews,,,,,1cwv24,False,Muslim community tipped off Canada about terror plot,,3283,,False,False,,t5_2qh13,False,,,16770,False,False,/r/worldnews/comments/1cwv24/muslim_community_tipped_off_canada_about_terror/,t3_1cwv24,1366690847,http://www.torontosun.com/2013/04/22/muslim-community-tipped-off-rcmp-about-terror-plot,,theonlybond,1366687247,20053,2022,,,ObjectID(51cd3fe8607d46e399000900),0
3312,3312,enetenglish.gr,,worldnews,,,,,1bdm7j,False,Cyprus President's Family Transferred Tens Of Millions To London Days Before Deposit Confiscations,,3286,,False,False,,t5_2qh13,False,,,7075,False,False,/r/worldnews/comments/1bdm7j/cyprus_presidents_family_transferred_tens_of/,t3_1bdm7j,1364767150,http://www.enetenglish.gr/?i=news.en.economy&amp;id=481,,hippyhippyshook,1364763550,10361,525,,,ObjectID(51cd3fe8607d46e399000909),0
3356,3356,arstechnica.com,,worldnews,,,,,18wiop,False,Germans couldn't see many of the Russian meteor videos last week because a radio was playing music in the background. The German version of the MIAA wanted a penny per view.,,3278,,False,False,,t5_2qh13,False,,,14978,False,False,/r/worldnews/comments/18wiop/germans_couldnt_see_many_of_the_russian_meteor/,t3_18wiop,1361388634,http://arstechnica.com/tech-policy/2013/02/germans-cant-see-meteorite-youtube-videos-due-to-copyright-dispute/,,nobodyspecial,1361388634,18256,1498,,,ObjectID(51cd3fe8607d46e399000935),0
3371,3371,wired.co.uk,,worldnews,,,,,1a9ypd,False,Bill Gates: capitalism means male baldness research gets more funding than malaria,,3270,,False,False,,t5_2qh13,False,,,25646,False,False,/r/worldnews/comments/1a9ypd/bill_gates_capitalism_means_male_baldness/,t3_1a9ypd,1363258651,http://www.wired.co.uk/news/archive/2013-03/14/bill-gates-capitalism#.UUGe-5TS1fE.reddit,,Libertatea,1363255051,28916,4071,,,ObjectID(51cd3fe8607d46e399000944),0
3378,3378,npr.org,,worldnews,,,,,16k539,False,"In China's capital, they're calling it the ""airpocalypse,"" with air pollution that's literally off the charts. The air has been classified as hazardous to human health for a fifth consecutive day, at its worst hitting pollution levels 25x that considered safe in the U.S.",,3278,,False,False,,t5_2qh13,False,,,12131,False,False,/r/worldnews/comments/16k539/in_chinas_capital_theyre_calling_it_the/,t3_16k539,1358183370,http://www.npr.org/2013/01/14/169305324/beijings-air-quality-reaches-hazardous-levels,,ServerGeek,1358183370,15409,2845,,,ObjectID(51cd3fe8607d46e39900094b),0
3382,3382,aljazeera.com,,worldnews,,,,,wz8cb,False,"Super rich hiding up to $32 trillion offshore, which amounts to roughly the US and Japanese GDP combined. Up to $280bn is lost in tax revenues. Some of the world's biggest banks are involved: HSBC, Citigroup, Bank of America, UBS, Credit Suisse",,3269,,False,False,,t5_2qh13,False,,,17301,False,False,/r/worldnews/comments/wz8cb/super_rich_hiding_up_to_32_trillion_offshore/,t3_wz8cb,1342990321,http://www.aljazeera.com//news/europe/2012/07/2012722145418435676.html,,mepper,1342986721,20570,3682,,,ObjectID(51cd3fe8607d46e39900094f),0
3405,3405,foodrenegade.com,,worldnews,,,,,1cakot,False,Peru Bans Monsanto and GMOs,,3269,,False,False,,t5_2qh13,False,,,16665,False,False,/r/worldnews/comments/1cakot/peru_bans_monsanto_and_gmos/,t3_1cakot,1365895964,http://www.foodrenegade.com/peru-bans-monsanto-gmos/,,moonraine,1365892364,19934,2788,,,ObjectID(51cd3fed607d46e399000966),0
3412,3412,news.ph.msn.com,,worldnews,,,,,ztazz,False,Up to 10 Libyans were also killed or wounded defending the US cousulate,,3264,,False,False,,t5_2qh13,False,,,17207,False,False,/r/worldnews/comments/ztazz/up_to_10_libyans_were_also_killed_or_wounded/,t3_ztazz,1347528544,http://news.ph.msn.com/top-stories/us-envoy-killed-as-libya-mob-storms-embassy,,2oosra,1347524944,20471,1787,,,ObjectID(51cd3fed607d46e39900096d),0
3416,3416,telegraph.co.uk,,worldnews,,,,,11r687,False,Rowan Atkinson: We must be allowed to insult each other - Rowan speaks out against strict censorship laws in the UK,,3272,,False,False,,t5_2qh13,False,,,8702,False,False,/r/worldnews/comments/11r687/rowan_atkinson_we_must_be_allowed_to_insult_each/,t3_11r687,1350668628,http://www.telegraph.co.uk/news/uknews/law-and-order/9616750/Rowan-Atkinson-we-must-be-allowed-to-insult-each-other.html,,AdamVR4,1350665028,11974,1006,,,ObjectID(51cd3fed607d46e399000971),0
3420,3420,reuters.com,,worldnews,,,,,1g4wp9,False,"Germany Demands Obama Explain ""American-Style Stasi Methods"" before his visit.",,3258,,False,False,,t5_2qh13,False,,,7886,False,False,/r/worldnews/comments/1g4wp9/germany_demands_obama_explain_americanstyle_stasi/,t3_1g4wp9,1370977339,http://www.reuters.com/article/2013/06/11/cnews-us-usa-security-germany-idCABRE95A0T820130611,,cuteman,1370973739,11144,1120,,,ObjectID(51cd3fed607d46e399000975),0
3431,3431,cbc.ca,,worldnews,,,,,1brrng,False,"Demonstrators march against law that allows police to declare public protests illegal. In response, the Montreal police declare the protest illegal.",,3260,,False,False,,t5_2qh13,False,,,7086,False,False,/r/worldnews/comments/1brrng/demonstrators_march_against_law_that_allows/,t3_1brrng,1365213470,http://www.cbc.ca/news/canada/montreal/story/2013/04/05/montreal-anti-police-brutality-protest.html,,enonx1,1365209870,10346,1091,,,ObjectID(51cd3fed607d46e399000980),0
3433,3433,bigstory.ap.org,,worldnews,,,,,17yn05,False,"Thousands of Mali's ancient manuscripts were saved from the fires of radical Islamists by an illiterate 72-year-old librarian who stuffed them into millet bags and smuggled them by cart, motorcycle, canoe, then car to the capital, Bamako, on the other side of the country.",,3263,,False,False,,t5_2qh13,False,,,5766,False,False,/r/worldnews/comments/17yn05/thousands_of_malis_ancient_manuscripts_were_saved/,t3_17yn05,1360105171,http://bigstory.ap.org/article/people-timbuktu-save-manuscripts-invaders,,octaviusromulus,1360105171,9029,558,,,ObjectID(51cd3fed607d46e399000982),0
3445,3445,thelede.blogs.nytimes.com,,worldnews,,,,,1fz43f,False,Turkish game show host breaks self-censorship by making answers about ongoing unrest: 70 times.,,3262,,False,False,,t5_2qh13,False,,,8744,False,False,/r/worldnews/comments/1fz43f/turkish_game_show_host_breaks_selfcensorship_by/,t3_1fz43f,1370774719,http://thelede.blogs.nytimes.com/2013/06/05/civil-disobedience-on-a-turkish-game-show/?ref=world,,north_runner,1370771119,12006,382,,,ObjectID(51cd3fed607d46e39900098e),0
3461,3461,bbc.co.uk,,worldnews,,,,,1cexp6,False,31 People killed in Explosions in Iraq,,3252,,False,False,,t5_2qh13,False,,,20758,False,False,/r/worldnews/comments/1cexp6/31_people_killed_in_explosions_in_iraq/,t3_1cexp6,1366063432,http://www.bbc.co.uk/news/world-middle-east-22149863,,KoCrazy,1366059832,24010,1413,,,ObjectID(51cd3fed607d46e39900099e),0
3472,3472,haaretz.com,,worldnews,,,,,1fpmij,False,"Tens of thousands in Iran protest against Khamenei, chant 'death to dictator'",,3249,,False,False,,t5_2qh13,False,,,8932,False,False,/r/worldnews/comments/1fpmij/tens_of_thousands_in_iran_protest_against/,t3_1fpmij,1370426861,http://www.haaretz.com/news/middle-east/tens-of-thousands-in-iran-protest-against-khamenei-chant-death-to-dictator-1.527893,,IBiteYou,1370423261,12181,1573,,,ObjectID(51cd3fed607d46e3990009a9),0
3483,3483,npr.org,,worldnews,,,,,z6m4n,False,"Once the highway network is completed, an estimated 15,000 additional people will switch from driving to biking... The bike highway alone is expected to save Copenhagen's health care system some $60 million a year.",,3252,,False,False,,t5_2qh13,False,,,13310,False,False,/r/worldnews/comments/z6m4n/once_the_highway_network_is_completed_an/,t3_z6m4n,1346510722,http://www.npr.org/2012/09/01/160386904/in-bike-friendly-copenhagen-highways-for-cyclists?ps=view&amp;ec=mostpopular,,sporkintheroad,1346507122,16562,1805,,,ObjectID(51cd3fed607d46e3990009b4),0
3538,3538,hosted.ap.org,,worldnews,,,,,13vg13,False,China's party paper falls for Onion joke about Kim Jong Un,,3243,,False,False,,t5_2qh13,False,,,16258,False,False,/r/worldnews/comments/13vg13/chinas_party_paper_falls_for_onion_joke_about_kim/,t3_13vg13,1354025082,http://hosted.ap.org/dynamic/stories/A/AS_CHINA_ONION_KIM?SITE=AP&amp;SECTION=HOME&amp;TEMPLATE=DEFAULT&amp;CTIME=2012-11-27-07-38-17,,edisekeed,1354025082,19501,1135,,,ObjectID(51cd3ff2607d46e3990009eb),0
3551,3551,economist.com,,worldnews,,,,,19n819,False,"A huge comet is headed for Mars. If it hits, ""it would be an event on the same sort of scale as the impact that drove the dinosaurs extinct 65m years ago. """,,3246,,False,False,,t5_2qh13,False,,,12540,False,False,/r/worldnews/comments/19n819/a_huge_comet_is_headed_for_mars_if_it_hits_it/,t3_19n819,1362415127,http://www.economist.com/blogs/babbage/2013/02/comet-headed-mars,,cakelamotta,1362415127,15786,2147,,,ObjectID(51cd3ff2607d46e3990009f8),0
3568,3568,google.com,,worldnews,,,,,19vr23,False,"North Korea officially voids non-aggression pacts with South, following new round of UN sanctions",,3242,,False,False,,t5_2qh13,False,,,15646,False,False,/r/worldnews/comments/19vr23/north_korea_officially_voids_nonaggression_pacts/,t3_19vr23,1362703960,http://www.google.com/hostednews/afp/article/ALeqM5hmEUR-mSLEUHfAswkZ36agHTkKiw?docId=CNG.29350d12cef5ba479bd32457cce4d1a0.8a1,,Timmyc62,1362703960,18888,3777,,,ObjectID(51cd3ff2607d46e399000a09),0
3572,3572,huffingtonpost.com,,worldnews,,,,,xz3nr,False,"The Libor scandal is the largest financial scandal of all-time, but receiving almost no TV coverage. Here is a complete package of news articles on the matter. ",,3238,,False,False,,t5_2qh13,False,,,8364,False,False,/r/worldnews/comments/xz3nr/the_libor_scandal_is_the_largest_financial/,t3_xz3nr,1344568605,http://www.huffingtonpost.com/news/libor-scandal/,,Nicolasbeeberman,1344565005,11602,750,,,ObjectID(51cd3ff2607d46e399000a0d),0
3580,3580,nbcnews.com,,worldnews,,,,,1dmi10,False,Tribes vow to fight-to-the-death to save Amazon rainforest,,3238,,False,False,,t5_2qh13,False,,,14067,False,False,/r/worldnews/comments/1dmi10/tribes_vow_to_fighttothedeath_to_save_amazon/,t3_1dmi10,1367600049,http://www.nbcnews.com/video/rock-center/51754456,,MikeCharlieUniform,1367596449,17305,1515,,,ObjectID(51cd3ff2607d46e399000a15),0
3586,3586,cbc.ca,,worldnews,,,,,19hsyg,False,The good news: Meat Pies tested in Iceland contain no horse meat.  The bad news: They also apparently contain no meat of any kind.,,3235,,False,False,,t5_2qh13,False,,,16071,False,False,/r/worldnews/comments/19hsyg/the_good_news_meat_pies_tested_in_iceland_contain/,t3_19hsyg,1362182234,http://www.cbc.ca/news/world/story/2013/03/01/wrd-iceland-horsemeat-meat-pie.html,,NMW,1362182234,19306,1632,,,ObjectID(51cd3ff2607d46e399000a1b),0
3610,3610,rt.com,,worldnews,,,,,10r7a3,False,Bahraini court sentences 9 doctors to prison for up to 5 years for treating injured protesters. ,,3228,,False,False,,t5_2qh13,False,,,6865,False,False,/r/worldnews/comments/10r7a3/bahraini_court_sentences_9_doctors_to_prison_for/,t3_10r7a3,1349091814,http://rt.com/news/bahrain-dortors-appeal-denied-382/,,swanson_stash,1349088214,10093,609,,,ObjectID(51cd3ff7607d46e399000a33),0
3612,3612,amnesty.org,,worldnews,,,,,1gzfrt,False,"Amnesty International chimes in on Snowden case: ""USA must not hunt down whistleblower Edward Snowden""",,3235,,False,False,,t5_2qh13,False,,,8246,False,False,/r/worldnews/comments/1gzfrt/amnesty_international_chimes_in_on_snowden_case/,t3_1gzfrt,1372127786,http://www.amnesty.org/en/news/usa-must-not-hunt-down-whistleblower-edward-snowden-2013-06-24,,jrv,1372098986,11481,766,,,ObjectID(51cd3ff7607d46e399000a35),0
3691,3691,ireport.cnn.com,,worldnews,,,,,1ffnjg,False,"In Turkey, 'police are packing people into the subway stations and throwing in tear gas, attacking hospitals where the injured are being treated.'",,3216,,False,False,,t5_2qh13,False,,,9520,False,False,/r/worldnews/comments/1ffnjg/in_turkey_police_are_packing_people_into_the/,t3_1ffnjg,1370045759,http://ireport.cnn.com/docs/DOC-980179,,jimcc333,1370042159,12736,1290,,,ObjectID(51cd3ff8607d46e399000a84),0
3717,3717,mirror.co.uk,,worldnews,,,,,11urak,False,Soldier sacked by the army 72 hours before he gets his full pension,,3220,,False,False,,t5_2qh13,False,,,19065,False,False,/r/worldnews/comments/11urak/soldier_sacked_by_the_army_72_hours_before_he/,t3_11urak,1350848412,http://www.mirror.co.uk/news/uk-news/soldier-sacked-by-army-72-hours-1389909,,ZzWoOstY,1350844812,22285,1735,,,ObjectID(51cd3ffc607d46e399000a9e),0
3734,3734,rt.com,,worldnews,,,,,zrb8x,False,"US ambassador and 3 staff members killed in an attack on the American consulate in Benghazi, Libya",,3210,,False,False,,t5_2qh13,False,,,12875,False,False,/r/worldnews/comments/zrb8x/us_ambassador_and_3_staff_members_killed_in_an/,t3_zrb8x,1347445069,http://rt.com/news/us-ambassador-libya-killed-946/,,Your_socks,1347441469,16085,6456,,,ObjectID(51cd3ffc607d46e399000aaf),0
3737,3737,economist.com,,worldnews,,,,,1fsoq3,False,"Mr Erdogan has intimidated the media into self-censorship: as the protesters choked on tear gas, the television networks carried programmes about cooking and penguins. More journalists are in jail in Turkey than in China.",,3206,,False,False,,t5_2qh13,False,,,8628,False,False,/r/worldnews/comments/1fsoq3/mr_erdogan_has_intimidated_the_media_into/,t3_1fsoq3,1370537650,http://www.economist.com/news/leaders/21579004-recep-tayyip-erdogan-should-heed-turkeys-street-protesters-not-dismiss-them-democrat-or-sultan,,emr1028,1370534050,11834,482,,,ObjectID(51cd3ffc607d46e399000ab2),0
3764,3764,g1.globo.com,,worldnews,,,,,1gr6xw,False,More than 300 thousand people protesting in Rio right now!,,3204,,False,False,,t5_2qh13,False,,,14190,False,False,/r/worldnews/comments/1gr6xw/more_than_300_thousand_people_protesting_in_rio/,t3_1gr6xw,1371793588,http://g1.globo.com/distrito-federal/manifestacoes/2013/cobertura/,,CyberLani,1371764788,17394,1687,,,ObjectID(51cd3ffc607d46e399000acd),0
3778,3778,guardian.co.uk,,worldnews,,,,,1fmius,False,"Turkish protesters raise $55,000 for full-page ad in New York Times | World news",,3205,,False,False,,t5_2qh13,False,,,13911,False,False,/r/worldnews/comments/1fmius/turkish_protesters_raise_55000_for_fullpage_ad_in/,t3_1fmius,1370316056,http://www.guardian.co.uk/world/2013/jun/03/turkey-new-york-times-ad,,The-MERTEGER,1370312456,17116,1013,,,ObjectID(51cd3ffc607d46e399000adb),0
3782,3782,wired.com,,worldnews,,,,,14777f,False,Internet Hangs in Balance as World Governments Meet in Secret,,3201,,False,False,,t5_2qh13,False,,,9749,False,False,/r/worldnews/comments/14777f/internet_hangs_in_balance_as_world_governments/,t3_14777f,1354542920,http://www.wired.com/threatlevel/2012/12/itc-internet-meetings/,,anutensil,1354542920,12950,1170,,,ObjectID(51cd3ffc607d46e399000adf),0
3793,3793,qz.com,,worldnews,,,,,1f5ry9,False,China is starting to get embarrassed about its tourists’ obnoxious behavior abroad - “Take for example the sign outside the Louvre Museum only in Chinese characters that forbids people from urinating or defecating wherever they want.”,,3203,,False,False,,t5_2qh13,False,,,10591,False,False,/r/worldnews/comments/1f5ry9/china_is_starting_to_get_embarrassed_about_its/,t3_1f5ry9,1369694265,http://qz.com/88334/china-is-starting-to-get-embarrassed-about-its-tourists-obnoxious-behavior-abroad/,,anutensil,1369690665,13794,4782,,,ObjectID(51cd3ffc607d46e399000aea),0
3818,3818,nu.nl,,worldnews,,,,,12q4r1,False,Skype illegally distributed a user's personal information to a private company during a Dutch police investigation into Anonymous-sanctioned cyberattacks on PayPal,,3196,,False,False,,t5_2qh13,False,,,8429,False,False,/r/worldnews/comments/12q4r1/skype_illegally_distributed_a_users_personal/,t3_12q4r1,1352204695,http://www.nu.nl/internet/2950158/skype-hands-16-year-olds-personal-information-to-it-company.html,,maxwellhill,1352204695,11625,671,,,ObjectID(51cd4001607d46e399000b03),0
3853,3853,imgur.com,,worldnews,,,,,1fiogq,False,"Based on requests, the pictures of the protests going on in Turkey. You will see how big the protest is. It is believed it has reached 1 million people througout Turkey. You will also see how brutally violent the police is.",,3191,,False,False,,t5_2qh13,False,,,23398,False,False,/r/worldnews/comments/1fiogq/based_on_requests_the_pictures_of_the_protests/,t3_1fiogq,1370185142,http://imgur.com/a/wOrZR#0,,lymiegirl,1370181542,26589,2274,,,ObjectID(51cd4001607d46e399000b26),0
3860,3860,bbc.co.uk,,worldnews,,,,,17v0s6,False,"The remains of Richard III, one of the most famous figures in English history, has been found.",,3189,,False,False,,t5_2qh13,False,,,18359,False,False,/r/worldnews/comments/17v0s6/the_remains_of_richard_iii_one_of_the_most_famous/,t3_17v0s6,1359974806,http://www.bbc.co.uk/news/uk-england-leicestershire-21063882,,ashuri,1359974806,21548,2136,,,ObjectID(51cd4001607d46e399000b2d),0
3871,3871,hosted.ap.org,,worldnews,,,,,10anyj,False,"A synchronized, 1 million person toilet flush is planned to clear a backed-up sewer system in Zimbabwe",,3184,,False,False,,t5_2qh13,False,,,15625,False,False,/r/worldnews/comments/10anyj/a_synchronized_1_million_person_toilet_flush_is/,t3_10anyj,1348323737,http://hosted.ap.org/dynamic/stories/A/AF_ZIMBABWE_WATER_CRISIS?SITE=AP&amp;SECTION=HOME&amp;TEMPLATE=DEFAULT,,twolf1,1348320137,18809,1308,,,ObjectID(51cd4001607d46e399000b38),0
3924,3924,googleblog.blogspot.com,,worldnews,,,,,aouz8,False,"Dear World, The Chinese government stole intellectual property from us and others. The censorship is crazy over there and we are seriously considering ceasing our Chinese operation. - signed google.",,3174,,False,False,,t5_2qh13,False,,,1313,False,False,/r/worldnews/comments/aouz8/dear_world_the_chinese_government_stole/,t3_aouz8,1263338669,http://googleblog.blogspot.com/2010/01/new-approach-to-china.html,,frenchphrasebook,1263338669,4487,699,,,ObjectID(51cd4006607d46e399000b6d),0
3949,3949,telegraph.co.uk,,worldnews,,,,,1cerrp,False,Boston Marathon explosions: dozens wounded as two blasts hit finish line,,3178,,False,False,,t5_2qh13,False,,,29588,False,False,/r/worldnews/comments/1cerrp/boston_marathon_explosions_dozens_wounded_as_two/,t3_1cerrp,1366059295,http://www.telegraph.co.uk/news/worldnews/northamerica/usa/9996332/Boston-Marathon-explosions-dozens-wounded-as-two-blasts-hit-finish-line.html,,Madd_73,1366055695,32766,2368,,,ObjectID(51cd4006607d46e399000b86),0
3951,3951,bbc.co.uk,,worldnews,,,,,18fwzi,False,"The European Union and the US will begin formal talks on a free-trade agreement, paving the way for the biggest trade deal in history. ",,3181,,False,False,,t5_2qh13,False,,,11903,False,False,/r/worldnews/comments/18fwzi/the_european_union_and_the_us_will_begin_formal/,t3_18fwzi,1360759190,http://www.bbc.co.uk/news/business-21439945,,Libertatea,1360759190,15084,3004,,,ObjectID(51cd4006607d46e399000b88),0
3966,3966,bbc.co.uk,,worldnews,,,,,1a3d5u,False,EU bans sale of all animal-tested cosmetics [BBC],,3171,,False,False,,t5_2qh13,False,,,9035,False,False,/r/worldnews/comments/1a3d5u/eu_bans_sale_of_all_animaltested_cosmetics_bbc/,t3_1a3d5u,1363027548,http://www.bbc.co.uk/news/world-europe-21740745,,lakedonkey,1363023948,12206,1586,,,ObjectID(51cd4006607d46e399000b97),0
3974,3974,rt.com,,worldnews,,,,,11yj5l,False,'We won’t advise the state again': Scientists outraged at Italian seismologists' jailing,,3176,,False,False,,t5_2qh13,False,,,5472,False,False,/r/worldnews/comments/11yj5l/we_wont_advise_the_state_again_scientists/,t3_11yj5l,1351020651,http://rt.com/news/italy-jail-scientists-reaction-061/,,twolf1,1351017051,8648,811,,,ObjectID(51cd4006607d46e399000b9f),0
3990,3990,bbc.co.uk,,worldnews,,,,,13e6uz,False,ATM gives out extra money - the British form an orderly queue,,3168,,False,False,,t5_2qh13,False,,,7614,False,False,/r/worldnews/comments/13e6uz/atm_gives_out_extra_money_the_british_form_an/,t3_13e6uz,1353232556,http://www.bbc.co.uk/news/uk-scotland-glasgow-west-20377784,,strawberry_beard,1353232556,10782,1587,,,ObjectID(51cd4006607d46e399000baf),0
3999,3999,cbsnews.com,,worldnews,,,,,10mfz7,False,"Iran news agency picks up ""Onion"" story, tells Iranians rural Americans prefer Ahmadinejad to Obama",,3165,,False,False,,t5_2qh13,False,,,14179,False,False,/r/worldnews/comments/10mfz7/iran_news_agency_picks_up_onion_story_tells/,t3_10mfz7,1348851360,http://www.cbsnews.com/8301-202_162-57522363/iran-news-agency-picks-up-onion-story-tells-iranians-rural-americans-prefer-ahmadinejad-to-obama/,,misterAction,1348847760,17344,993,,,ObjectID(51cd4006607d46e399000bb8),0
4006,4006,guardian.co.uk,,worldnews,,,,,17faf6,False,Mali rebels fleeing Timbuktu burn library full of ancient manuscripts,,3175,,False,False,,t5_2qh13,False,,,7329,False,False,/r/worldnews/comments/17faf6/mali_rebels_fleeing_timbuktu_burn_library_full_of/,t3_17faf6,1359373337,http://www.guardian.co.uk/world/2013/jan/28/mali-timbuktu-library-ancient-manuscripts,,Guillam,1359373337,10504,2077,,,ObjectID(51cd400b607d46e399000bbf),0
4027,4027,wsws.org,,worldnews,,,,,1gkyds,False,Turkish government threatens to deploy the army against protests and to prosecute doctors who treated wounded protesters in Gezi Park,,3163,,False,False,,t5_2qh13,False,,,11685,False,False,/r/worldnews/comments/1gkyds/turkish_government_threatens_to_deploy_the_army/,t3_1gkyds,1371589650,http://wsws.org/en/articles/2013/06/18/turk-j18.html,,charlesgrrr,1371560850,14848,1537,,,ObjectID(51cd400b607d46e399000bd4),0
4051,4051,hosted.ap.org,,worldnews,,,,,1gwlml,False,Hong Kong Government: U.S. Extradition Request Did Not Fully Comply With Hong Kong Law,,3165,,False,False,,t5_2qh13,False,,,8901,False,False,/r/worldnews/comments/1gwlml/hong_kong_government_us_extradition_request_did/,t3_1gwlml,1372018100,http://hosted.ap.org/dynamic/stories/A/AS_NSA_SURVEILLANCE_HONG_KONG?SITE=AP&amp;SECTION=HOME&amp;TEMPLATE=DEFAULT&amp;CTIME=2013-06-23-07-04-11,,alibaba1027,1371989300,12066,1319,,,ObjectID(51cd400b607d46e399000bec),0
