,Unnamed: 0,domain,banned_by,subreddit,selftext_html,selftext,likes,link_flair_text,id,clicked,title,media,score,approved_by,over_18,hidden,thumbnail,subreddit_id,edited,link_flair_css_class,author_flair_css_class,downs,saved,is_self,permalink,name,created,url,author_flair_text,author,created_utc,ups,num_comments,num_reports,distinguished,_id,__v
5237,5237,cnn.com,,worldnews,,,,,19yv56,False,Afghan police officer embraces suicide bomber to save others,,3011,,False,False,,t5_2qh13,False,,,10972,False,False,/r/worldnews/comments/19yv56/afghan_police_officer_embraces_suicide_bomber_to/,t3_19yv56,1362832213,http://www.cnn.com/2013/03/09/world/asia/afghanistan-police-self-sacrifice/index.html,,twolf1,1362832213,13983,920,,,ObjectID(51cd4086ef7ac6f3990000ee),0
5245,5245,dawn.com,,worldnews,,,,,v76y2,False,"Indian drug giant Cipla cuts cost of cancer medicines in a humanitarian move, shaking up the drug market ",,3015,,False,False,,t5_2qh13,False,,,8478,False,False,/r/worldnews/comments/v76y2/indian_drug_giant_cipla_cuts_cost_of_cancer/,t3_v76y2,1339981758,http://dawn.com/2012/06/17/india-firm-shakes-up-cancer-drug-market-with-price-cuts/,,sidcool1234,1339978158,11493,907,,,ObjectID(51cd4086ef7ac6f3990000f6),0
5247,5247,motherjones.com,,worldnews,,,,,1gb8kk,False,Google finds that Pakistan leads in searches for gay pornography despite the country's overwhelming opposition to homosexuality,,3017,,False,False,,t5_2qh13,False,,,7144,False,False,/r/worldnews/comments/1gb8kk/google_finds_that_pakistan_leads_in_searches_for/,t3_1gb8kk,1371179421,http://www.motherjones.com/mixed-media/2013/06/gay-porn-pakistan,,Sbzxvc,1371175821,10161,995,,,ObjectID(51cd4086ef7ac6f3990000f8),0
5258,5258,telegraph.co.uk,,worldnews,,,,,pepx7,False,The last World War I veteran has died.,,3013,,False,False,,t5_2qh13,False,,,19201,False,False,/r/worldnews/comments/pepx7/the_last_world_war_i_veteran_has_died/,t3_pepx7,1328627236,http://www.telegraph.co.uk/news/uknews/9066371/Last-surviving-veteran-of-First-World-War-dies-aged-110.html,,rotzooi,1328627236,22214,1437,,,ObjectID(51cd4086ef7ac6f399000103),0
5272,5272,guardian.co.uk,,worldnews,,,,,11b14p,False,"A group of 23 impoverished west African fishing communities has driven off a fleet of illegal, unreported &amp; unregulated ""pirate"" trawlers by filming &amp; reporting them when they are found in their waters.  9 of the 10 ships identified  were found to have licences to export catches to Europe.",,3015,,False,False,,t5_2qh13,False,,,6896,False,False,/r/worldnews/comments/11b14p/a_group_of_23_impoverished_west_african_fishing/,t3_11b14p,1349962527,http://www.guardian.co.uk/environment/2012/oct/11/west-africa-fishing-pirate-trawlers?intcmp=122,,anutensil,1349958927,9911,523,,,ObjectID(51cd4086ef7ac6f399000111),0
5274,5274,arts.nationalpost.com,,worldnews,,,,,unz8d,False,Ray Bradbury Passes Away at 91.,,3014,,False,False,,t5_2qh13,False,,,16858,False,False,/r/worldnews/comments/unz8d/ray_bradbury_passes_away_at_91/,t3_unz8d,1338996771,http://arts.nationalpost.com/2012/06/06/reports-ray-bradbury-dead-at-91/,,Riddler0789,1338993171,19872,1020,,,ObjectID(51cd4086ef7ac6f399000113),0
5290,5290,latino.foxnews.com,,worldnews,,,,,13lovk,False,"China sends 90 tons of aid, including 900 tents, 10,000 blankets, 30 water purification systems, 100 electric generators and assorted medicines to Cuba for Hurricane Sandy recovery(x-post from /r/China)",,3013,,False,False,,t5_2qh13,False,,,9024,False,False,/r/worldnews/comments/13lovk/china_sends_90_tons_of_aid_including_900_tents/,t3_13lovk,1353553867,http://latino.foxnews.com/latino/news/2012/11/21/china-sends-0-tons-aid-to-cuba-after-hurricane-sandy/,,RogueAngelX,1353553867,12037,1284,,,ObjectID(51cd4086ef7ac6f399000123),0
5294,5294,dw.de,,worldnews,,,,,xzpzc,False,"Commerzbank stops speculating on basic food prices: Germany's second-biggest lender, Commerzbank, says it will no longer participate in market speculation on basic food prices. The bank says it has removed all agricultural products from its funds for moral reasons.",,3009,,False,False,,t5_2qh13,False,,,7273,False,False,/r/worldnews/comments/xzpzc/commerzbank_stops_speculating_on_basic_food/,t3_xzpzc,1344602334,"http://www.dw.de/dw/article/0,,16153042,00.html",,davidreiss666,1344598734,10282,1119,,,ObjectID(51cd4086ef7ac6f399000127),0
5303,5303,vimeo.com,,worldnews,,,,,1fgisz,False,Revolution in 90 seconds.This is what happening right now in Turkey. Help us spread the word.,,3013,,False,False,,t5_2qh13,False,,,20081,False,False,/r/worldnews/comments/1fgisz/revolution_in_90_secondsthis_is_what_happening/,t3_1fgisz,1370085887,https://vimeo.com/67432788,,ucman,1370082287,23094,3414,,,ObjectID(51cd408bef7ac6f399000130),0
5332,5332,shine.yahoo.com,,worldnews,,,,,1b9mcz,False,UK Man Caught With Just Over 2lbs Of Marijuana. Sentenced To Writing 5000 Word Essay.,,3013,,False,False,,t5_2qh13,False,,,18758,False,False,/r/worldnews/comments/1b9mcz/uk_man_caught_with_just_over_2lbs_of_marijuana/,t3_1b9mcz,1364596763,http://shine.yahoo.com/healthy-living/pot-dealer-in-uk-gets-sentenced-to-write-10-page-essay--161750168.html,,ixiduffixi,1364593163,21771,1828,,,ObjectID(51cd408bef7ac6f39900014d),0
5350,5350,reuters.com,,worldnews,,,,,v6dxm,False,"""Australia will create the largest network of marine parks in the world, protecting waters covering an area as large as India while banning oil and gas exploration and limiting commercial fishing in some of the most sensitive areas.""",,3006,,False,False,,t5_2qh13,False,,,11647,False,False,/r/worldnews/comments/v6dxm/australia_will_create_the_largest_network_of/,t3_v6dxm,1339943415,http://www.reuters.com/article/2012/06/14/us-australia-environment-marine-idUSBRE85D02Y20120614,,trot-trot,1339939815,14653,737,,,ObjectID(51cd408bef7ac6f39900015f),0
5363,5363,thediplomat.com,,worldnews,,,,,14s8mp,False,"The Real North Korea Problem - While the world fears its missiles 250,000 innocents, one-third of them children, are being forced to do slave labor on starvation rations and are daily subjected to heinous torture and executions",,3014,,False,False,,t5_2qh13,False,,,8809,False,False,/r/worldnews/comments/14s8mp/the_real_north_korea_problem_while_the_world/,t3_14s8mp,1355406091,http://thediplomat.com/the-editor/2012/12/12/shinning-a-light-on-north-koreas-human-rights-crisis/,,dunkin45,1355406091,11823,2146,,,ObjectID(51cd408bef7ac6f39900016c),0
5367,5367,stream.aljazeera.com,,worldnews,,,,,1fe8jm,False,"Police attacks peaceful protest trying to save a park in the heart of Istanbul, Turkey. Local media is being silenced.",,3010,,False,False,,t5_2qh13,False,,,6077,False,False,/r/worldnews/comments/1fe8jm/police_attacks_peaceful_protest_trying_to_save_a/,t3_1fe8jm,1369995979,http://stream.aljazeera.com/story/201305302148-0022796,,QubaHQ,1369992379,9087,801,,,ObjectID(51cd408bef7ac6f399000170),0
5390,5390,aljazeera.com,,worldnews,,,,,1axjc6,False,"Armenia is the first country in the world to make chess mandatory in schools, aiming to build a better society",,3008,,False,False,,t5_2qh13,False,,,18070,False,False,/r/worldnews/comments/1axjc6/armenia_is_the_first_country_in_the_world_to_make/,t3_1axjc6,1364160878,http://www.aljazeera.com/indepth/features/2013/03/201331792224757326.html,,nastratin,1364157278,21078,1592,,,ObjectID(51cd408bef7ac6f399000187),0
5443,5443,thelocal.fr,,worldnews,,,,,17jyra,False,France to deport radical Muslim clerics,,2997,,False,False,,t5_2qh13,False,,,8443,False,False,/r/worldnews/comments/17jyra/france_to_deport_radical_muslim_clerics/,t3_17jyra,1359539369,http://www.thelocal.fr/page/view/interior-ministers-vows-to-deport-radical-muslim-clerics,,1mk8,1359539369,11440,3266,,,ObjectID(51cd4090ef7ac6f3990001bc),0
5501,5501,uk.reuters.com,,worldnews,,,,,1elv9s,False,"Church must help the poorest, not dissect theology, Pope says",,2995,,False,False,,t5_2qh13,False,,,7751,False,False,/r/worldnews/comments/1elv9s/church_must_help_the_poorest_not_dissect_theology/,t3_1elv9s,1368929499,http://uk.reuters.com/article/2013/05/18/uk-pope-personal-idUKBRE94H0CS20130518,,MagmaSuperstar,1368925899,10746,1230,,,ObjectID(51cd4095ef7ac6f3990001f6),0
5530,5530,live.reuters.com,,worldnews,,,,,1ba8sn,False,Full war declaration statement from DPRK,,2989,,False,False,,t5_2qh13,False,,,11204,False,False,/r/worldnews/comments/1ba8sn/full_war_declaration_statement_from_dprk/,t3_1ba8sn,1364617525,http://live.reuters.com/Event/North_Korea/70001409,,Grapnor,1364613925,14193,4116,,,ObjectID(51cd4095ef7ac6f399000213),0
5566,5566,pasthorizonspr.com,,worldnews,,,,,12udaw,False," Ancient Buddhist city of Mes Aynak will be destroyed,  turned into an open pit copper mine",,2980,,False,False,,t5_2qh13,False,,,5235,False,False,/r/worldnews/comments/12udaw/ancient_buddhist_city_of_mes_aynak_will_be/,t3_12udaw,1352352133,http://www.pasthorizonspr.com/index.php/archives/11/2012/help-save-the-cultural-heritage-of-afghanistan,,PLEBEIAN_TYRANNY,1352352133,8215,717,,,ObjectID(51cd4095ef7ac6f399000237),0
5579,5579,bigstory.ap.org,,worldnews,,,,,1h66vv,False,The CIA's Plan To Cut Down On Leaks Was Just Leaked.,,2980,,False,False,,t5_2qh13,False,,,25779,False,False,/r/worldnews/comments/1h66vv/the_cias_plan_to_cut_down_on_leaks_was_just_leaked/,t3_1h66vv,1372359680,http://bigstory.ap.org/article/cia-cracks-down-its-own-stop-leaks,,Theonlymatt,1372330880,28759,1307,,,ObjectID(51cd4095ef7ac6f399000244),0
5593,5593,independent.co.uk,,worldnews,,,,,1fjdc1,False,Turkey’s PM dismisses protesters as just ‘a few looters’ as thousands return to Taksim Square,,2982,,False,False,,t5_2qh13,False,,,6767,False,False,/r/worldnews/comments/1fjdc1/turkeys_pm_dismisses_protesters_as_just_a_few/,t3_1fjdc1,1370209266,http://www.independent.co.uk/news/world/europe/turkeys-pm-dismisses-protesters-as-just-a-few-looters-as-thousands-return-to-taksim-square-8641336.html,,neilbuster,1370205666,9749,1043,,,ObjectID(51cd4095ef7ac6f399000252),0
5610,5610,guardian.co.uk,,worldnews,,,,,196pe7,False,Norwegian prison where inmates are treated like people has the lowest reoffending rate in Europe,,2982,,False,False,,t5_2qh13,False,,,16884,False,False,/r/worldnews/comments/196pe7/norwegian_prison_where_inmates_are_treated_like/,t3_196pe7,1361787358,http://www.guardian.co.uk/society/2013/feb/25/norwegian-prison-inmates-treated-like-people,,k-h,1361787358,19866,2312,,,ObjectID(51cd409bef7ac6f399000263),0
5624,5624,bbc.co.uk,,worldnews,,,,,14srh7,False,"BBC News - US, UK and Canada refuse to sign UN internet treaty",,2978,,False,False,,t5_2qh13,False,,,5022,False,False,/r/worldnews/comments/14srh7/bbc_news_us_uk_and_canada_refuse_to_sign_un/,t3_14srh7,1355425697,http://www.bbc.co.uk/news/technology-20717774,,rydtix,1355425697,8000,1125,,,ObjectID(51cd409bef7ac6f399000271),0
5640,5640,bbc.co.uk,,worldnews,,,,,1gejxu,False,Hassan Rouhani wins Iran presidential election,,2983,,False,False,,t5_2qh13,False,,,7593,False,False,/r/worldnews/comments/1gejxu/hassan_rouhani_wins_iran_presidential_election/,t3_1gejxu,1371315465,http://www.bbc.co.uk/news/world-middle-east-22916174,,mugustus,1371311865,10576,1157,,,ObjectID(51cd409bef7ac6f399000281),0
5645,5645,news.yahoo.com,,worldnews,,,,,15b91n,False,Philippines OKs divisive contraceptives bill: Philippine legislators passed a landmark bill that would provide government funding for contraceptives and sexuality classes in schools despite strong opposition by the dominant Roman Catholic Church and its followers,,2983,,False,False,,t5_2qh13,False,,,6771,False,False,/r/worldnews/comments/15b91n/philippines_oks_divisive_contraceptives_bill/,t3_15b91n,1356236152,http://news.yahoo.com/philippines-oks-divisive-contraceptives-bill-143300593.html,,mepper,1356236152,9754,511,,,ObjectID(51cd409bef7ac6f399000286),0
5695,5695,qz.com,,worldnews,,,,,1ebp9x,False,"There’s a country that will pay $300,000 per rhino horn to cure cancer and hangovers, and it’s wiping out rhinos",,2974,,False,False,,t5_2qh13,False,,,9326,False,False,/r/worldnews/comments/1ebp9x/theres_a_country_that_will_pay_300000_per_rhino/,t3_1ebp9x,1368555037,http://qz.com/82302/theres-a-country-that-will-pay-300000-per-rhino-horn-to-cure-cancer-and-hangovers-and-its-wiping-out-rhinos/,,hywong,1368551437,12300,1655,,,ObjectID(51cd409bef7ac6f3990002b8),0
5717,5717,csmonitor.com,,worldnews,,,,,1etaxd,False,North Korea's hidden labor camps exposed: A new UN panel is vowing to hold North Korea's Kim regime to 'full accountability' for decades of mass crime and murder. Will Pyongyang face ICC indictment?,,2973,,False,False,,t5_2qh13,False,,,11002,False,False,/r/worldnews/comments/1etaxd/north_koreas_hidden_labor_camps_exposed_a_new_un/,t3_1etaxd,1369198642,http://www.csmonitor.com/World/Asia-Pacific/2013/0521/North-Korea-s-hidden-labor-camps-exposed?nav=88-csm_category-topStories,,maxwellhill,1369195042,13975,1291,,,ObjectID(51cd409fef7ac6f3990002ce),0
5729,5729,japantoday.com,,worldnews,,,,,1c12b8,False,Germany gives Japan its backing as N Korea tensions rise,,2972,,False,False,,t5_2qh13,False,,,12759,False,False,/r/worldnews/comments/1c12b8/germany_gives_japan_its_backing_as_n_korea/,t3_1c12b8,1365557879,http://www.japantoday.com/category/politics/view/germany-gives-japan-its-backing-as-n-korea-tensions-rise,,jecjec81,1365554279,15731,3341,,,ObjectID(51cd409fef7ac6f3990002da),0
5743,5743,news.yahoo.com,,worldnews,,,,,136fnj,False,UN says access to contraception a human right,,2974,,False,False,,t5_2qh13,False,,,17153,False,False,/r/worldnews/comments/136fnj/un_says_access_to_contraception_a_human_right/,t3_136fnj,1352896985,Http://news.yahoo.com/un-says-access-contraception-human-122456723.html,,hypno_tode,1352896985,20127,3065,,,ObjectID(51cd409fef7ac6f3990002e8),0
5755,5755,reuters.com,,worldnews,,,,,139khi,False,"Mexico lawmaker introduces bill to legalize marijuana. A leftist Mexican lawmaker on Thursday presented a bill to legalize the production, sale and use of marijuana, adding to a growing chorus of Latin American politicians who are rejecting the prohibitionist policies of the United States.",,2975,,False,False,,t5_2qh13,False,,,9150,False,False,/r/worldnews/comments/139khi/mexico_lawmaker_introduces_bill_to_legalize/,t3_139khi,1353019884,http://www.reuters.com/article/2012/11/15/us-mexico-marijuana-idUSBRE8AE1V320121115?feedType=RSS&amp;feedName=lifestyleMolt,,Libertatea,1353019884,12125,930,,,ObjectID(51cd409fef7ac6f3990002f4),0
5757,5757,nytimes.com,,worldnews,,,,,11jzc7,False,"For eight months, starting last November, he was the prime minister of his native country, Somalia, one of the most chaotic nations on earth. And then, as suddenly as he had left, he was back in his cubicle at the Transportation Department in Buffalo, NY",,2967,,False,False,,t5_2qh13,False,,,4353,False,False,/r/worldnews/comments/11jzc7/for_eight_months_starting_last_november_he_was/,t3_11jzc7,1350365315,http://www.nytimes.com/2011/12/07/nyregion/after-serving-as-somalias-prime-minister-back-to-work-in-buffalo.html?pagewanted=all&amp;_r=0,,emr1028,1350361715,7320,651,,,ObjectID(51cd409fef7ac6f3990002f6),0
5766,5766,news.mongabay.com,,worldnews,,,,,1el94t,False,"In landmark ruling, Indonesia's indigenous people win right to millions of hectares of forest",,2968,,False,False,,t5_2qh13,False,,,8821,False,False,/r/worldnews/comments/1el94t/in_landmark_ruling_indonesias_indigenous_people/,t3_1el94t,1368907862,http://news.mongabay.com/2013/0517-indonesia-customary-forest.html,,maxwellhill,1368904262,11789,340,,,ObjectID(51cd409fef7ac6f3990002ff),0
5787,5787,theatlantic.com,,worldnews,,,,,kedxy,False,Vladimir Putin: Action Man [pics],,2961,,False,False,,t5_2qh13,False,,,11977,False,False,/r/worldnews/comments/kedxy/vladimir_putin_action_man_pics/,t3_kedxy,1315937551,http://www.theatlantic.com/infocus/2011/09/vladimir-putin-action-man/100147/,,SolInvictus,1315933951,14938,2076,,,ObjectID(51cd409fef7ac6f399000314),0
5795,5795,telegraph.co.uk,,worldnews,,,,,1azgxl,False,Japan breaks China's monopoly on rare metals with discovery of vast reserves (x-post from science),,2965,,False,False,,t5_2qh13,False,,,9113,False,False,/r/worldnews/comments/1azgxl/japan_breaks_chinas_monopoly_on_rare_metals_with/,t3_1azgxl,1364237111,http://www.telegraph.co.uk/finance/comment/ambroseevans_pritchard/9951299/Japan-breaks-Chinas-stranglehold-on-rare-metals-with-sea-mud-bonanza.html,,rubikhan,1364233511,12078,799,,,ObjectID(51cd409fef7ac6f39900031c),0
5797,5797,theglobeandmail.com,,worldnews,,,,,12yrr4,False,"Raped police officer offered cash to quit - ""A female police officer who was sexually assaulted by a male colleague has spent nearly three years being sidelined from her job – and says she is now being offered a few months’ salary to quit.""",,2964,,False,False,,t5_2qh13,False,,,9587,False,False,/r/worldnews/comments/12yrr4/raped_police_officer_offered_cash_to_quit_a/,t3_12yrr4,1352561989,http://www.theglobeandmail.com/news/national/raped-police-officer-offered-cash-to-quit/article5148153/,,salvia_d,1352561989,12551,830,,,ObjectID(51cd409fef7ac6f39900031e),0
5874,5874,euobserver.com,,worldnews,,,,,1g1r1y,False,Germany most snooped EU country by US,,2958,,False,False,,t5_2qh13,False,,,5604,False,False,/r/worldnews/comments/1g1r1y/germany_most_snooped_eu_country_by_us/,t3_1g1r1y,1370880948,http://euobserver.com/justice/120431,,Aschebescher,1370877348,8562,1295,,,ObjectID(51cd40a4ef7ac6f39900036b),0
5891,5891,reuters.com,,worldnews,,,,,ya882,False,Ecuador says Britain threatened to raid embassy to extract Julian Assange,,2961,,False,False,,t5_2qh13,False,,,6135,False,False,/r/worldnews/comments/ya882/ecuador_says_britain_threatened_to_raid_embassy/,t3_ya882,1345070176,http://www.reuters.com/article/2012/08/15/us-wikileaks-assange-ecuador-idUSBRE87E16N20120815,,wlpress,1345066576,9096,2418,,,ObjectID(51cd40a4ef7ac6f39900037c),0
5894,5894,news.yahoo.com,,worldnews,,,,,1gq17b,False,Pope Francis says that financial speculation and corruption were keeping millions of people in hunger and the financial crisis could not be used as an alibi for failing to help the poor,,2959,,False,False,,t5_2qh13,False,,,8736,False,False,/r/worldnews/comments/1gq17b/pope_francis_says_that_financial_speculation_and/,t3_1gq17b,1371759754,http://news.yahoo.com/pope-blames-speculation-corruption-scandalous-food-crisis-111649612.html,,DougBolivar,1371730954,11695,1502,,,ObjectID(51cd40a4ef7ac6f39900037f),0
5902,5902,wired.co.uk,,worldnews,,,,,1av04v,False,"Twitter sued £32m for refusing to reveal anti-semites - French court ruled Twitter must hand over details of people who'd tweeted racist &amp; anti-semitic remarks, &amp; set up a system that'd alert police to any further such posts as they happen. Twitter ignored the ruling.",,2958,,False,False,,t5_2qh13,False,,,12215,False,False,/r/worldnews/comments/1av04v/twitter_sued_32m_for_refusing_to_reveal/,t3_1av04v,1364055074,http://www.wired.co.uk/news/archive/2013-03/22/twitter-sued-france-anti-semitism,,anutensil,1364051474,15173,4979,,,ObjectID(51cd40aaef7ac6f399000387),0
5989,5989,rte.ie,,worldnews,,,,,16zb2o,False,Google Earth puts North Korea labour camps on the map - RTÉ News,,2952,,False,False,,t5_2qh13,False,,,11576,False,False,/r/worldnews/comments/16zb2o/google_earth_puts_north_korea_labour_camps_on_the/,t3_16zb2o,1358757820,http://www.rte.ie/news/2013/0110/google-earth-puts-north-korea-labour-camps-on-the-map.html,,badlarry001,1358757820,14528,927,,,ObjectID(51cd40aaef7ac6f3990003de),0
6000,6000,smh.com.au,,worldnews,,,,,1f6m4e,False,"Unvaccinated children will be banned from childcare facilities, and centres who do enrol them will face fines, after changes to the Public Health Act passed through cabinet Monday night (NSW, Australia)",,2947,,False,False,,t5_2qh13,False,,,8141,False,False,/r/worldnews/comments/1f6m4e/unvaccinated_children_will_be_banned_from/,t3_1f6m4e,1369721813,http://www.smh.com.au/nsw/unvaccinated-children-banned-from-nsw-childcare-centres-20130528-2n8wp.html,,MalaLoquebantur,1369718213,11088,1566,,,ObjectID(51cd40aeef7ac6f3990003e9),0
6009,6009,google.com,,worldnews,,,,,11n36a,False,"8,000-yr-old carvings in stone destroyed in Morocco’s High Atlas Mountains by Salafists, Muslims who strictly prohibit idolatry - The carvings depicted the sun as a divinity. “One of the carvings, called the ‘plaque of the sun,’ predates the arrival of the Phoenicians in Morocco.” ",,2946,,False,False,,t5_2qh13,False,,,8173,False,False,/r/worldnews/comments/11n36a/8000yrold_carvings_in_stone_destroyed_in_moroccos/,t3_11n36a,1350500539,http://www.google.com/hostednews/afp/article/ALeqM5j8YTcHzPr8qkQj8Be68BkdE6L1pA?docId=CNG.bbe1d6490ab6ef1279c6c7aa83c20199.261,,anutensil,1350496939,11119,2562,,,ObjectID(51cd40aeef7ac6f3990003f2),0
6033,6033,timesofindia.indiatimes.com,,worldnews,,,,,15dzm2,False,India rape victim raped by cops investigating case,,2947,,False,False,,t5_2qh13,False,,,7199,False,False,/r/worldnews/comments/15dzm2/india_rape_victim_raped_by_cops_investigating_case/,t3_15dzm2,1356380114,http://timesofindia.indiatimes.com/india/UP-rape-victim-raped-by-cops-probing-case/articleshow/17748777.cms,,terminalxposure,1356380114,10146,1816,,,ObjectID(51cd40aeef7ac6f39900040a),0
6073,6073,smh.com.au,,worldnews,,,,,15virv,False,Australian PM says abolishing compulsory voting would make democracy the plaything of cashed up interest groups.,,2935,,False,False,,t5_2qh13,False,,,6516,False,False,/r/worldnews/comments/15virv/australian_pm_says_abolishing_compulsory_voting/,t3_15virv,1357194079,http://www.smh.com.au/opinion/political-news/pm-vows-to-fight-any-qld-move-to-scrap-compulsory-voting-20130103-2c6hr.html,,da1inchpunch,1357194079,9451,2371,,,ObjectID(51cd40aeef7ac6f399000432),0
6094,6094,g1.globo.com,,worldnews,,,,,1grf9u,False,"""Occupy Brazil"" happening simultaneously in over 100 cities, totalling a few million people on the streets right now",,2941,,False,False,,t5_2qh13,False,,,6563,False,False,/r/worldnews/comments/1grf9u/occupy_brazil_happening_simultaneously_in_over/,t3_1grf9u,1371800483,http://g1.globo.com/brasil/fotos/2013/06/veja-fotos-de-protestos-realizados-pelo-pais-nesta-quinta-feira.html,,herrmann,1371771683,9504,739,,,ObjectID(51cd40aeef7ac6f399000447),0
6140,6140,guardian.co.uk,,worldnews,,,,,1gcp5d,False,UK's 5 biggest banks lose 2.4 million customers in protests against banking scandals,,2939,,False,False,,t5_2qh13,False,,,10077,False,False,/r/worldnews/comments/1gcp5d/uks_5_biggest_banks_lose_24_million_customers_in/,t3_1gcp5d,1371237026,http://www.guardian.co.uk/money/2013/jun/13/big-banks-lose-customers-protest,,HenryCorp,1371233426,13016,448,,,ObjectID(51cd40b3ef7ac6f399000475),0
6147,6147,washingtonpost.com,,worldnews,,,,,17gy1m,False,Google unveils detailed map of North Korea,,2931,,False,False,,t5_2qh13,False,,,7770,False,False,/r/worldnews/comments/17gy1m/google_unveils_detailed_map_of_north_korea/,t3_17gy1m,1359426420,http://www.washingtonpost.com/wp-srv/special/world/Google-unveils-detailed-map-of-North-Korea/index.html,,MidwestDrummer,1359426420,10701,1254,,,ObjectID(51cd40b3ef7ac6f39900047c),0
6205,6205,astronomynow.com,,worldnews,,,,,10ifc9,False,New comet discovered predicted to blaze brighter than the full moon next year,,2933,,False,False,,t5_2qh13,False,,,6117,False,False,/r/worldnews/comments/10ifc9/new_comet_discovered_predicted_to_blaze_brighter/,t3_10ifc9,1348678775,http://www.astronomynow.com/news/n1209/25comet/#.UGMQXQyVuJI.facebook,,doppelgin,1348675175,9050,973,,,ObjectID(51cd40b8ef7ac6f3990004b6),0
6251,6251,money.cnn.com,,worldnews,,,,,17768o,False,Prime Minister David Cameron calls for a worldwide crackdown on big companies that avoid paying taxes.,,2926,,False,False,,t5_2qh13,False,,,5986,False,False,/r/worldnews/comments/17768o/prime_minister_david_cameron_calls_for_a/,t3_17768o,1359048448,http://money.cnn.com/2013/01/24/news/economy/cameron-tax-trade/index.html?iid=HP_Highlight,,doogie92,1359048448,8912,680,,,ObjectID(51cd40b8ef7ac6f3990004e4),0
6270,6270,m.guardian.co.uk,,worldnews,,,,,1ghop1,False,"Police brutality caused a pregnant victim to miscarry on Saturday night; six rounds of teargas was fired into an impromptu medical clinic housed in a tent in Istanbul. PM Erdogan threatens news reporters: ""Turkey is not a country that international media can play games on.""",,2922,,False,False,,t5_2qh13,False,,,9808,False,False,/r/worldnews/comments/1ghop1/police_brutality_caused_a_pregnant_victim_to/,t3_1ghop1,1371466696,http://m.guardian.co.uk/world/2013/jun/16/turkey-unrest-clashes-istanbul-erdogan,,yardimet,1371437896,12730,1114,,,ObjectID(51cd40b8ef7ac6f3990004f7),0
6273,6273,spiegel.de,,worldnews,,,,,1b3vob,False,Portugal: 12 Years After Decriminalizing Drugs,,2925,,False,False,,t5_2qh13,False,,,9263,False,False,/r/worldnews/comments/1b3vob/portugal_12_years_after_decriminalizing_drugs/,t3_1b3vob,1364393198,http://www.spiegel.de/international/europe/evaluating-drug-decriminalization-in-portugal-12-years-later-a-891060.html,,seffrican,1364389598,12188,1292,,,ObjectID(51cd40b8ef7ac6f3990004fa),0
6313,6313,scmp.com,,worldnews,,,,,1gne2e,False,"Subway Contractor Destroys Ancient Tombs—Workers have destroyed over 12 historically significant tombs ( 2,200-3,000 yrs old) on China's Da Gong Mountain. “Yesterday we were still conducting archaeological excavations, but all 5 tombs were gone this morning.”",,2920,,False,False,,t5_2qh13,False,,,6798,False,False,/r/worldnews/comments/1gne2e/subway_contractor_destroys_ancient_tombsworkers/,t3_1gne2e,1371670712,http://www.scmp.com/news/china/article/1262466/work-guangzhou-metro-line-6-destroys-five-ancient-tombs,,anutensil,1371641912,9718,1002,,,ObjectID(51cd40bdef7ac6f399000522),0
