,Unnamed: 0,domain,banned_by,subreddit,selftext_html,selftext,likes,link_flair_text,id,clicked,title,media,score,approved_by,over_18,hidden,thumbnail,subreddit_id,edited,link_flair_css_class,author_flair_css_class,downs,saved,is_self,permalink,name,created,url,author_flair_text,author,created_utc,ups,num_comments,num_reports,distinguished,_id,__v
7212,7212,news.oneindia.in,,worldnews,,,,,1cr0oh,False,Pope cancels salaries of cardinals overseeing bank,,2845,,False,False,,t5_2qh13,False,,,4949,False,False,/r/worldnews/comments/1cr0oh/pope_cancels_salaries_of_cardinals_overseeing_bank/,t3_1cr0oh,1366482105,http://news.oneindia.in/2013/04/20/pope-cancels-salaries-of-cardinals-overseeing-bank-1198193.html,,spicetwist,1366478505,7794,833,,,ObjectID(51cd40f544a454f899000139),0
7217,7217,bloomberg.com,,worldnews,,,,,13xg93,False,Spain Intends to Back Palestinian Bid for Statehood at UN.,,2855,,False,False,,t5_2qh13,False,,,4737,False,False,/r/worldnews/comments/13xg93/spain_intends_to_back_palestinian_bid_for/,t3_13xg93,1354101124,http://www.bloomberg.com/news/2012-11-28/spain-intends-to-back-palestinian-bid-for-statehood-at-un.html,,RationalMind888,1354101124,7592,1712,,,ObjectID(51cd40f544a454f89900013e),0
7222,7222,guardian.co.uk,,worldnews,,,,,lo9gt,False,"The bankers' blockade of WikiLeaks must end: Whether you support WikiLeaks or not, the blockade by Visa, Mastercard, Paypal and others is a sinister attack on free speech",,2852,,False,False,,t5_2qh13,False,,,14761,False,False,/r/worldnews/comments/lo9gt/the_bankers_blockade_of_wikileaks_must_end/,t3_lo9gt,1319543148,http://www.guardian.co.uk/commentisfree/2011/oct/24/bankers-wikileaks-free-speech,,maxwellhill,1319539548,17613,1715,,,ObjectID(51cd40f544a454f899000143),0
7234,7234,falkvinge.net,,worldnews,,,,,tjl3w,False,"The Dutch judge who ordered The Pirate Bay links censored, Chris Hensen, has been found to be textbook corrupt - he had commercial ventures with the plaintiffs in previous anti-piracy cases",,2849,,False,False,,t5_2qh13,False,,,14279,False,False,/r/worldnews/comments/tjl3w/the_dutch_judge_who_ordered_the_pirate_bay_links/,t3_tjl3w,1336830590,http://falkvinge.net/2012/05/12/dutch-judge-who-ordered-pirate-bay-links-censored-found-to-be-corrupt/,,maxwellhill,1336826990,17128,498,,,ObjectID(51cd40f544a454f89900014f),0
7251,7251,bloomberg.com,,worldnews,,,,,17hw0a,False,Libor Lies Revealed in Rigging of $300 Trillion Benchmark -- The benchmark rate for more than $300 trillion of contracts was based on honesty. New evidence in banking's biggest scandal shows traders took it as a license to cheat. ,,2847,,False,False,,t5_2qh13,False,,,5227,False,False,/r/worldnews/comments/17hw0a/libor_lies_revealed_in_rigging_of_300_trillion/,t3_17hw0a,1359470332,http://www.bloomberg.com/news/2013-01-28/libor-lies-revealed-in-rigging-of-300-trillion-benchmark.html,,DavidCarraway,1359470332,8074,772,,,ObjectID(51cd40f544a454f899000160),0
7267,7267,af.reuters.com,,worldnews,,,,,fpo4h,False,Libyan airforce colonels ordered to attack protestors in fighter jets... instead they fly to Malta and defect,,2847,,False,False,,t5_2qh13,False,,,7657,False,False,/r/worldnews/comments/fpo4h/libyan_airforce_colonels_ordered_to_attack/,t3_fpo4h,1298310379,http://af.reuters.com/article/libyaNews/idAFLDE71K23020110221,,Sealbhach,1298310379,10504,1133,,,ObjectID(51cd40f544a454f899000170),0
7282,7282,bbc.co.uk,,worldnews,,,,,1h0gj6,False,Afghan Presidential Palace is Under Attack,,2841,,False,False,,t5_2qh13,False,,,6672,False,False,/r/worldnews/comments/1h0gj6/afghan_presidential_palace_is_under_attack/,t3_1h0gj6,1372156741,http://www.bbc.co.uk/news/world-asia-23042005,,RoswellSpaceman,1372127941,9513,1034,,,ObjectID(51cd40f544a454f89900017f),0
7290,7290,pri.org,,worldnews,,,,,177ho5,False,A group of Delhi women have decided the best way to make sure women are safe is to create a special cab service just for them. Women drive the cabs and only pick up women passengers. ,,2846,,False,False,,t5_2qh13,False,,,12490,False,False,/r/worldnews/comments/177ho5/a_group_of_delhi_women_have_decided_the_best_way/,t3_177ho5,1359057422,http://www.pri.org/stories/business/global-development/women-form-special-cab-service-in-delhi-catering-exclusively-to-women-12782.html,,imatworkprobably,1359057422,15336,1263,,,ObjectID(51cd40f544a454f899000187),0
7309,7309,reuters.com,,worldnews,,,,,znbe4,False,"Impoverished North Korea has accepted an offer of aid from rival South Korea after devastating summer floods, the South said on Monday, the first time the new leadership in Pyongyang has accepted aid from Seoul.",,2842,,False,False,,t5_2qh13,False,,,9765,False,False,/r/worldnews/comments/znbe4/impoverished_north_korea_has_accepted_an_offer_of/,t3_znbe4,1347277555,http://www.reuters.com/article/2012/09/10/us-korea-north-aid-idUSBRE8890EY20120910?feedType=RSS&amp;feedName=worldNews&amp;utm_source=feedburner&amp;utm_medium=feed&amp;utm_campaign=Feed%3A+Reuters%2FworldNews+%28Reuters+World+News%29,,[deleted],1347273955,12607,812,,,ObjectID(51cd40fe44a454f89900019a),0
7347,7347,usatoday.com,,worldnews,,,,,1dfqju,False,2-year-old girl gets windpipe made from stem cells,,2837,,False,False,,t5_2qh13,False,,,7555,False,False,/r/worldnews/comments/1dfqju/2yearold_girl_gets_windpipe_made_from_stem_cells/,t3_1dfqju,1367359675,http://www.usatoday.com/story/news/nation/2013/04/30/girl-windpipe-stem-cells/2123881/,,Buck-Nasty,1367356075,10392,542,,,ObjectID(51cd40fe44a454f8990001c0),0
7350,7350,news.yahoo.com,,worldnews,,,,,1cqnz3,False,"""Czechs: we're not Chechens""",,2833,,False,False,,t5_2qh13,False,,,12914,False,False,/r/worldnews/comments/1cqnz3/czechs_were_not_chechens/,t3_1cqnz3,1366469520,http://news.yahoo.com/czechs-were-not-chechens-132405023.html;_ylt=AvzQM1g1u1bZaPa7uVpW8EJvaA8F;_ylu=X3oDMTNyMzVhcnJjBG1pdANUb3BTdG9yeSBXb3JsZFNGBHBrZwNiNjA3YzMzNy1lNThlLTM2ZWQtODc3MC03YWQzMjU5MDU0MGQEcG9zAzE1BHNlYwN0b3Bfc3RvcnkEdmVyA2M3YWI5NGMwLWE5YmQtMTFlMi1iZmZkLWMyZGVmMGY5ZGY2ZA--;_ylg=X3oDMTFqOTI2ZDZmBGludGwDdXMEbGFuZwNlbi11cwRwc3RhaWQDBHBzdGNhdAN3b3JsZARwdANzZWN0aW9ucw--;_ylv=3,,aliaschick559,1366465920,15747,3468,,,ObjectID(51cd40fe44a454f8990001c3),0
7362,7362,rt.com,,worldnews,,,,,vdjvm,False,"ACTA rejected by last committee, crucial blow before final EU Parliament vote: 'The Internet, in all its diversity, winning a global political battle against some of the most powerful industries and governments'",,2844,,False,False,,t5_2qh13,False,,,8973,False,False,/r/worldnews/comments/vdjvm/acta_rejected_by_last_committee_crucial_blow/,t3_vdjvm,1340278483,http://www.rt.com/news/acta-committee-final-vote-365/,,circoloco,1340274883,11817,272,,,ObjectID(51cd40fe44a454f8990001cf),0
7395,7395,dutchnews.nl,,worldnews,,,,,12gg1l,False,"Amsterdam will not ban tourists from coffee shops, says mayor",,2833,,False,False,,t5_2qh13,False,,,9263,False,False,/r/worldnews/comments/12gg1l/amsterdam_will_not_ban_tourists_from_coffee_shops/,t3_12gg1l,1351780787,http://www.dutchnews.nl/news/archives/2012/11/amsterdam_will_not_ban_tourist.php,,cccbreaker,1351777187,12096,1049,,,ObjectID(51cd40fe44a454f8990001f0),0
7402,7402,smh.com.au,,worldnews,,,,,1f4b9i,False,116 year old Japanese man now the last male alive that was born in the 19th century,,2833,,False,False,,t5_2qh13,False,,,6046,False,False,/r/worldnews/comments/1f4b9i/116_year_old_japanese_man_now_the_last_male_alive/,t3_1f4b9i,1369631311,http://www.smh.com.au/world/outnumbered-by-the-girls-hes-the-last-man-standing-20130524-2k6ry.html,,superstoreman,1369627711,8879,581,,,ObjectID(51cd410444a454f89900025b),0
7414,7414,scientificamerican.com,,worldnews,,,,,mdwox,False,"EU has banned the use of X-ray body scanners in European airports, parting ways with the US TSA which has deployed hundreds of the scanners as a way to screen millions of airline passengers for explosives hidden under clothing",,2838,,False,False,,t5_2qh13,False,,,7647,False,False,/r/worldnews/comments/mdwox/eu_has_banned_the_use_of_xray_body_scanners_in/,t3_mdwox,1321412365,http://www.scientificamerican.com/article.cfm?id=europe-bans-x-ray-body-scanners,,maxwellhill,1321412365,10485,859,,,ObjectID(51cd410444a454f899000267),0
7452,7452,blogs.aljazeera.com,,worldnews,,,,,1gdvh0,False,"Syria chemical weapons - no questions asked; At briefing No one, not one person asked if the Obama administration would make public any of its ""proof"" that the Assad regime had used chemical weapons.",,2840,,False,False,,t5_2qh13,False,,,5449,False,False,/r/worldnews/comments/1gdvh0/syria_chemical_weapons_no_questions_asked_at/,t3_1gdvh0,1371275581,http://blogs.aljazeera.com/blog/americas/syria-chemical-weapons-no-questions-asked,,buzzit292,1371271981,8289,1587,,,ObjectID(51cd410444a454f89900028d),0
7471,7471,edmonton.ctvnews.ca,,worldnews,,,,,1bnehm,False,Canadian father 'appalled' that mother who drowned two young boys and left their dead bodies for her husband to find next to her wedding ring will be released after serving only 10 months.,,2834,,False,False,,t5_2qh13,False,,,6130,False,False,/r/worldnews/comments/1bnehm/canadian_father_appalled_that_mother_who_drowned/,t3_1bnehm,1365067381,http://edmonton.ctvnews.ca/father-appalled-that-millet-mother-who-drowned-young-boys-could-be-released-thursday-1.1222857,,esmeriolis,1365063781,8964,1838,,,ObjectID(51cd410444a454f8990002a0),0
7473,7473,uk.reuters.com,,worldnews,,,,,1ao6df,False,"European Union lawmakers are expected to agree on Wednesday to bar bankers in Europe from getting bonuses bigger than their salary, introducing the first cap of its kind globally.",,2835,,False,False,,t5_2qh13,False,,,4828,False,False,/r/worldnews/comments/1ao6df/european_union_lawmakers_are_expected_to_agree_on/,t3_1ao6df,1363801201,http://uk.reuters.com/article/2013/03/20/uk-eu-bonus-idUKBRE92J00620130320,,[deleted],1363797601,7663,691,,,ObjectID(51cd410444a454f8990002a2),0
7503,7503,cnn.com,,worldnews,,,,,1f4t3e,False,"Chinese tourist carved ""Ding Jinhao was here"" in a 3,500 year old Egyptian temple: ""We want to apologize to the Egyptian people and to people who have paid attention to this case across China""",,2832,,False,False,,t5_2qh13,False,,,9337,False,False,/r/worldnews/comments/1f4t3e/chinese_tourist_carved_ding_jinhao_was_here_in_a/,t3_1f4t3e,1369659354,http://www.cnn.com/2013/05/27/travel/china-egypt/?sr=google_news&amp;google_editors_picks=true,,DougBolivar,1369655754,12169,1720,,,ObjectID(51cd410944a454f8990002c0),0
7540,7540,reuters.com,,worldnews,,,,,xdcd7,False," Germany Breaks 25% Renewable Energy Barrier - It produced 67.9 billion kWh renewable energy in 1st 1/2 of 2012, an increase of 19.5% from last year. The world's top market for power converted from solar radiation, its installed capacity accounts for over 1/3 of global total.",,2831,,False,False,,t5_2qh13,False,,,6656,False,False,/r/worldnews/comments/xdcd7/germany_breaks_25_renewable_energy_barrier_it/,t3_xdcd7,1343618512,http://www.reuters.com/article/2012/07/26/germany-renewables-idUSL6E8IQIA720120726,,anutensil,1343614912,9487,2136,,,ObjectID(51cd410944a454f8990002e5),0
7543,7543,arstechnica.com,,worldnews,,,,,1h3ltk,False,"Former Icelandic minister asked “8 or 9” FBI agents to leave country - Agents said they were there to stop hackers, were really investigating WikiLeaks.",,2824,,False,False,,t5_2qh13,False,,,3255,False,False,/r/worldnews/comments/1h3ltk/former_icelandic_minister_asked_8_or_9_fbi_agents/,t3_1h3ltk,1372270476,http://arstechnica.com/tech-policy/2013/06/iceland-a-nexus-for-us-wikileaks-investigations-new-york-times-says/,,bimonscificon,1372241676,6079,325,,,ObjectID(51cd410944a454f8990002e8),0
7570,7570,abcnews.go.com,,worldnews,,,,,14dpby,False,"Mexican court rules in favor of same-sex marriage—Mexico's Supreme Court ruled that law in Oaxaca banning same-sex marriages is unconstitutional, paving way for same-sex couples to marry in that state &amp; possibly in the rest of Mexico.",,2830,,False,False,,t5_2qh13,False,,,7131,False,False,/r/worldnews/comments/14dpby/mexican_court_rules_in_favor_of_samesex/,t3_14dpby,1354796374,http://abcnews.go.com/International/wireStory/mexican-court-rules-favor-sex-marriage-17890707#.UMCMkYOumXk,,anutensil,1354796374,9961,992,,,ObjectID(51cd410944a454f899000303),0
7620,7620,now.msn.com,,worldnews,,,,,1h3lgn,False,Netherlands closing prisons due to lack of prisoners,,2822,,False,False,,t5_2qh13,False,,,3674,False,False,/r/worldnews/comments/1h3lgn/netherlands_closing_prisons_due_to_lack_of/,t3_1h3lgn,1372269864,http://now.msn.com/netherlands-closing-prisons-due-to-lack-of-prisoners#scpshrtu,,johnnygrant,1372241064,6496,601,,,ObjectID(51cd410e44a454f899000335),0
7634,7634,news.yahoo.com,,worldnews,,,,,15fj8g,False,"Mexico Bishop Inspires, Infuriates by Telling 1,000s Gathered in Stadium That Politicians are Tied to Organized Crime, Lawmakers' Attempts to Curb Money Laundering are Intentionally Weak, &amp; New Labor Reforms are a Way to Enslave Mexican Workers",,2820,,False,False,,t5_2qh13,False,,,4767,False,False,/r/worldnews/comments/15fj8g/mexico_bishop_inspires_infuriates_by_telling/,t3_15fj8g,1356463621,http://news.yahoo.com/mexico-bishop-inspires-infuriates-activism-162210371.html,,anutensil,1356463621,7587,588,,,ObjectID(51cd410e44a454f899000343),0
7660,7660,reuters.com,,worldnews,,,,,bozxs,False,Polish president's plane crashes in Russia,,2822,,False,False,,t5_2qh13,False,,,1837,False,False,/r/worldnews/comments/bozxs/polish_presidents_plane_crashes_in_russia/,t3_bozxs,1270888897,http://www.reuters.com/article/idUSTRE6390K120100410,,[deleted],1270885297,4659,1060,,,ObjectID(51cd410e44a454f89900035d),0
7684,7684,secularism.org.uk,,worldnews,,,,,13hs3i,False,Italian Catholic Church to pay property tax from next year,,2816,,False,False,,t5_2qh13,False,,,5475,False,False,/r/worldnews/comments/13hs3i/italian_catholic_church_to_pay_property_tax_from/,t3_13hs3i,1353387055,http://www.secularism.org.uk/news/2012/11/italian-catholic-church-to-pay-property-tax-from-next-year,,ImNotJesus,1353387055,8291,443,,,ObjectID(51cd410e44a454f899000375),0
7690,7690,reuters.com,,worldnews,,,,,eadmg,False,"North Korea has fired several artillery shells across its western maritime border, prompting return fire from South Korea",,2821,,False,False,,t5_2qh13,False,,,7261,False,False,/r/worldnews/comments/eadmg/north_korea_has_fired_several_artillery_shells/,t3_eadmg,1290493955,http://www.reuters.com/article/idUSTRE6AM0TZ20101123,,Maryleaf,1290493955,10082,2303,,,ObjectID(51cd410e44a454f89900037b),0
7710,7710,reuters.com,,worldnews,,,,,zbxed,False,"Impunity for the rich and famous leaves Thais outraged. A dented silver Ferrari, a dead Thai policeman whose body was dragged for 200 meters under its wheels, a family driver ready to take the fall for the wealthy 27-year-old heir to the world-famous Red Bull energy drink empire.",,2813,,False,False,,t5_2qh13,False,,,9221,False,False,/r/worldnews/comments/zbxed/impunity_for_the_rich_and_famous_leaves_thais/,t3_zbxed,1346762086,http://www.reuters.com/article/2012/09/04/us-thailand-justice-idUSBRE8830EM20120904?feedType=RSS&amp;feedName=worldNews&amp;utm_source=feedburner&amp;utm_medium=feed&amp;utm_campaign=Feed%3A+Reuters%2FworldNews+%28Reuters+World+News%29,,[deleted],1346758486,12034,921,,,ObjectID(51cd411344a454f89900038f),0
7732,7732,guardian.co.uk,,worldnews,,,,,wxq2j,False,$21tn: hoard hidden from taxman by global elite,,2821,,False,False,,t5_2qh13,False,,,7585,False,False,/r/worldnews/comments/wxq2j/21tn_hoard_hidden_from_taxman_by_global_elite/,t3_wxq2j,1342905462,http://www.guardian.co.uk/business/2012/jul/21/global-elite-tax-offshore-economy,,iceicebaba,1342901862,10406,3209,,,ObjectID(51cd411344a454f8990003a5),0
7740,7740,telegraph.co.uk,,worldnews,,,,,14wa0s,False,A real first world problem: More people are killed by obesity than malnutrition,,2814,,False,False,,t5_2qh13,False,,,9124,False,False,/r/worldnews/comments/14wa0s/a_real_first_world_problem_more_people_are_killed/,t3_14wa0s,1355585098,http://www.telegraph.co.uk/health/healthnews/9742960/Obesity-killing-three-times-as-many-as-malnutrition.html,,the_electric_gigolo,1355585098,11938,1436,,,ObjectID(51cd411344a454f8990003ad),0
7747,7747,torrentfreak.com,,worldnews,,,,,o3za7,False,US Threatened To Blacklist Spain For Not Implementing Site Blocking Law,,2816,,False,False,,t5_2qh13,False,,,12546,False,False,/r/worldnews/comments/o3za7/us_threatened_to_blacklist_spain_for_not/,t3_o3za7,1325774672,https://torrentfreak.com/us-threatened-to-blacklist-spain-for-not-implementing-site-blocking-law-120105/,,maxwellhill,1325774672,15362,1447,,,ObjectID(51cd411344a454f8990003b4),0
7749,7749,guardian.co.uk,,worldnews,,,,,1gbs3p,False,"PRISM-style surveillance is global, Julian Assange says ""Edward Snowden revealed something that I've been speaking about for a long time, providing clear concrete proof that the internet has penetrated every aspect of society, right along with it is mass surveillance,"" he said.",,2813,,False,False,,t5_2qh13,False,,,7638,False,False,/r/worldnews/comments/1gbs3p/prismstyle_surveillance_is_global_julian_assange/,t3_1gbs3p,1371200974,http://www.guardian.co.uk/world/2013/jun/14/wikileaks-australia-surveillance-google-julian-assange,,Libertatea,1371197374,10451,752,,,ObjectID(51cd411344a454f8990003b6),0
7757,7757,washingtonpost.com,,worldnews,,,,,13uf4o,False,"""One challenge I have when I speak about North Korea is I run out of adjectives for how bad things are... This place is almost this black hole for modern civilization""",,2813,,False,False,,t5_2qh13,False,,,4980,False,False,/r/worldnews/comments/13uf4o/one_challenge_i_have_when_i_speak_about_north/,t3_13uf4o,1353977719,http://www.washingtonpost.com/blogs/worldviews/wp/2012/11/26/it-really-is-that-bad-a-powerful-speech-on-north-korea/,,nuktl,1353977719,7793,1837,,,ObjectID(51cd411344a454f8990003be),0
7763,7763,guardian.co.uk,,worldnews,,,,,uzu5l,False,"Former British PM John Major testifies that Rupert 
Murdoch demanded his government change its 
policy on Europe or his papers would oppose him at 
the 1997 general election.",,2811,,False,False,,t5_2qh13,False,,,5816,False,False,/r/worldnews/comments/uzu5l/former_british_pm_john_major_testifies_that/,t3_uzu5l,1339600861,http://www.guardian.co.uk/media/2012/jun/12/rupert-murdoch-john-major,,mongolianhousesitter,1339597261,8627,676,,,ObjectID(51cd411344a454f8990003c4),0
7774,7774,reuters.com,,worldnews,,,,,1cshcr,False,"China says aims to banish superstition, promote knowledge",,2820,,False,False,,t5_2qh13,False,,,6300,False,False,/r/worldnews/comments/1cshcr/china_says_aims_to_banish_superstition_promote/,t3_1cshcr,1366534724,http://www.reuters.com/article/2013/04/21/us-china-religion-idUSBRE93K02D20130421?feedType=RSS&amp;feedName=worldNews,,BanMePleaase,1366531124,9120,1520,,,ObjectID(51cd411344a454f8990003cf),0
7785,7785,bbc.co.uk,,worldnews,,,,,ra452,False,A Kazakh shooting gold medallist is stunned as the comedy national anthem from the film Borat is played for her victory in Kuwait instead of the real one.,,2815,,False,False,,t5_2qh13,False,,,11679,False,False,/r/worldnews/comments/ra452/a_kazakh_shooting_gold_medallist_is_stunned_as/,t3_ra452,1332522561,http://www.bbc.co.uk/news/world-middle-east-17491344,,DrJulianBashir,1332518961,14494,1158,,,ObjectID(51cd411344a454f8990003da),0
7791,7791,reuters.com,,worldnews,,,,,1drc6j,False,UN investigator says evidence is that rebels NOT Syria's government used chemical weapons.,,2809,,False,False,,t5_2qh13,False,,,5399,False,False,/r/worldnews/comments/1drc6j/un_investigator_says_evidence_is_that_rebels_not/,t3_1drc6j,1367800757,http://www.reuters.com/article/2013/05/05/us-syria-crisis-un-idUSBRE94409Z20130505,,pill_popper,1367797157,8208,1593,,,ObjectID(51cd411344a454f8990003e0),0
7815,7815,cbc.ca,,worldnews,,,,,1dserg,False,Canadian teacher's career ruined by cyber-stalker ex-girlfriend even after she was placed in jail and ordered to pay him damages. Not many schools want to hire a teacher who is accused of being a pedophile.,,2809,,False,False,,t5_2qh13,False,,,8176,False,False,/r/worldnews/comments/1dserg/canadian_teachers_career_ruined_by_cyberstalker/,t3_1dserg,1367847700,http://www.cbc.ca/news/canada/story/2013/05/03/bc-cyber-stalking.html,,adamsons,1367844100,10985,2226,,,ObjectID(51cd411844a454f8990003f8),0
7825,7825,dailystar.com.lb,,worldnews,,,,,13ici8,False,"Israel air force drops leaflets across Gaza City warning residents to evacuate homes ""immediately""",,2811,,False,False,,t5_2qh13,False,,,7963,False,False,/r/worldnews/comments/13ici8/israel_air_force_drops_leaflets_across_gaza_city/,t3_13ici8,1353421357,http://www.dailystar.com.lb/News/Middle-East/2012/Nov-20/195685-israel-army-leaflet-warns-gazans-to-leave-homes.ashx#axzz2ClyME0Z1,,twolf1,1353421357,10774,5484,,,ObjectID(51cd411844a454f899000402),0
7863,7863,aljazeera.com,,worldnews,,,,,1giekt,False,Turkey threatens to deploy army to end unrest,,2814,,False,False,,t5_2qh13,False,,,5108,False,False,/r/worldnews/comments/1giekt/turkey_threatens_to_deploy_army_to_end_unrest/,t3_1giekt,1371474513,http://www.aljazeera.com/news/europe/2013/06/201361742432736655.html,,mandala7,1371470913,7922,959,,,ObjectID(51cd411844a454f899000428),0
7877,7877,huffingtonpost.com,,worldnews,,,,,12ekp1,False,"France deports radical imam for advocating holy war, violence against women",,2810,,False,False,,t5_2qh13,False,,,7704,False,False,/r/worldnews/comments/12ekp1/france_deports_radical_imam_for_advocating_holy/,t3_12ekp1,1351704049,http://www.huffingtonpost.com/huff-wires/20121031/eu-france-imam/,,successadult,1351700449,10514,2334,,,ObjectID(51cd411844a454f899000436),0
7902,7902,torrentfreak.com,,worldnews,,,,,1e272r,False,Pirate Bay takes over distribution of censored 3D Printable Gun,,2809,,False,False,,t5_2qh13,False,,,14941,False,False,/r/worldnews/comments/1e272r/pirate_bay_takes_over_distribution_of_censored_3d/,t3_1e272r,1368183040,http://torrentfreak.com/pirate-bay-takes-over-distribution-of-censored-3d-printable-gun-130510/,,ani625,1368179440,17750,4908,,,ObjectID(51cd411d44a454f89900044f),0
7903,7903,news.nationalpost.com,,worldnews,,,,,1dk7ma,False,Two Chinese kindergarten students die after rival school poisons yogurt,,2800,,False,False,,t5_2qh13,False,,,9026,False,False,/r/worldnews/comments/1dk7ma/two_chinese_kindergarten_students_die_after_rival/,t3_1dk7ma,1367517979,http://news.nationalpost.com/2013/05/02/two-chinese-kindergarten-students-die-after-rival-school-poisons-yogurt/,,odetocapitalism,1367514379,11826,1287,,,ObjectID(51cd411d44a454f899000450),0
7911,7911,en.ria.ru,,worldnews,,,,,ujt71,False,"Eduard Khil ('Trololo Guy') dies in St. Petersburg, aged 77",,2804,,False,False,,t5_2qh13,False,,,18617,False,False,/r/worldnews/comments/ujt71/eduard_khil_trololo_guy_dies_in_st_petersburg/,t3_ujt71,1338793221,http://en.ria.ru/world/20120604/173831212.html,,stoichkov,1338789621,21421,1203,,,ObjectID(51cd411d44a454f899000458),0
7918,7918,telegraph.co.uk,,worldnews,,,,,122p01,False,"North Korean army minister executed with mortar round. ""Kim Chol was forced to stand on a spot that had been zeroed in for a mortar round and ""obliterated.""",,2804,,False,False,,t5_2qh13,False,,,7136,False,False,/r/worldnews/comments/122p01/north_korean_army_minister_executed_with_mortar/,t3_122p01,1351189016,http://www.telegraph.co.uk/news/worldnews/asia/northkorea/9630509/North-Korean-army-minister-executed-with-mortar-round.html,,ShellOilNigeria,1351185416,9940,2015,,,ObjectID(51cd411d44a454f89900045f),0
7920,7920,independent.co.uk,,worldnews,,,,,11evf9,False,"A pharmaceutical giant has withdrawn an existing treatment for MS, and rebranded it. It now sells at twenty times the original price.",,2812,,False,False,,t5_2qh13,False,,,17058,False,False,/r/worldnews/comments/11evf9/a_pharmaceutical_giant_has_withdrawn_an_existing/,t3_11evf9,1350137757,http://www.independent.co.uk/life-style/health-and-families/health-news/exclusive-ms-drug-rebranded--at-up-to-20-times-the-price-8209885.html,,scientologist2,1350134157,19870,1693,,,ObjectID(51cd411d44a454f899000461),0
7925,7925,devex.com,,worldnews,,,,,o10yn,False,Doctors Without Borders loses contact with 130 staff members in South Sudan; clinic destroyed,,2808,,False,False,,t5_2qh13,False,,,11093,False,False,/r/worldnews/comments/o10yn/doctors_without_borders_loses_contact_with_130/,t3_o10yn,1325593745,http://www.devex.com/en/blogs/the-development-newswire/msf-loses-track-of-130-staff-in-pibor,,alquanna,1325593745,13901,1114,,,ObjectID(51cd411d44a454f899000466),0
7958,7958,telegraph.co.uk,,worldnews,,,,,1gqt9o,False,"""Japanese scientists are expecting to be granted approval to grow human organs in animals and then harvest them for transplant within the next year.""",,2796,,False,False,,t5_2qh13,False,,,5544,False,False,/r/worldnews/comments/1gqt9o/japanese_scientists_are_expecting_to_be_granted/,t3_1gqt9o,1371783323,http://www.telegraph.co.uk/science/science-news/10132347/Human-organs-could-be-grown-in-animals-within-a-year.html,,trot-trot,1371754523,8340,667,,,ObjectID(51cd411d44a454f899000487),0
7961,7961,news.yahoo.com,,worldnews,,,,,1f773d,False,Israel warns Moscow that it will attack shipments of Russian weapons to Syria,,2801,,False,False,,t5_2qh13,False,,,8291,False,False,/r/worldnews/comments/1f773d/israel_warns_moscow_that_it_will_attack_shipments/,t3_1f773d,1369754162,http://news.yahoo.com/israel-warns-russia-against-giving-syria-missiles-132538404.html,,tmost337,1369750562,11092,3581,,,ObjectID(51cd411d44a454f89900048a),0
7963,7963,rawstory.com,,worldnews,,,,,1c4tjy,False,"Two Norwegian teens return $81,500 found in bag on a train left by elderly passenger",,2801,,False,False,,t5_2qh13,False,,,13774,False,False,/r/worldnews/comments/1c4tjy/two_norwegian_teens_return_81500_found_in_bag_on/,t3_1c4tjy,1365691438,http://www.rawstory.com/rs/2013/04/11/norwegian-teens-return-81500-found-in-bag-on-a-train-left-by-elderly-passenger/,,maxwellhill,1365687838,16575,2423,,,ObjectID(51cd411d44a454f89900048c),0
