,Unnamed: 0,domain,banned_by,subreddit,selftext_html,selftext,likes,link_flair_text,id,clicked,title,media,score,approved_by,over_18,hidden,thumbnail,subreddit_id,edited,link_flair_css_class,author_flair_css_class,downs,saved,is_self,permalink,name,created,url,author_flair_text,author,created_utc,ups,num_comments,num_reports,distinguished,_id,__v
64,64,reuters.com,,worldnews,,,,,1fwhkx,False,"""What we have... is... concrete proof of U.S.-based... companies participating with the NSA in wholesale surveillance on us, the rest of the world, the non-American, you and me,"" Mikko Hypponen, chief research officer at Finnish software security firm F-Secure.",,7901,,False,False,,t5_2qh13,False,,,17228,False,False,/r/worldnews/comments/1fwhkx/what_we_have_is_concrete_proof_of_usbased/,t3_1fwhkx,1370658722,http://www.reuters.com/article/2013/06/07/europe-surveillance-prism-idUSL5N0EJ3G520130607,,dantesinfer,1370655122,25129,2832,,,ObjectID(51cd3dcc771f93c199000041),0
81,81,michaelgeist.ca,,worldnews,,,,,13xwk6,False,"Canada creates $5,000 cap on liability for file sharing lawsuits",,7447,,False,False,,t5_2qh13,False,,,20539,False,False,/r/worldnews/comments/13xwk6/canada_creates_5000_cap_on_liability_for_file/,t3_13xwk6,1354122879,http://www.michaelgeist.ca/content/view/6710/125/,,mepper,1354122879,27986,1761,,,ObjectID(51cd3dcc771f93c199000052),0
333,333,csmonitor.com,,worldnews,,,,,1015r4,False,"Russia has just declassified news that will shake world gem markets to their core: the discovery of a vast new diamond field containing ""trillions of carats,"" enough to supply global markets for another 3,000 years.",,5249,,False,False,,t5_2qh13,False,,,22867,False,False,/r/worldnews/comments/1015r4/russia_has_just_declassified_news_that_will_shake/,t3_1015r4,1347907306,http://www.csmonitor.com/World/Global-News/2012/0917/Russia-reveals-shiny-state-secret-It-s-awash-in-diamonds,,qgyh2,1347903706,28116,3215,,,ObjectID(51cd3ddc771f93c19900014e),0
406,406,aljazeera.com,,worldnews,,,,,1ggkce,False,Julian Assange was willing to go to Sweden to answer allegations. All he wanted was a guarantee he wouldn't be handed over to the United States. Sweden refused.,,5018,,False,False,,t5_2qh13,False,,,13535,False,False,/r/worldnews/comments/1ggkce/julian_assange_was_willing_to_go_to_sweden_to/,t3_1ggkce,1371402925,http://www.aljazeera.com/programmes/listeningpost/2013/06/2013614145837882956.html,,umium,1371399325,18553,2046,,,ObjectID(51cd3de0771f93c199000197),0
493,493,csmonitor.com,,worldnews,,,,,1byje4,False,Ontario is putting an end to coal-burning power plants: '...on the verge of becoming the first industrial region in North America to eliminate all coal-fired electrical generation.',,4813,,False,False,,t5_2qh13,False,,,5060,False,False,/r/worldnews/comments/1byje4/ontario_is_putting_an_end_to_coalburning_power/,t3_1byje4,1365473955,http://www.csmonitor.com/World/Making-a-difference/Change-Agent/2013/0403/How-Ontario-is-putting-an-end-to-coal-burning-power-plants?nav=88-csm_category-storyList,,maxwellhill,1365470355,9873,815,,,ObjectID(51cd3de0771f93c1990001ee),0
546,546,news.nationalpost.com,,worldnews,,,,,17zuse,False,"Canada officially eliminates the penny, 35 billion pennies (82M kg/ 180M pounds) will be collected and melted down. Transactions will be rounded to the nearest $0.05",,4694,,False,False,,t5_2qh13,False,,,26737,False,False,/r/worldnews/comments/17zuse/canada_officially_eliminates_the_penny_35_billion/,t3_17zuse,1360153917,http://news.nationalpost.com/2013/02/04/canadian-penny-last-day/,,310_nightstalkers,1360153917,31431,3726,,,ObjectID(51cd3de5771f93c199000223),0
602,602,guardian.co.uk,,worldnews,,,,,1fzrp5,False,Edward Snowden: the whistleblower behind revelations of NSA surveillance,,4573,,False,False,,t5_2qh13,False,,,31475,False,False,/r/worldnews/comments/1fzrp5/edward_snowden_the_whistleblower_behind/,t3_1fzrp5,1370806222,http://www.guardian.co.uk/world/2013/jun/09/edward-snowden-nsa-whistleblower-surveillance,,systemstheorist,1370802622,36048,4013,,,ObjectID(51cd3f2be2ad3adb99000003),0
682,682,reuters.com,,worldnews,,,,,1fl25g,False,Turks are closing their bank accounts and withdrawing their money from banks owned by the mainstream media bosses which blacked out mass protests against the government. Garanti Bank lost 13% of its share price.,,4449,,False,False,,t5_2qh13,False,,,32885,False,False,/r/worldnews/comments/1fl25g/turks_are_closing_their_bank_accounts_and/,t3_1fl25g,1370276367,http://www.reuters.com/finance/stocks/overview?&amp;symbol=GARAN.IS,,skylorelding,1370272767,37334,2599,,,ObjectID(51cd3f2be2ad3adb99000053),0
691,691,news.sky.com,,worldnews,,,,,15j8y6,False,"A 17-year-old Indian girl who was gang-raped killed herself after police pressured her to drop the case and marry one of her attackers, police and a relative said on Thursday.",,4445,,False,False,,t5_2qh13,False,,,12663,False,False,/r/worldnews/comments/15j8y6/a_17yearold_indian_girl_who_was_gangraped_killed/,t3_15j8y6,1356639504,http://news.sky.com/story/1030759/gang-raped-indian-teenager-kills-herself,,newsboyron,1356639504,17108,1890,,,ObjectID(51cd3f2be2ad3adb9900005c),0
802,802,eff.org,,worldnews,,,,,1fulg4,False,EFF has so much evidence of the NSA surveillance now that they've created a timeline,,4295,,False,False,,t5_2qh13,False,,,14446,False,False,/r/worldnews/comments/1fulg4/eff_has_so_much_evidence_of_the_nsa_surveillance/,t3_1fulg4,1370593502,https://www.eff.org/nsa-spying/timeline,,whitefangs,1370589902,18741,2259,,,ObjectID(51cd3f35e2ad3adb990000cb),0
806,806,dailymail.co.uk,,worldnews,,,,,13tb8e,False,"Having survived two assassination attempts, Mexican mayor beaten to death",,4287,,False,False,,t5_2qh13,False,,,24155,False,False,/r/worldnews/comments/13tb8e/having_survived_two_assassination_attempts/,t3_13tb8e,1353941820,http://www.dailymail.co.uk/news/article-2238577/Maria-Santos-Gorrostieta-executed-surviving-assassination-attempts.html,,noorits,1353941820,28442,4700,,,ObjectID(51cd3f35e2ad3adb990000cf),0
857,857,translate.google.com,,worldnews,,,,,1fjyaj,False,"Human rights activist Ethem Sarısülük was shot in the head and killed by the police during the protests in the capital Ankara. Confirmed by multiple witnesses, footage available. Turkish media ignoring the story.",,4227,,False,False,,t5_2qh13,False,,,17108,False,False,/r/worldnews/comments/1fjyaj/human_rights_activist_ethem_sarısülük_was_shot_in/,t3_1fjyaj,1370227447,http://translate.google.com/translate?sl=auto&amp;tl=en&amp;js=n&amp;prev=_t&amp;hl=en&amp;ie=UTF-8&amp;eotf=1&amp;u=http%3A%2F%2Fwww.birgun.net%2Factuels_index.php%3Fnews_code%3D1370162821%26year%3D2013%26month%3D06%26day%3D02&amp;act=url,,obdurak,1370223847,21335,1052,,,ObjectID(51cd3f35e2ad3adb99000102),0
945,945,breakingnews.com,,worldnews,,,,,nhzyw,False,North Korea Leader Kim-Jong Il has died,,4132,,False,False,,t5_2qh13,False,,,42229,False,False,/r/worldnews/comments/nhzyw/north_korea_leader_kimjong_il_has_died/,t3_nhzyw,1324264098,http://www.breakingnews.com/,,Merytz,1324264098,46361,6385,,,ObjectID(51cd3f3ae2ad3adb9900015a),0
949,949,finance.yahoo.com,,worldnews,,,,,1h11pq,False,Leaked e-mails reveal that Standard and Poors and Moodys accepted money for higher ratings before the financial crisis.,,4129,,False,False,,t5_2qh13,False,,,14887,False,False,/r/worldnews/comments/1h11pq/leaked_emails_reveal_that_standard_and_poors_and/,t3_1h11pq,1372181730,http://finance.yahoo.com/news/the-last-mystery-of-the-financial-crisis-154447818.html?page=all,,MeyerLink,1372152930,19016,969,,,ObjectID(51cd3f3ae2ad3adb9900015e),0
951,951,guardian.co.uk,,worldnews,,,,,14u2fs,False,Internet remains unregulated after UN treaty blocked,,4127,,False,False,,t5_2qh13,False,,,13404,False,False,/r/worldnews/comments/14u2fs/internet_remains_unregulated_after_un_treaty/,t3_14u2fs,1355473593,http://www.guardian.co.uk/technology/2012/dec/14/telecoms-treaty-internet-unregulated,,heisakukosawa,1355473593,17531,952,,,ObjectID(51cd3f3ae2ad3adb99000160),0
1025,1025,bbc.co.uk,,worldnews,,,,,19qf6v,False,Venezuela's Hugo Chavez dead at 58,,4067,,False,False,,t5_2qh13,False,,,33639,False,False,/r/worldnews/comments/19qf6v/venezuelas_hugo_chavez_dead_at_58/,t3_19qf6v,1362521035,http://www.bbc.co.uk/news/world-latin-america-21679053,,al19,1362521035,37706,5085,,,ObjectID(51cd3f75607d46e39900001a),0
1067,1067,news.com.au,,worldnews,,,,,13xoz4,False,"Girl, 8, to get vaccination shots after court overrules mum (xpost from /r/NewsOfTheWeird)",,4044,,False,False,,t5_2qh13,False,,,3539,False,False,/r/worldnews/comments/13xoz4/girl_8_to_get_vaccination_shots_after_court/,t3_13xoz4,1354115387,http://www.news.com.au/lifestyle/parenting/girl-8-to-get-vaccination-shots-after-court-overrules-mum/story-fnet08ui-1226526103657,,Nickster79,1354115387,7583,2469,,,ObjectID(51cd3f75607d46e399000044),0
1069,1069,translate.google.be,,worldnews,,,,,15kfrs,False,"Belgium prosecutes Scientology as a criminal organisation. Charges are: extortion, fraud, privacy breaches and practice of illegal medicine.",,4045,,False,False,,t5_2qh13,False,,,16869,False,False,/r/worldnews/comments/15kfrs/belgium_prosecutes_scientology_as_a_criminal/,t3_15kfrs,1356688470,http://translate.google.be/translate?hl=en&amp;sl=nl&amp;u=http://www.hln.be/hln/nl/957/Binnenland/article/detail/1554628/2012/12/28/Belgie-vervolgt-scientology.dhtml%3Fshow%3Dreact&amp;prev=/search%3Fq%3Dbelgie%2Bvervolgt%2Bscientology%26hl%3Den%26safe%3Doff%26client%3Dsafari%26tbo%3Dd%26rls%3Den&amp;sa=X&amp;ei=WGrdUOm_B4yRhQeO2IDwBA&amp;ved=0CD8Q7gEwAg,,Crembo,1356688470,20914,1098,,,ObjectID(51cd3f75607d46e399000046),0
1074,1074,aje.me,,worldnews,,,,,10cjdj,False,"After 11 years in Guantanamo, a man who was never charged with any crime, and was recommended twice for release has been found dead.",,4039,,False,False,,t5_2qh13,False,,,19372,False,False,/r/worldnews/comments/10cjdj/after_11_years_in_guantanamo_a_man_who_was_never/,t3_10cjdj,1348424299,http://aje.me/QMX6s8,,underwaterthoughts,1348420699,23411,3345,,,ObjectID(51cd3f75607d46e39900004b),0
1086,1086,youtube.com,,worldnews,,,,,1dpez6,False,"A huge explosion has hit Damascus, the capital of Syria. This is video footage of it (0.20). More in the comments.","{ ""type"" : ""youtube.com"", ""oembed"" : { ""author_url"" : ""http://www.youtube.com/user/momo1984momo1"", ""thumbnail_height"" : 360, ""type"" : ""video"", ""thumbnail_url"" : ""http://i3.ytimg.com/vi/f_j8ID-m1pU/hqdefault.jpg"", ""provider_name"" : ""YouTube"", ""version"" : ""1.0"", ""thumbnail_width"" : 480, ""html"" : ""&lt;iframe width=\""600\"" height=\""338\"" src=\""http://www.youtube.com/embed/f_j8ID-m1pU?feature=oembed\"" frameborder=\""0\"" allowfullscreen&gt;&lt;/iframe&gt;"", ""width"" : 600, ""height"" : 338, ""author_name"" : ""momo1984momo1"", ""url"" : ""http://www.youtube.com/watch?v=f_j8ID-m1pU"", ""title"" : ""قدسيا 5-5-2013 قصف مجهول المصدر على جبال قاسيون"", ""description"" : ""Uploaded by momo1984momo1 on 2013-05-04."", ""provider_url"" : ""http://www.youtube.com/"" } }",4030,,False,False,,t5_2qh13,False,,,28635,False,False,/r/worldnews/comments/1dpez6/a_huge_explosion_has_hit_damascus_the_capital_of/,t3_1dpez6,1367715795,http://www.youtube.com/watch?v=f_j8ID-m1pU,,DonCaliente,1367712195,32665,6400,,,ObjectID(51cd3f75607d46e399000057),0
1147,1147,cbc.ca,,worldnews,,,,,11q7yq,False,"Boeing 777 Air Canada passenger flight drops to 
3,700 to help locate a yacht in distress off 
Australian coast. Passengers spot yacht, sailor 
rescued.",,3991,,False,False,,t5_2qh13,False,,,14566,False,False,/r/worldnews/comments/11q7yq/boeing_777_air_canada_passenger_flight_drops_to/,t3_11q7yq,1350619211,http://www.cbc.ca/news/world/story/2012/10/16/air-canada-australia-rescue-sailor.html,,marcussantiago,1350615611,18557,1159,,,ObjectID(51cd3f7a607d46e399000094),0
1238,1238,politico.com,,worldnews,,,,,1fvckv,False,"Glenn Greenwald, journalist who broke the PRISM story: U.S. wants to destroy privacy worldwide",,3931,,False,False,,t5_2qh13,False,,,8555,False,False,/r/worldnews/comments/1fvckv/glenn_greenwald_journalist_who_broke_the_prism/,t3_1fvckv,1370626554,http://www.politico.com/story/2013/06/glenn-greenwald-us-privacy-92400.html?hp=l1,,RoswellSpaceman,1370622954,12486,1496,,,ObjectID(51cd3f7f607d46e3990000ef),0
1311,1311,translate.google.com,,worldnews,,,,,iwsj7,False,Huge explosion in downtown Oslo,,3884,,False,False,,t5_2qh13,False,,,11469,False,False,/r/worldnews/comments/iwsj7/huge_explosion_in_downtown_oslo/,t3_iwsj7,1311345499,http://translate.google.com/translate?js=n&amp;prev=_t&amp;hl=en&amp;ie=UTF-8&amp;layout=2&amp;eotf=1&amp;sl=no&amp;tl=en&amp;u=http%3A%2F%2Fwww.dagbladet.no%2F2011%2F07%2F22%2Fnyheter%2Finnenriks%2Feksplosjon%2F17411344%2F,,Nico_,1311341899,15353,4929,,,ObjectID(51cd3f84607d46e399000138),0
1356,1356,dailytech.com,,worldnews,,,,,wvmi4,False,"Lenovo CEO distributes his $3 Million USD Bonus to his 10,000 Employees ",,3862,,False,False,,t5_2qh13,False,,,27848,False,False,/r/worldnews/comments/wvmi4/lenovo_ceo_distributes_his_3_million_usd_bonus_to/,t3_wvmi4,1342803109,http://www.dailytech.com/Lenovo+CEO+Gives+Part+of+His+3+Million+USD+Bonus+to+10000+Employees/article25227.htm,,Ktvone,1342799509,31710,2175,,,ObjectID(51cd3f84607d46e399000165),0
1375,1375,guardian.co.uk,,worldnews,,,,,19li0v,False,US doctors cure child born with HIV,,3855,,False,False,,t5_2qh13,False,,,38512,False,False,/r/worldnews/comments/19li0v/us_doctors_cure_child_born_with_hiv/,t3_19li0v,1362346504,http://www.guardian.co.uk/society/2013/mar/03/us-doctors-cure-child-born-hiv,,twolf1,1362346504,42367,1811,,,ObjectID(51cd3f84607d46e399000178),0
1390,1390,guardian.co.uk,,worldnews,,,,,xr1dl,False,NASA's Curiosity rover has successfully landed on Mars! The first pictures are expected shortly. (Guardian liveblog),,3849,,False,False,,t5_2qh13,False,,,26813,False,False,/r/worldnews/comments/xr1dl/nasas_curiosity_rover_has_successfully_landed_on/,t3_xr1dl,1344234747,http://www.guardian.co.uk/science/blog/2012/aug/06/curiosity-rover-mars-landing-live-blog,,e1000,1344231147,30662,1653,,,ObjectID(51cd3f84607d46e399000187),0
1409,1409,bbc.co.uk,,worldnews,,,,,18nsqc,False,"Suspects in sex cases should have their identities protected until they are convicted, a senior lawyer has said",,3834,,False,False,,t5_2qh13,False,,,15155,False,False,/r/worldnews/comments/18nsqc/suspects_in_sex_cases_should_have_their/,t3_18nsqc,1361055076,http://www.bbc.co.uk/news/uk-21487266,,odetocapitalism,1361055076,18989,1822,,,ObjectID(51cd3f88607d46e39900019a),0
1447,1447,copaemcuiaba.com.br,,worldnews,,,,,1gjckc,False,Protesters in Brasil: World Cup website hacked to show the world what's happening in Brazil right now.,,3820,,False,False,,t5_2qh13,False,,,18770,False,False,/r/worldnews/comments/1gjckc/protesters_in_brasil_world_cup_website_hacked_to/,t3_1gjckc,1371528520,http://copaemcuiaba.com.br/,,brewno,1371499720,22590,2183,,,ObjectID(51cd3f88607d46e3990001c0),0
1474,1474,hosted.ap.org,,worldnews,,,,,ko5d0,False,Scientists claim to have broken the absolute speed barrier - particles travelling faster than the speed of light.,,3799,,False,False,,t5_2qh13,False,,,27300,False,False,/r/worldnews/comments/ko5d0/scientists_claim_to_have_broken_the_absolute/,t3_ko5d0,1316718958,http://hosted.ap.org/dynamic/stories/E/EU_BREAKING_LIGHT_SPEED?SITE=AP&amp;SECTION=HOME&amp;TEMPLATE=DEFAULT,,walrusbukit,1316715358,31099,4138,,,ObjectID(51cd3f88607d46e3990001db),0
1494,1494,nwww.koreaherald.com,,worldnews,,,,,1a47di,False,"N. Korea ready to “fight a real war” with the U.S, its media report. ",,3791,,False,False,,t5_2qh13,False,,,3851,False,False,/r/worldnews/comments/1a47di/n_korea_ready_to_fight_a_real_war_with_the_us_its/,t3_1a47di,1363051728,http://nwww.koreaherald.com/view.php?ud=20130310000009,,flamingeyebrows,1363048128,7642,2637,,,ObjectID(51cd3f88607d46e3990001ef),0
1512,1512,miamiherald.com,,worldnews,,,,,11gjz9,False,Thousands rally for Pakistani girl shot by Taliban - ISLAMABAD -- Tens of thousands have rallied in Pakistan's largest city in support of a 14-year-old girl shot and critically wounded by the Taliban for promoting girls' education and criticizing the militant group.,,3775,,False,False,,t5_2qh13,False,,,15752,False,False,/r/worldnews/comments/11gjz9/thousands_rally_for_pakistani_girl_shot_by/,t3_11gjz9,1350225417,http://www.miamiherald.com/2012/10/14/3049471/thousands-rally-for-pakistani.html,,daviddesousa,1350221817,19527,981,,,ObjectID(51cd3f8e607d46e399000201),0
1563,1563,telegraph.co.uk,,worldnews,,,,,14mkuz,False,Calls for a ban on helium balloons as world shortage worsens.  ,,3757,,False,False,,t5_2qh13,False,,,19588,False,False,/r/worldnews/comments/14mkuz/calls_for_a_ban_on_helium_balloons_as_world/,t3_14mkuz,1355176302,http://www.telegraph.co.uk/science/science-news/9732883/Ban-helium-balloons-this-Christmas-academic-warns.html,,stupendousdragon,1355176302,23345,2676,,,ObjectID(51cd3f8e607d46e399000234),0
1621,1621,nasa.gov,,worldnews,,,,,1eaf7m,False,"Astronauts Chris Hadfield, Tom Marshburn, and Roman Romanenko have just touched down in Kazakhstan after 146 days in the International Space Station during Expedition 35.",,3726,,False,False,,t5_2qh13,False,,,20453,False,False,/r/worldnews/comments/1eaf7m/astronauts_chris_hadfield_tom_marshburn_and_roman/,t3_1eaf7m,1368502324,http://www.nasa.gov/multimedia/nasatv/ustream.html,,synrgi,1368498724,24179,1038,,,ObjectID(51cd3f93607d46e39900026e),0
1632,1632,guardian.co.uk,,worldnews,,,,,1g4c5a,False,"NSA surveillance: The US is behaving like China ""Both governments think they are doing what is best for the state and people. But, as I know, such abuse of power can ruin lives"" By Ai Weiwei",,3723,,False,False,,t5_2qh13,False,,,19885,False,False,/r/worldnews/comments/1g4c5a/nsa_surveillance_the_us_is_behaving_like_china/,t3_1g4c5a,1370962196,http://www.guardian.co.uk/commentisfree/2013/jun/11/nsa-surveillance-us-behaving-like-china,,Libertatea,1370958596,23608,977,,,ObjectID(51cd3f93607d46e399000279),0
1669,1669,forbes.com,,worldnews,,,,,1g0j7y,False,Icelandic Legislator: I'm Ready To Help NSA Whistleblower Edward Snowden Seek Asylum,,3704,,False,False,,t5_2qh13,False,,,11349,False,False,/r/worldnews/comments/1g0j7y/icelandic_legislator_im_ready_to_help_nsa/,t3_1g0j7y,1370829158,http://www.forbes.com/sites/andygreenberg/2013/06/09/icelandic-legislator-im-ready-to-help-nsa-whistleblower-seek-asylum/,,i_like_alpacas,1370825558,15053,1351,,,ObjectID(51cd3f93607d46e39900029e),0
1682,1682,blogs.estadao.com.br,,worldnews,,,,,1gjpf2,False,"Brazil is under Siege: Protest in all Major Cities. Rio 100 thousands, Sao Paulo, 65 thousands. Brasilia, Capital: Congress was invaded.",,3708,,False,False,,t5_2qh13,False,,,14304,False,False,/r/worldnews/comments/1gjpf2/brazil_is_under_siege_protest_in_all_major_cities/,t3_1gjpf2,1371537776,http://blogs.estadao.com.br/estadao-urgente/manifestantes-fazem-quinto-ato-contra-o-aumento-da-tarifa-de-onibus-em-sao-paulo/,,tspegiorin,1371508976,18012,1919,,,ObjectID(51cd3f93607d46e3990002ab),0
1687,1687,newsday.com,,worldnews,,,,,1h4w9x,False,"Ecuador president blasts coverage of Snowden case: ""They've managed to focus attention on Snowden and on the 'wicked' countries that 'support' him, making us forget the terrible things against the U.S. people and the whole world that he denounced.""",,3702,,False,False,,t5_2qh13,False,,,21793,False,False,/r/worldnews/comments/1h4w9x/ecuador_president_blasts_coverage_of_snowden_case/,t3_1h4w9x,1372310893,http://www.newsday.com/news/world/ecuador-president-blasts-coverage-of-snowden-case-1.5574121,,parthsavi,1372282093,25495,1616,,,ObjectID(51cd3f93607d46e3990002b0),0
1722,1722,telegraph.co.uk,,worldnews,,,,,19bicj,False,Chinese environmentalist beaten after calling on official to swim in polluted creek,,3680,,False,False,,t5_2qh13,False,,,14584,False,False,/r/worldnews/comments/19bicj/chinese_environmentalist_beaten_after_calling_on/,t3_19bicj,1361957413,http://www.telegraph.co.uk/news/worldnews/asia/china/9896761/Chinese-environmentalist-beaten-after-calling-on-official-to-swim-in-polluted-creek.html,,whackk,1361957413,18264,1197,,,ObjectID(51cd3f98607d46e3990002d3),0
1757,1757,guardian.co.uk,,worldnews,,,,,1gswc8,False,"British spy agency has secret access to the world's Facebook posts, phone calls, emails and internet history",,3672,,False,False,,t5_2qh13,False,,,13500,False,False,/r/worldnews/comments/1gswc8/british_spy_agency_has_secret_access_to_the/,t3_1gswc8,1371861203,http://www.guardian.co.uk/uk/2013/jun/21/gchq-cables-secret-world-communications-nsa?CMP=twt_gu,,samvimesmusic,1371832403,17172,1636,,,ObjectID(51cd3f98607d46e3990002f6),0
1780,1780,nytimes.com,,worldnews,,,,,12pi7i,False,Harassers of women in Cairo now face wrath of vigilantes. 'More and more groups are emerging to make protecting women — and shaming the do-nothing police — a cause',,3667,,False,False,,t5_2qh13,False,,,9927,False,False,/r/worldnews/comments/12pi7i/harassers_of_women_in_cairo_now_face_wrath_of/,t3_12pi7i,1352171725,http://www.nytimes.com/2012/11/06/world/middleeast/egyptian-vigilantes-crack-down-on-abuse-of-women.html?smid=re-share,,pool92,1352171725,13594,867,,,ObjectID(51cd3f98607d46e39900030d),0
1790,1790,scmp.com,,worldnews,,,,,18qyft,False,"A Chinese entrepreneur is offering a huge reward to a senior official if he swims in a polluted river for 20 minutes, an attempt to draw attention to China's the environmental problems.",,3661,,False,False,,t5_2qh13,False,,,17903,False,False,/r/worldnews/comments/18qyft/a_chinese_entrepreneur_is_offering_a_huge_reward/,t3_18qyft,1361192779,http://www.scmp.com/news/china/article/1153028/chinese-official-offered-huge-reward-if-he-can-swim-polluted-river,,ngamau,1361192779,21564,1100,,,ObjectID(51cd3f98607d46e399000317),0
1804,1804,slate.com,,worldnews,,,,,1g31nk,False,"European member of parliament on PRISM: “We really need to wake up. This is serious stuff. The government knowing everything, literally everything about us, and we are unable to exercise any meaningful democratic scrutiny? That is not a democracy.”",,3655,,False,False,,t5_2qh13,False,,,8984,False,False,/r/worldnews/comments/1g31nk/european_member_of_parliament_on_prism_we_really/,t3_1g31nk,1370914065,http://www.slate.com/blogs/future_tense/2013/06/10/prism_fallout_european_legislators_furious_about_u_s_surveillance.html,,tamsincrav,1370910465,12639,841,,,ObjectID(51cd3f9d607d46e399000325),0
1814,1814,ens-newswire.com,,worldnews,,,,,1er94w,False,India Bans Captive Dolphin Shows as ‘Morally Unacceptable’ - Says they're highly intelligent &amp; should be seen as ‘non-human persons’ with their own specific rights.,,3650,,False,False,,t5_2qh13,False,,,20909,False,False,/r/worldnews/comments/1er94w/india_bans_captive_dolphin_shows_as_morally/,t3_1er94w,1369136425,http://ens-newswire.com/2013/05/20/india-bans-captive-dolphin-shows-as-morally-unacceptable/,,anutensil,1369132825,24559,2557,,,ObjectID(51cd3f9d607d46e39900032f),0
1825,1825,bbc.co.uk,,worldnews,,,,,18axbi,False,"Pope Pope Benedict XVI 'to resign'. The Pope is to resign at the end of this month in an entirely unexpected development, reports from the Vatican say.",,3652,,False,False,,t5_2qh13,False,,,27520,False,False,/r/worldnews/comments/18axbi/pope_pope_benedict_xvi_to_resign_the_pope_is_to/,t3_18axbi,1360580289,http://www.bbc.co.uk/news/world-21411304,,Libertatea,1360580289,31172,5774,,,ObjectID(51cd3f9d607d46e39900033a),0
1866,1866,npr.org,,worldnews,,,,,129s68,False,Sweden Wants Your Trash,,3631,,False,False,,t5_2qh13,False,,,14936,False,False,/r/worldnews/comments/129s68/sweden_wants_your_trash/,t3_129s68,1351516816,http://www.npr.org/blogs/thetwo-way/2012/10/28/163823839/sweden-wants-your-trash,,dvdfreak0301,1351513216,18567,2129,,,ObjectID(51cd3f9d607d46e399000363),0
1943,1943,labs.umbrella.com,,worldnews,,,,,1dvsyg,False,Internet Traffic from Syria Just Disappeared,,3601,,False,False,,t5_2qh13,False,,,16657,False,False,/r/worldnews/comments/1dvsyg/internet_traffic_from_syria_just_disappeared/,t3_1dvsyg,1367960848,http://labs.umbrella.com/2013/05/07/breaking-news-traffic-from-syria-disappears-from-internet/,,jimmyb207,1367957248,20258,2475,,,ObjectID(51cd3fa2607d46e3990003b0),0
1958,1958,qz.com,,worldnews,,,,,1deily,False,China is plundering the planet's seas -- and it's doing it 12.5 times more than it's telling anybody,,3597,,False,False,,t5_2qh13,False,,,14177,False,False,/r/worldnews/comments/1deily/china_is_plundering_the_planets_seas_and_its/,t3_1deily,1367321315,http://qz.com/78803/china-fishing-more-than-its-telling-anybody/,,Bemuzed,1367317715,17774,2569,,,ObjectID(51cd3fa2607d46e3990003bf),0
1959,1959,businessweek.com,,worldnews,,,,,zu37q,False,"U.S. Embassy calls out Muslim Brotherhood over contradiction between the Brotherhood’s Arabic and English Twitter postings.  English feed: ""hope US-Eg relations will sustain turbulence of Tuesday's events."" Arabic feed: “Egyptians revolt for the Prophet’s victory in front of U.S. embassy.”",,3604,,False,False,,t5_2qh13,False,,,9362,False,False,/r/worldnews/comments/zu37q/us_embassy_calls_out_muslim_brotherhood_over/,t3_zu37q,1347565753,http://www.businessweek.com/news/2012-09-13/u-dot-s-dot-embassy-calls-out-muslim-brotherhood-over-twitter,,nowhathappenedwas,1347562153,12966,2235,,,ObjectID(51cd3fa2607d46e3990003c0),0
2013,2013,blogs.wsj.com,,worldnews,,,,,19sw3f,False,Rhino Poachers Shot Dead by Forest Guards in India,,3573,,False,False,,t5_2qh13,False,,,19686,False,False,/r/worldnews/comments/19sw3f/rhino_poachers_shot_dead_by_forest_guards_in_india/,t3_19sw3f,1362607263,http://blogs.wsj.com/indiarealtime/2013/03/06/indian-rhino-poachers-shot-dead/,,destinys_parent,1362607263,23259,2471,,,ObjectID(51cd3fa7607d46e3990003f6),0
